senid,sentence
618565,Ship cho mình 1 cái màu nâu nha
618566,271 trần phú tp pleiku gia lai
618567,0933984007
618568,Nguyễn phương anh
618569,Cho e hỏi mẫu này giá bao nhiêu vậy ạ
618570,Xe 2 chiều pk ạ
618571,Mình chỉnh nằm dc k shop
618572,E ở sg ship b n shop
618573,Co bảo hanh k ạ
618574,Lấy m 1c mẫu xe đó nhé
618575,Cc newcity 17 mai chí thọ phường bình khánh quận 2
618576,0908266009
618577,K co ship cod hả b
618578,Vậy minh cam on shop nhé
618579,M sắp sinh với có bé nhỏ nên ra ngân hàng cũng hơi vất vả
618580,M tưởng có ship cod
618581,Xe đẩy b beko giá bn ạ 
618582,Shop ơi cái này bn ak
618583,Đây nữa ak
618584,Cho mình giá của tủ 5 tầng này vs
618585,Tủ 4 tầng thì bnhieu ạ
618586,1 bộ nguyên có những này ạ
618587,Mình thấy shoppe của shop đang sale đúng k
618588,Tủ nhựa 5 tầng trắng n u mua thì về tự nắp ạ
618589,Hay vận chuyển cả tủ th ahop
618590,Shoppe món đấy có miễn phí vận chuyển k nhỉ
618591,M muốn mua tủ 5 tầng đấy
618592,Th mua luôn từ shop có ship cod k ạ
618593,Về shop báo mình với nhé
618594,Kệ 5 tầng về chưa ạ
618595,Shop cho e xin giá máy này vs ạ
618596,Shop ơi gh này nặng bnhieu kg ạ
618597,Có dễ mang lại di chuyển k ạ
618598,Kiểu cho lên ô tô mang đi ấy
618599,Shop ship tỉnh k ạ
618600,Hay ship nội thành Hnoi thôi
618601,Th ship Hnoi có nhận k ạ
618602,Hay phải đ n cửa hàng ạ
618603,Thu tiền tại nhà ạ
618604,Cho m xin giá bình này vs ạ
618605,Vs cả giờ ra t t shop ship tỉnh chưa ạ
618606,M muốn mua gh ăn dặm
618607,Shop báo giá mình vs
618608,Xanh mint là màu ntn ạ
618609,Newber k dc kmai ạ
618610,Mastela vs newber hãng nào hơn ạ
618611,Shop tư vân sm nhé
618612,Mai nhà m có ng ở hnoi về
618613,Ng mhaf m mang về luôn
618614,N u ship tỉnh thì shop gửi xe hay cpn ạ
618615,Cpn gh to chắc nặng
618616,Shop ship về nhà c mình ở Văn Quán Hà Đông
618617,M ck shop nhé
618618,Thôi m ck bạn giao hàng là dc
618619,M lấy newber
618620,Mai shop ship về nhà c gái cho k
618621,15 âm c mìn về Quảng Ninh
618622,Mang về cho m
618623,1540
618624,Địa chỉ giao hàng là chung cư newskyline Văn Quán Hà Đông sdt 0988151618
618625,Ngày kia hãy giao nhé
618626,Ôi m quên mất
618627,B cứ để gh ở shop đi
618628,Nhà ac m đi lễ
618629,K có nhad
618630,Sáng nay mới bảo 
618631,Shop ship ra xe cho mình dc k
618632,Xe khách ấy ạ
618633,Caia gh ăn ấy
618634,M ck r mà
618635,B đọc lại tnhan vs ạ
618636,Vẫn gửi gh ở shop mà
618637,Ck cả cước ship r
618638,0964240240
618639,À tưd từ
618640,Caia đấy có to k banh
618641,To quá xe limousine k chở dc
618642,Thì phải chở qua mỹ đình
618643,Để m xin số nhà xe nào thuận tiện r báo shop
618644,À máy pha sữa bnhieu vậy shop ơi
618645,Tiny ấy ạ
618646,Ủa htrc m hỏi shop có hơn 2t6 j đấy n u k lấy nôi mà
618647,Ôi th ạ Ti c quá
618648,M muốn mua 1 cái
618649,0972111112 đây là số xe về Vân Đồn Quảng Ninh shop gọi xe ở đâu xe qua lấy đồ cho shop nhé Hỏi trc cước xe giùm mình nhé
618650,Bộ này bnhieu shop ơi
618651,Gửi về Vân Đồn b nhé
618652,201 khu 5 thị trấn Cái Rồng huyện Vân Đồn
618653,Sđt 0978588234
618654,Vậy à m có mấy nhà xe nữa nhưng toàn phải ra b n
618655,B xem có chỗ nào đón gần cho shop thì hẹn nhà xe giúp m vs
618656,Hday mình cungz ck 40k cước ship nữa mà
618657,Cước phí của chậm vt là bnhieu ạ
618658,Ôi đắt th á
618659,Thôi shop cứ ship về đi
618660,Đằng nào cũng mua r
618661,Chuyêbr khoản đi chuyển lại lgi
618662,Năm mới
618663,Th có xe ngoài Mỹ Đình
618664,Sdt 0971885567
618665,Xe Hùng Đức
618666,Shop gửi cho m chưa ạ
618667,M nhận dc gh r nhé
618668,Hx 350k tiền cước
618669,Máy pha sữa đợt này giá tnao shop ơi
618670,Giường này bnhieu th shop ơi
618671,Có kèm đệm k ạ
618672,E ck shop ship cái này về cho e nhé
618673,Shop ship về 201 khu 5 thị trấn Cái Rồng huyện Vân Đồn tỉnh Quảng Ninh
618674,Lục Thanh Hà 0978588234
618675,m muốn mua 3 món này
618676,shop ship về cho m nhé
618677,cái thảm kia ship có nặng k ạ
618678,Vs e muốn mua 2 thanh chắn giường nữa
618679,Shop rep ib giùm e caia
618680,Đệm 14 có nắp dc k ạ
618681,m muốn mua 1 thảm 1 gặm nướu 1 thanh chắn m8 1 thanh 2m
618682,Lục Thanh Hà 201 khu 5 thị trấn Cái Rồng huyện Vân Đồn tỉnh Quảng Ninh
618683,sdt 0978588234
618684,đồ này có nặng k b
618685,htruoc b gửi xe cước mất 350k r
618686,hỏi trc giùm m dc k
618687,ck trc hay nhận hàng thanh toán ạ
618688,b thử tính cước xem gửi nhanh thì h t bn ạ
618689,khoảng 3 4 trăm ạ
618690,B gửi nhà xe cho m M chịu cước cũng dc Nhưng bạn hỏi cước trc cho m nhé
618691,À hình như shoppe có vận chuyển
618692,Hay e đawtj qua shoppe
618693,Vâng ạ M cảm oen nha
618694,C ơi cái thanh chắn giường ấy chỉ dùng dc cho đệm bằng giường à
618695,Đệm cao hơn giường k luồn dc caia thanh giữ ạ
618696,K dc b ạ Vì m còn caia gờ giường
618697,Đoạn này gờ cao nthe thig k vào dc ạ
618698,Th độ cao của nó đâu đủ an toàn
618699,Xong r phải khoan vào giường ạ
618700,Phải khoan vita vào giường ạ
618701,Doctor Dolphin giá bnhieu th shop ơi
618702,m mua 1 cái nhé
618703,đợi xem còn đồ gì chọn shoip ship cả thể
618704,hany còn đồ gì sale k shop
618705,Kệ này sz gì th shop
618706,bn th shop ơi
618707,shop ship cho mình bể bơi đ n Văn Quán Hà Đông nha
618708,chung cư newskyline Văn Quán Hà Đông
618709,sdt 0988151618
618710,b đã đi đơn hàng của mình chưa
618711,n u chwua thì lấy cho mình thêm hộp chia thức ăn nuk với nhé
618712,shop ơi bể bơi còn k shop
618713,m kload dc ảnh
618714,b xem lại tnhan của mình ấy
618715,loại m mua r ấy
618716,Cho m xin giá bộ này bs
618717,K mua cầu trượt xích đu vs ngựa thì sao ạ
618718,có loại nào bán quây riêng k ạ
618719,xe nặng bn kg ạ
618720,Ko lấy đai đc ko shop
618721,Ko đai thì vậy đúng ko
618722,Xe ko đai như hình đúng ko ạ
618723,Ship có nguyên chi c ko hay fai tự lắp
618724,Cho minh 1 xe nhé
618725,Hàng chính hãng dai ko nhie
618726,Ship SG nhé
618727,Tầm bh nhận đc hàng hả shop
618728,Shop ơi ck sao nhie
618729,Shop rao cho mình ở hanoi luôn nhé
618730,Số 14 ngõ 67 64 thái thịnh đống đa hanoi
618731,C Minh nhận hàng nhé
618732,0913030360
618733,Rao vào buổi sáng hoặc chiều 3h
618734,Tránh giờ trưa gọi ko ai nghe máy
618735,Lây đai luôn
618736,Có mau xanh ko
618737,Minh xem hinh ở ngoài đc ko ạ
618738,Xe này có nặng k
618739,Bé 3 tuổi cao 95 cm có phù hợp k
618740,Mình muốn lấy xe hồng
618741,Ship đ n udic complex hoàng đạo thu cầu giấy
618742,Sau 5h nha
618743,0915575407
618744,Th mang mình màu đỏ nhé
618745,Nãy cho con chọn màu
618746,Giờ nó đòi quá
618747,De minh goi lai
618748,Sorry đang bận e bé chút
618749,Bộ này bn báo giá giúp mình nhé
618750,Voi umoo bao nhiêu ạ
618751,Shop còn gối th này k ạ
618752,Có mấy mẫu chống trào ạ shop
618753,Còn caia này thì bnhieu ak
618754,Dạ vậy còn gối chống bẹp đầu là bnhieeu ạ và phí ship là bnhieu ạ
618755,Về cao bằng ạ
618756,Shop cho m hỏi là có đặt cái gối chống bẹp lên cái chống trào dc k ạ
618757,Caia chống trào đó có cao quá k ạ E sợ về bé nhà e k chịu nằm ạ
618758,Vâng vậy c cho e cái chống trào đó ạ
618759,Nó có tác dụng chống bẹp k c
618760,Cái như này ấy c
618761,Cái này thì đặt cái chống bẹp lên trên phải k ạ
618762,Vậy cho e cái goiis chống trào với cái gối choings bẹp nhé
618763,Huy diệu shop mậu dịch quảng uyên huyện quảng uyên tỉnh cao bằng 0385659105
618764,Tổng của e bnhieu ạ
618765,mùng quây nệm giá ntn v shop
618766,nệm nằm và 4 quây xung quanh để trong cũi cho bé
618767,Còn bình tiệt trùng sấy khô fazt ko shop 
618768,Mình đã đặt 1 bình tiệt trùng sấy khô fazt qua shopee
618769,Shope check giúp m
618770,Mình đặt 1c máy này màu hồng nữa nhé Gửi link shopee giúp m
618771,Shop ơi m đặt đơn này từ mấy hôm rồi mà chưa thấy giao hàng lấy hàng
618772,Còn hàng ko vậy ạ 
618773,B ơi ben b có gối chống trào ngược k
618774,Cho mjh xin ảnh sp dc k ạ
618775,Mjh tìm trong album k có
618776,Shop ơi máy hút sữa medela like new bên mình giá ntn Máy năm bao nhiu ạ
618777,Máy bộ 2590k là sx năm bao nhiu b
618778,B ơi b có mẫu xe đẩy vovo cho trẻ k
618779,Vovo loại 2 chiều
618780,B cho mình xem mẫu đc k
618781,Th k còn màu hồng à b
618782,Th shop mình ở đâu nhỉ
618783,B có ship hàng k
618784,Mình ở hà nam b ạ
618785,Là mình gửi trước cho b 50 xong khi nào nhận hàng mình mới gửi nốt à b
618786,Th mình chuyển trước 500k có đc k b
618787,Xe na y nă ng bnhiu ky vâ y 
618788,Mi nh ship vê tphcm bnhiu vâ y shop 
618789,Shop vui lòng tư vấn cho mình vài mẫu xe tập đi để mình chọn nhe 
618790,Tư vấn cho mình xe tập đi nha 
618791,Shop gửi hình và tư vấn cho mình chọn luôn nha 
618792,Ok shop mình đặt 1 cái Mastela màu trắng nha 
618793,FB Hàng Vũ 0939107910 Địa chỉ 128 Hai Bà Trưng phường Thắng Lợi tp Buôn Ma Thuột Dak Lak
618794,Mình đặt ở đây luôn dc ko 
618795,Ok để mình xem 
618796,Cho e xin đi a chi cư a ha ng mi nh vơ i ah
618797,Vag e ca m ơn
618798,Gh aqn dặm mastela bao tiền ạ
618799,Hàng chính hãng có giấy tờ j k ạ
618800,Ship về nhân hoà hà nội thì có mất phí ship nhiều k ạ 
618801,Đoàn tàu toyhouse bao tiền ạ
618802,Có cần đặt qua shopee k ạ
618803,Ship qua 33 nhân hoà có mất ship k ạ
618804,Hnay hạn cuối mua bộ đồ chơi này giá 150k fai k ạ
618805,Đặt qua shopee có mất phí ship k ạ
618806,Đặt shopee mình sợ k kịp thứ 5 nhận hàng Nên mai bạn ship cho mình qua địa chỉ 33 nhân hoà ạ 
618807,Sđt 0989841323
618808,Bạn chưa ship bộ tàu hoả cho mình à
618809,T nhận rồi ạ
618810,Shop bán bình avent 240ml k ạ
618811,Cho mình hỏi địu comfy giá bao nhiêu ai
618812,Màu ghi k dc giảm giá à bạn
618813,Mai ship cho mình 1 địu màu cát cháy đ n 69 vũ trọng phụng Sđt 0961388686 ạ
618814,Gọi điện trước khi ship bạn nhé Vì chồng mình đi làm K bi t lúc nào có ở nhà
618815,Mình lấy màu cát cháy ạ
618816,Mình chuyển khoản trc cho
618817,Ship trong hnay sớm giúp mình ạ
618818,Cho mình 2 xe màu tím Ship sáng mai dc k ạ Mình muốn cho bé lên phố đi bộ chơi
618819,69 vũ trọng phụng 0972346336
618820,Mà mua 2 chi c có dc freeship k ạ N u k để mình đặt qua shoppe ạ
618821,Mua qua shopee dc freeship k bạn 
618822,Mai giao gh cho mình nhé
618823,Mấy jo bên bạn giao cho mình ạ
618824,Vâng Mình gọi rồi ạ
618825,Cho mình hỏi chút Gh joovy mình mua cho bé
618826,Mà dây đai an toàn ở phần hông
618827,Vậy bé nhoài người ra thì sao ạ 
618828,Mình thấy có 2 lỗ phía trên Nhưng phần đệm lại k có lỗ để luôn dây đai qua
618829,Ý là bé ngồi có sợ bị nhoài người ra rồi ngã k ạ
618830,Mình còn box này k ạ
618831,Mình vào shopee đặt có dc free ship k ạ
618832,Gối chữ C bên mình có hình rõ k ah
618833,Có đai thắt an toàn cho bé k ạ
618834,Bé e chưa bi t ngồi
618835,K bi t có chèn cho ngồi dc k nhỉ
618836,Bé nhà mình quậy lắm
618837,Sợ nó k chịu ngồi cho
618838,Cho mình đặt mua gh ăn dặm này nhé
618839,Trc mình có mua hàng ở shop rồi đó
618840,Sao ở trên này giá 1 342k luôn hả shop
618841,quây giường cho bé
618842,giá bn shop ơi
618843,2 cái này giá bn shop ơi
618844,Gh nhún bao nhiêu a
618845,Mình muốn mua con khỉ
618846,Bạn ơi con này bao nhiêu
618847,Ship hàng miễn phí Hà nội ko
618848,Nhiều thể
618849,May Hom moi toi ha noi
618850,Con o phu tho lau hơn a
618851,Chị định mua gh cao cho bé ăn dặm
618852,E tư vấn chị với
618853,Chị thích shop mình
618854,Mua sẽ nhiều đồ lắm
618855,Nhà chị có 3 nhocs
618856,Mua hàng nhiều có dc Ck ko
618857,Gh cao bạn a
618858,Xin lỗi bạn mình hỏi chút mình tham khảo giá thấy chỗ bạn bán hơi cao
618859,Giảm chút đi con mình nhỏ mình sẽ mua rất nhiều
618860,Con khỉ khoảng 130k
618861,Free ship ha Nội thi tot
618862,Co gh Graco ko
618863,Bao nhiêu hàng cũng vậy à
618864,Gửi gh này về phú thọ mất ship ko
618865,Trên shopee là 1299
618866,Ko thay shopee co cái bát mới nhỉ
618867,Shop ơi thảm này kích thước bnhieu và giá bnhieu vậy shop 
618868,Mẫu này có những màu nào vậy
618869,Oh mình gọi ko thấy bên bạn nhấc máy
618870,Mình lấy bộ này có Ship luôn ko bạn
618871,82 cù chính lan Khương mai thanh xuân
618872,Bộ y hình nhé
618873,Ngựa xanh đi
618874,Phi Ship cao vậy ak
618875,Mình xem ngựa hồng với
618876,Thấy trên ảnh chỉ có ngựa xanh
618877,Ok Bạn Ship luôn bộ như hình cho minh nhé
618878,01667 303 459
618879,Có 1 chị ti t lệch bạn ơi
618880,Alo mình điều chỉnh được rồi
618881,Để bạn ấy bớt xem tivi điện thoại Bạn ấy khá là thích 
618882,Bạn ơi mẫu này bn vậy
618883,Mình 1 cái màu xanh với
618884,Chiều bên bạn ship được ko 
618885,Đi chơi đi
618886,Sorry Mình nhắn nhầm
618887,Bạn ơi tớ 1 cái nhé
618888,097 109 7586 Địa chỉ cũ nhé
618889,Bạn ơi xe này có mấy màu ạ
618890,Cho mình 1c đ n 82 cù chính lan nhé
618891,Ship luôn được ko bạn
618892,097 109 7586 094 302 7586 
618893,Gọi cho m trước khi ship nhé Mình sợ ra ngoài ko ơ nhà lại mất công bạn ship
618894,Giờ bạn ship đồ mình được ko Sợ tối mình cho bé đi chơi
618895,Bạn ơi còn xe này ko vậy 
618896,Tớ thêm 1c với
618897,Tra loi giúp mình nhé
618898,Ok bạn Địa chỉ như cũ nhé
618899,Gọi cho tớ trước khi ship nhé
618900,Giá máy fa sua tiny bnh vay ad 
618901,Sữa aptamil úc có fa dc ko ạ
618902,1muong bôt sua voi 50ml nước
618903,Ship sg bnh ạ
618904,Mua shopee phí ship rẻ hơn ko ạ
618905,Shop chac chan pha dc sữa minh noi nhe
618906,Mua ve pha ko dc chêt lun ạ
618907,Anh đức công thưc fa giong sua mỹ
618908,Sua úc ct no lạ
618909,Nen minh hơi sợ
618910,Vay shop ship dùm Minh
618911,Cod hay ck vay ạ
618912,40 độ ạ
618913,Nhu sữa mỹ
618914,Shop ship cho m nhe
618915,Đau jo chieu m ck nhe
618916,Ch xong m ib cho s
618917,M ch 3050k hay 3100k vay s
618918,M ck cho shop roi
618919,Nd nguyen như 0908452242 máy tiny Agribank
618920,20 nghĩa thục p5 q5 0908452242
618921,Sao m ko dc freeship nhỉ
618922,Shop oi sao m chua nhan dc máy
618923,Mấy ngay mới nhan dc vay ạ
618924,Shop cho m hoi CON là j ạ
618925,Hay shop co link hdsd tieng viet ko ạ
618926,Cho minh xin
618927,M add roi đay ạ
618928,M Lm sai cho nao
618929,Ma no chi ra nc
618930,Ko ra sữa
618931,M bấm mấy lần
618932,No cug toan ra nc
618933,Mà minh thay cái cây đảo sữa bột no ko quay
618934,M đổi sữa cho bé
618935,Sữa nay nồng độ bnh vay ạ 
618936,Cho mình hỏi bình ủ sữa bên mình bán bn ạ 
618937,Tủ trắng đựng quần áo bên mình có bán k ạ
618938,Tủ h t rồi ạ
618939,Gửi cho e túi ủ sữa nhé
618940,Ship về Vũ Thị Kha quán gỏi hưng thịnh bình giang hải dương dt 0344668318 e nhé
618941,Đậy ạ
618942,K cod ạ
618943,Tại e k có thời gian đi ck
618944,Shop cho tớ xin báo giá của máy với ạ
618945,Cho mình xin giá với ak
618946,Cho tớ xin giá 2 đồ chơi này voeis ah
618947,Bạn ship giúp mình mẫu trên về đc
618948,Số 16 ngõ 282 thuỵ khuê
618949,Sđt 0396 990 900
618950,Đang có ct fs đúng ko bạn
618951,Shop còn màu này k ạ
618952,H t thảm rồi hả shop
618953,cho m hỏi đai tập đi bn tiền ah
618954,mẫu này bn vay shop
618955,Có ship xa đc ko ạ
618956,Mình ở Cần Thơ
618957,Để m hỏi ba bé xem nhe hihi
618958,Ơ 1xxx cơ ma
618959,Alo Shop
618960,Mấy món này còn ko 
618961,Em lấy 2 món này nha
618962,Cái này 2 chi c
618963,Cái này 1
618964,Lên tổng đơn em ck luôn nhé
618965,Đủ đai bảo vệ
618966,2 cái màu xanh
618967,Và 1 cái hộp bên trên
618968,Bên bạn ship giúp mình ra nhà xe Tâm Đạt Sdt 097 7460567 B n nước ngầm Giờ xuất b n 1h chiều nhé
618969,Tổng đơn luôn
618970,Bên bạn ship giúp mình ra nhà xe Tâm Đạt Sdt 097 7460567 B n nước ngầm Giờ xuất b n 1h chiều nhé Người nhận chị Thu Sdt 0983 888 449 Địa chỉ Nghi Phương
618971,Xe này bé mấy tháng thì dùng đc ah
618972,Bên bạn gửi chư
618973,Vì 1h xe chạy rồi bạn ơi
618974,Kẻo lỡ việc mình
618975,Vậy mấy h thì giao đc
618976,7h tối nay mình phải gửi cho kịp xe đi SG rồi
618977,Mà chỉ có xe đó là về kịp
618978,Bên bạn làm hay vậy khách hàng note lại cũng như ko
618979,Để sát giờ mình hỏi rồi lại báo như th 
618980,Mới đặt nhưng bên bạn ok rồi mình mới thanh toán
618981,N u ko thì mình đã ko đặt
618982,Ko phải chuyện tiền nong
618983,Mà là lỡ việc của mình
618984,Giờ mình tìm đâu ra hàng mà đặt nữa hả bạn
618985,Nên bạn giúp mình vụ này sớm sớm chuta nha
618986,Xe đó nó dê dịch về 1h30 chiều thì kịp ko
618987,13h30 ấy
618988,Vì giờ đó là giờ chậm nhất xe còn ở b n
618989,Bên bạn chủ động liên hệ nhà xe nha
618990,Thôi đàng nào cũng lỡ việc rồi
618991,Bên bạn gửi xe Văn Minh về giúp mình njes
618992,Người nhận anh Lập Sdt 0962 880888 Địa chỉ Diễn Kỷ
618993,Gửi luôn giúp mình nha
618994,Bên bạn gửi chưa ạ
618995,Cho mình xin mã vận đơn với
618996,Đóng kiện gửi thì có cồng kềnh ko bạn 
618997,Mình muốn bên bạn gửi ra văn phòng nhà xe Văn Minh ở 172 Trần Bình thì có dc ko 
618998,Nt từ qua giờ mà ko thấy rep
618999,Ok nhưng bạn cho mình hỏi là có cồng kềnh ko 
619000,Bạn tới một trong những địa chỉ sau
619001,Người nhận Anh Lập Sdt 0962 880888 Địa chỉ Diễn Kỷ Bạn tới đó ghi như vậy là đc
619002,Chị ơi cái trà lợi sữa sử dụng ntn hả c
619003,E mới đẻ xog nhưng ít sữa quá dùng cái này có cải thiện đc ko c
619004,Vâng th c ship cho e 2 hộp e dùng thử nhé
619005,Địa chỉ 15 ngách 10 ngõ Mai Hương Bạch Mai Hai Bà Trưng
619006,Sđt 0945743993 e tên Huyền
619007,Vâng e ít sữa nên đang lo quá
619008,Vâng e cám ơn c
619009,Chị ơi gối sợi tre Comfy Baby của nhà mình giá bao nhiêu ạ
619010,Kích thước ntn ạ 
619011,Bộ này bn vậy shop Địa chỉ shop ở đâu vậy ạ 
619012,Chị ơi e qua shop lấy có đc ko ạ Khoảng chiều tối t7 e lấy set màu hồng
619013,B ơi cai nay bao nhiêu b
619014,Màu xanh tim than dúng ko 
619015,Th tầm bao giờ có hangd b 
619016,Địu vêg rôi hả b 
619017,Co màu xanh tim than ko b 
619018,Để c mình địu cho dễ
619019,Cho minh hoi môt tí hơi khác nhau về giá tiền cai nao tôt minh dung cho con thôi cai mới nay có oki ko bạn
619020,Th thôi mịn đo cai kia về vâyh
619021, khi nao về bạn pm cho minh được ko
619022,B ơi t xin giá bộ này với
619023,Ib e giá 2 mẫu này Sh ạ
619024,Sản phẩm nào mh để luôn ở trên giường đc ạ
619025,Mh đang quan tâm hai mẫu trên Sh ạ mh muốn bt là mẫu trên mh có thể để ở trên giường nằm của mh đc k ạ
619026,Mẫu này hả Sh
619027,Mh chọn mẫu này ạ
619028,Dành cho bé máy tháng tuổi th ạ
619029,Sh còn những màu nào ạ
619030,Tổng Bill mh Bn ạ
619031,Để mh Ck cho b
619032,Giữ hàng hộ mh
619033,T2 mh mới Ck cho b đc
619034,Nằm tối đa bao nhiêu kg vay shop
619035,M ở biên hòa muốn mua thi sao b
619036,B hô dum m cuoc bao nhieu nhe
619037,Tai m thich qua
619038,Vay de mai m hoi xem đc ko roi bao b nhe
619039,Cho m giá 2 cái này nha
619040,M ở biên hoà có ship đc xe chòi chân ko b
619041,Gửi xe vậy khoảng mấy ngày m nhận đc b
619042,Ng ta giao lại tới nhà cho m luôn phải ko
619043,M lấy 1 xe chồi thôi b
619044,Mà ng ta giao luôn tới nhà phải ko
619045,Ok vậy m chỉ chuyển tiện xe cho b thôi còn tiền ship lúc đó giao cho ng ta hay sao
619046,Ok vậy để t2 m ck cho b nha
619047,Set này coa những màu j
619048,Mà shop coa shoppe j
619049,Ủa sao thía
619050,To th á
619051,Th bên bạn có ship toies tận nhà
619052,Vs lắp ráp lun hẻm b
619053,Hà nội cầu vĩnh tuy
619054,Th mua về r tự lần sao
619055,Có bản hướng dẫn cụ tỉ k shop
619056,Nhìn tg khó 
619057,Coa những màu j th b
619058,Set 7 món ship tới vĩnh tuy bn vậy shop
619059,Set 6 là k có ngựa hả
619060,Qua lễ là thứ mấy 
619061,Khoảng thời gian nào cho mình sắp x p
619062,Khi nào về hangd
619063,Minhd lất set 7
619064,Mình cg về quê
619065,T3 mới lên HN coe
619066,Cứ về báo mình
619067,Thật ra đang máu mua
619068,Th mà k có
619069,K bt tới tuần sau sao
619070,Cứ về hàng báo mình nhé
619071,Xanh ghi nhé
619072,Mai ship nhea
619073,0934412316 194 trần quang khải nhé
619074,Chiều cAo sao ạ
619075,Bé 17m dùng đc chân chòi chuea
619076,Có khung k ạ
619077,Màu đen nhea shop
619078,Sảnh B Cc udic riverside 1 Số 122 vĩnh tuy hbt hà nội
619079,Cho mình xin tk mình ck nhé
619080,Tính cả ship giúp mình
619081,0934412316
619082,Vẫn số đấy ah
619083,Chờ mình tầm 10min nữa mình ck nhé
619084,Tầm mấy h bạn
619085,Oiie
619086,đây c ạ
619087,Cái này có ship ko ạ
619088,Vâng gửi giúp e về địa chỉ khu hudB trầu cau thành phố bắc ninh ạ
619089,Sđt 0972192081 ạ
619090,Sh mình có xe đẩy du lịch loại nhẹ ko ạ
619091,Ko ah bé 17 kg ạ
619092,Lưới loại này có chắc chắn ko c 
619093,Cho bé đ n mấy kg c
619094,Đi du lịch có vác lên đk ko
619095,Th e ở nghệ an
619096,Ship thì khi nào đ n c
619097,Ship văn minh giúp e
619098,Cho e cái màu xanh nhé c
619099,xe đấy bn tiền b 
619100,Mình vừa ck cho b xong
619101,580k pk b
619102,Nhờ b gửi qa xe văn minh giúp monhf
619103,Trần Hà Trang sđt 01276316666 đ c sn 38 đg Đào duy từ tp vinh nghệ an
619104,Ko thì mình qua chỗ văn phòng văn minh lấy cũng đk b
619105,B ơi khi nào thì mình nhận đk b 
619106,Máy này bn vậy ah 
619107,Ben minh co tang cuc sac du phong
619108,Za binh sua co sac
619109,Co tinh tien ship hok
619110,La sao hok hieu
619111,O tphcm bao nhieu ah
619112,Duoi 100 la bao nhieu ah
619113,De bit
619114,3 9 thanh thai p14 q10 tphcm
619115,Dung oy ah
619116,J trong tuan nay giao cho e dc hok
619117,Khoang t6 co hang hok ah
619118,La lay tien truoc moi giao hang hả
619119,Gio di lam hok co ra dc
619120,Shopee cung bang gia cua minh hả
619121,Có ship sóc sơn k shop
619122,Vậy ạ làm ntn
619123,Còn mẫu này ko sh ơi
619124,Ship hcm ko ạ
619125,Cho e xem mẫu nhé
619126,Nhựa j vậy shop
619127,Nhìn có vẻ cứng quá ngồi ê mông ko sh
619128,Munhf ko có chi nhánh SG ạ
619129,Mún tới xem bánh lướt êm ko
619130,Xe này giá th nào shop
619131,chậu tắm đứng bên bạn còn ko
619132,giá bnhiu vạy
619133,đây nhed
619134,bạn oei
619135,Nhung gia hoi cao
619136,Minh muon mua tam 1tr thoi
619137,bạn ơi bên mình con máy hút mũi comfybaby k ạ
619138,Cảm ơn bạn có gì mình ib ạ
619139,Shop có cốc tập uống của richell và cốc nấu cháo ko ạ Báo giá giúp m vs
619140,Vali nay bao nhieu ban 
619141,Khay tru dong nay shop co ko a
619142,Cho m 1 be boi 1 coc tap uong va 1 khay tru dong b nhe
619143,Shipcode ha b 
619144,Co dc freeship ko b 
619145,B gui m so tk
619146,Sau bao lau co hang b 
619147,Hang loi co dc doi ko a
619148,Ok b Tong het bao nhieu b oi
619149,B ơi mình gửi tiền hôm nọ rùi đấy B gửi hàng cho m chưa Khi nào m nhận đc vậy
619150,Mình gửi rùi b nhé B ktra lại đi
619151,B gửi hàng sớm cho m nhé Khoảng ngày nào m nhận đc hàng vậy b
619152,Ơ sao lâu vậy Nhà m ở HD thôi mà B có sẵn hàng ở nhà ko
619153,Ok Vậy chiều b gửi luôn giúp m nhé 
619154,0394863456
619155,Dia chi cua m Pham Thi Bich Diep 0394863456 So 8 khu 19 TT Lai Cach Cam Giang Hai Duong
619156,Số 8 khu 19 TT Lai Cách Cẩm Giàng Hải Dương
619157,1 be boi 1 coc tap uong va 1 khay tru dong b nhe
619158,Mình gửi đủ tiền hàng rồi nhé Khi nào nhận hàng mình trả tiền ship là xong nhé
