senid,sentence
725863,N u đc cho e đặt cái máy học ti ng anh thông minh
725864,Mình ở hạ long ạ
725865,Shop ơi e đặt bình đun nc giữ nhiệt qua shoope mà chưa thấy shop chuyển
725866,Nhanh giúp e đc ko e đag cần
725867,Mình thấy đơn hàng trên shoppe hủy
725868,Vậy mình hủy đơn luôn nhé
725869,Vậy n u bạn chưa giao thì cho mình hủy
725870,Shop cho mình đặt sp này
725871,Ban cho mình hỏi thêm sản phẩm có cắm điện trực ti p đc ko hay phải cắm qua cục sạc
725872,Ok cho mình stk nhé
725873,Địa chỉ giao hàng của mình là Nguyễn Thu Hà số nhà 46 tổ 5 khu 7 Bãi Cháy Hạ Long Quảng Ninh sdt 0977977186
725874,Shop tư vấn cho mình loại ba lo bỉm sữa với con mình ko ti mẹ mỗi lần ra ngoài rất lích kích phải mang sữa rồi nước đi pha có loại nào tiện dùng ko ạ k t hợp giữ nhiệt càng tốt ạ
725875,Máy chạy bằng pin ạ
725876,Cho mình xin giá cả máy tạo ẩm với
725877,Cho mình 1 balo kidsapro nhé
725878,Ship mình Nguyễn Thu Hà số nhà 46 tổ 5 khu 7 Bãi Cháy Hạ Long Quảng Ninh sdt 0977977186
725879,Của mình bao nhiêu tiền để mình ck ah
725880,Shop cho mình đăt 1 nhiệt ẩm k nhé
725881,Vẫn tk cũ ah mình chuyển 390k đúng ko ah
725882,Bên mình còn máy học ti ng anh winfun ko ah
725883,Voi ú óa giá bn ạ
725884,M mún mua 1 xe đẩy kiêm xe đạp dream với 1 g đa năg mastela b gửi b n mĩ đình về phú thọ cho m đc ko
725885,M cho bạn thôg tin xe b gửi xe đó giúp m vì xe về đ n nhà m 
725886,Xe đẩy m lấy xanh
725887,B gửi m màu của xe mastela
725888,Clip của bạn có mỗi màu hi
725889,Cho m cái hình ở giữa nha
725890,Cộg với xe đẩy kiêm đạp màu xanh nhé
725891,Tổg của m là bn b 
725892,1250 là xe ăn đó ah b 
725893,Để m bắn tiền xog m bảo b cách chuyển nhé
725894,Cũi này bn b 
725895,Trẻ 1 tuổi vịn đứg có bị đổ ko
725896,Oki de m xem mua ko m chuyển tiền lun
725897,Gửi m màu cũi với
725898,M vừa tìm lại chả thấy dau
725899,Cho m đặt cái xe đẩy màu xanh với cũi màu xah nha
725900,Huỷ g ăn b nha
725901,H m chuyển khoản
725902,Oki m chuyển bjo lun
725903,Của m 2 thứ đó bn b 
725904,M vừa xem lại
725905,Xe đây là 949
725906,Cũi la 749 mà
725907,Xe đẩy kiêm đạp
725908,M lấy 2 thứ deu màu xanh nhé
725909,M chuyển 1698 ah
725910,Thêm 30k ship nữa đúg ko
725911,Ko b ak
725912,B ra b n mĩ đình gửi đồ giúp m nhé
725913,Gửi xe qen nhà m
725914,Ở trên m bảo các bạn ok r mà
725915,M lấy xe này với cũi này đều màu xah nhé
725916,Oki h m ck 
725917,Số nhà xe 10 chuy n mỗi chuy n 1 số m ko có
725918,B gửi đồ cho m chưa ak
725919,Ok b xog nhớ nhắn giúp m sdt xe nha 
725920,Ah b oi m đc tặg 100 bóg ko
725921,Oki xe vừa gọi m r Thaks b nhé 
725922,M lại lấy thêm g ăn
725923,H b gửi trog hnay giúp m ko
725924,M lấy cái ở giữa
725925,H m chuyển tiền cho b nhé
725926,B gi đc gửi giúp m Mai phương thị xã phú thọ 0981919828 B ra b n mĩ đình gửi xe Thuỷ Chính màu tím hồng giúp m nhé Hầu như giờ nào cũg có sẵn xe trong b n xog lấy giúp m sdt xe đó nhé Đừg gửi xe khác nhé m mua đồ nhìu r họ gửi xe khác m phải đi mấy chục cây mới lấy đc vì nhữg xe đó gi tx phú thọ nhưg lại ko vào tx Lưu giúp m nhé 
725927,Lần trc b gửi đúg xe m nhận hàg dễ b ak Hnay b bảo ngta gửi giúp m nthe nhé
725928,Th gửi m mẫu này cũg dc
725929,Oki b gửi cho m nha vì 5h 5 rưỡi là chuy n cuối r
725930,B oi b gưi giúp m chưa cho m sdt xe để m gọi
725931,B oi hnay b gửi xe nào nhớ nt số xe cho m nhé
725932,G ăn đẹp mà chắc chắn b ak 
725933,Gửi b feedback
725934,Có xe tròn tập đi của bé 6 7m ko b 
725935,Gui m xem hình vs b
725936,3 loại này thì h bạn còn của tomorow thui ak
725937,Vì trc bạn m mua của b york baby nhìn xinh lâm
725938,So vs tomo thì cái nào đẹp hơn b
725939,Chất liệu nhựa b
725940,Khug nâg cao thấp có như nhau ko b Ko sợ bé ko tới chân 
725941,Oki th m đặt qa shoppe nhed
725942,B oi tomorow sky 2019 còn màu trắg đen ko
725943,Khug như này còn trắg đen ko
725944,Còn xanh hồg thoi ah b
725945,Dạ em chào Shop
725946,Bn máy hút mũi ạ
725947,Cho em đặt cái hút múi
725948,Máy medela
725949,Mình k rõ loại nào tốt
725950,Mình sinh e bé dc 4 hôm
725951,Nhưng ngực to
725952,E bé khó ti quá
725953,Ngực lại cương cứng khó chịu
725954,Có mấy loại hả b
725955,Và loại nào bền và tốt nhâdt
725956,Giữa swing và pump thì swing hơn đúng k bạn
725957,Ghị ơi
725958,E mua 1 con thú nhún
725959,Coa dc giảm giá k ạ
725960,Bnhiu lit ha ship
725961,Lam lamh den bnhiu độ
725962,Ah m hoi chut
725963,Xe vovvo hai chieu nha b
725964,Giá bmhiu ak
725965,Co bảo hành k an
725966,M ở đoạn trần khát chân
725967,Bên b có free ship k
725968,Hay mất phí tn
725969,Tân tứ leien
725970,La đi qua sen r dung k b
725971,Ben b ship bnhieu
725972,Che độ bảo hành ntn ha b
725973,Neu ma hỏng hóc
725974,La mang qua shop b a
725975,Hay ntn 
725976,Cty o đâu ha b
725977,1 đổi 1 trong bao lâu ha b
725978,Ma hỏng hóc thì m phải đem qua shop b
725979,Hay la ntn
725980,Chu shop b xa qua
725981,Có ở gần sen hồ tây k ạ
725982,Nhỡ có lỗi j
725983,The néu h ma mua thì có thẻ bảo hành đấy ạ Mih cu g tìm hiểu r
725984,Tai cung hay di chuyển nên mới địh mua dòng nay
725985,Sr b tai m k qua shop xem xe dc
725986,Nên la cứ đắn do
725987,Mih lai hay phải vận chuyển đi lại nhiều
725988,Tìm xe nao nó nhẹ
725989,Vừa b bé vừa kéo xe dc ấy
725990,Hihi the lại đắt quá
725991,Vovoo 2 chieu co nặng lắm k ha b
725992,Như nhau het ha b
725993,The b lắp sẵn giup m dx k Mih mua màu đen Vovo 2 chiều ấyo
725994,Bọn vovohai chieu có nối dài chân k nhie 
725995,The ve m tự lắp có khó k nhi
725996,Tai có mỗi hai mẹ con 
725997,Caia hộp to k b
725998,Gui m xem hih dc k
725999,N u ma k b cu lắp sẵn giup m cung dc
726000,Có túi đựng la đc
726001,M tuong dang đc tặng chi u với hộc sữa j đó
726002,Hộc sữa la cái j
726003,The chiều b ship gium m den so 18325 trần khat chân dc k
726004,Số 18 ngõ 325
726005,Neu matuwj lắp dễ thi m tự lắp vay
726006,B gui m ca thẻ bảo hành
726007,Lấy m màu đen
726008,M có xem ảnh
726009,Sh b chup day a
726010,0971808692 nha b
726011,B co video hd lăp xe k
726012,Đây la hd su dung
726013,Lắp xe i
726014,Luc mua thi nó đã sẵn tn rui ha b
726015,Nhu video hdan day a
726016,Ma family shop voi bên b la 1 a
726017,Ok b the b ship giup m vay
726018,Momg la au kê
726019,Vag ok b
726020,Cai nay b a
726021,Sh có ship hnay k ạ
726022,Hay la mai
726023,Trông hịn
726024,Nhưng ma cái bánh
726025,Nó bị móp qua
726026,Hai chỗ lien
726027,B xem co đổi dc k nhe
726028,Cho m xin giá cái gh ăn avicare với
726029,Phần vải của gh có tháo ra giặt được k bạn 
726030,Báo giá giúp m cả mẫu này nhé
726031,Ship đ n Linh Đàm phí bnhiu bạn 
726032,Mà n u có link shopee thì cho m
726033,Xem giúp m đã đặt qua shopee thành công chưa với
726034,M lỡ tay thoát ra mất rồi
726035,Loan nguyễn bạn ạ
726036,Tớ đăng nhập bằng số đt mà
726037,0989410885
726038,tớ k dùng quen shopee
726039,Hux
726040,Bongxu85 bạn ạ
726041,Đúng đúng
726042,Cho m đổi sang màu be cho sạch đc hok 
726043,Sợ màu xanh sáng dễ bẩn
726044,Lấy thêm cho m cái đai để hút sữa rảnh tay í
726045,Có mấy chục k thoai đúng k bạn 
726046,Với lại bên bạn có bộ phụ kiện máy medela pump in style advanced k 
726047,Dây tubing phễu và cổ phễu í
726048,Giá bao nhiu bạn 
726049,Tớ cũng k bitd
726050,Mua máy về có sẵn rồi
726051,Mình nói ở trên rùi mà
726052,Pump in style advanced
726053,Th ship cho tớ 2 hàng kia trc nhé
726054,J bạn 
726055,Th ship gh k thôi cũng đc
726056,Bên mình có cửa hàng ko nhỉ Mình muốn qua xem hàng
726057,trời ơi vừa đ n tận nơi mua về thì trên shopee shop bán thảm rẻ hơn 50k lại còn miễn phí ship
726058,shop hỏi giúp khi nào có hàng kệ đồ chơi sz M nhé
726059,mình vừa đ n trưa nay nè
726060,vừa vác bộ thảm về xong
726061,ko vì mình định đ n bên bạn lấy mấy thứ luôn mà
726062,mình muốn mua cái kệ đựng đồ chơi sz M
726063,nhưng hôm nay ra ngoài cửa hàng thì hình như h t chỉ còn sz S
726064,có về thêm ko hả shop 
726065,vì mình sợ sz S hơi bé
726066,cho mình xin lại kích thước và giá của kệ sz S nhé
726067,th kệ này mình đặt qua shopee hay là th nào ạ 
726068,đặt qua shopee có được freeship ko ạ 
726069,nhà mình ở xa
726070,ở Lê trọng tấn hà nội
726071,qua shopee có đc freeship ko ạ 
726072,th thôi bên bạn giao cho mình cũng đc
726073,nhưng có đc tặng kèm cái j ko ạ 
726074,nãy qua cửa hàng nhân viên bên shop nói là có quà n u mua trên 700k
726075,vậy shop giao cho mình đ n số 16 ngõ 176 ngách 10 lê trọng tấn thanh xuân hà nôi nhé
726076,sđt 0916649981
726077,à có màu j nhỉ 
726078,có màu hồng ko ạ 
726079,bạn ơi bên bạn còn thảm xpe cuộn ko 
726080,Thảm gấp với thảm cuộn có dày như nhau ko ak 
726081,Giá thảm cuộn bao nhiêu ạ 
726082,Chất lượng có tốt ko ạ 
726083,Rẻ hơn thảm kia nhỉ 
726084,Sao bạn vừa bảo cuộn và gấp dày như nhau 
726085,Thảm silicon giá bao nhiêu ạ 
726086,Xe tập đi new york baby bao nhiu ạ 
726087,Phí ship đồng nai bao nhiu ạ 
726088,Cho em đặt 1 thanh này 2m 1 thanh 1m8 với ạ
726089,04 ng sỹ sách
726090,Vinh nghệ an
726091,Lê anh tuấn
726092,0987158234
726093,Ship bn tiền vậy sh
726094,Mẫu này bnhiu v shop
726095,B co bán thảm xốp xpe k ạ
726096,Báo gia cho m với
726097,Ship khoang bnhiu v b
726098,15e khóm tân bình P an hoà Tp sa đéc tỉnh đồng tháp
726099,B xem thử gium m ship khoảng bnhiu ạ
726100,cho mình hỏi bên b có bán dây hơi thay trong máy hút sữa Philips ko b 
726101,uh b check và báo jup mình với
726102,b check jup mình chưa b 
726103,có ko b 
726104,giường cho bé đ n mấy tuổi ạ
726105,Rẻ nhỉ
726106,Cho m xin giá set 7 món nhé 
726107,Và vì m đã mua thảm của shop rồi thì với kích cỡ đấy thì có vừa với quây ko 
726108,Quây toy có cỡ vừa thảm silicon Hàn Quốc ko ạh Và là cỡ bn Cho m xin giá luôn
726109,Uke M cũng muốn mua thêm gh oto cho bé nữa Để m xem trên hình xog đặt ship hoặc qua shop
726110,Cho m xin giá thanh chắn cửa nối 15cm nhé
726111,Ship cho mình đ n số 59 ngõ 117 18 Nguyễn Sơn nhé 0932385855
726112,Ùh 1 thanh chính và thanh nối 12 nhé
726113,Ùh Quan trọng nhất đấy
726114,Cầu thang nhà mình rộng 97 thì sẽ mua th nào 
726115,Thêm 1 thanh 12 sợ thi u ko nhỉ 
726116,Để m đo lại xem
726117,Chắc cho mình 2 thanh 12 đi vậy
726118,Thừa còn hơn thi u
726119,He he vừa xinh lun nhé 
726120,Alo Có gh ngồi oto nào đc sale ngày này ko shop 
726121,Tư vấn cho m cái nào tầm 2 triệu đc ko 
726122,Có loại cho bé từ ít tháng hơn k ạh 
726123,Vì e muốn dùng cho cả bé sau nữa 
726124,Tầm từ 7 tháng í
726125,E hỏi chút loại đấy với loại này thì cái nào hợp lí hơn ạh 
726126,C thấy loại nào các mẹ hay mua hơn í 
726127,Th thôi ship mình cái kia nhé
726128,Dễ lắp đặt ko ạh 
726129,Uke Có 2 màu nhỉ 
726130,Màu đen b nhé 
726131,E nhờ shop pass hộ đồ mua của shop đc ko ạh Gh ngồi oto e mua chưa dùng lần nào nhưng đã bỏ hộp rồi
726132,Đậy ạh 
726133,Sđt 0932385855 ạh
726134,Tí ship mình 1 kệ bồn cầu cho bé và 1 bộ x p tháp cốc đồ chơi nhé
726135,Vậy thôi mình cám ơn
726136,Máy ag life giờ bn xèng b ơi 
726137,Mai ship mình cái màu hồng nhé
726138,E hỏi giá cái giường hola nhé 
726139,E ko thấy ghi chịu lực bn kg ạh
726140,Sh ơi máy pha sửa giá bán bao nhiêu vậy
726141,Bên m có đổ buôn kệ k ah
726142,Cho mình hỏi vô lăng này có sẵn k ạ
726143,Gắn vào gh sau có dc k
726144,Vàng đen thì bh về ạ
726145,gửi giúp mình cách tháo đoàn tàu để thay pin với ạ
726146,dạ cảm ơn
726147,dạ không mở được ad ơi
726148,dạ vẫn ko được để mình thử lại xem sao ạ
726149,dạ em tháo đưuọc rồi tks ad
726150,Shop ơi báo giá cho m 2 cái này nhé
726151,Shop có xe đẩy k ak 
726152,E đnag tham khảo
726153,Chưa bi t lấy loại nào
726154,Xe này và xe vovo 2 chiều
726155,Thì câi nào thích hơn ak
726156,Vovo 2 chiều là bnhieu ak
726157,Th còn xe beko ak
726158,Xe vovo là chuẩn giá ak
726159,N u lấy đc miễn ship k ak
726160,Vậy có những màu gì ka
726161,Shop ib e giá tủ này nhé
726162,balo chong lac cho be con ko b
726163,Ok m cam ơn shop
726164,Cái như hình
726165,Th 5in1 là set nào
726166,Cho e xin giá quây và gh nhún với ạ
726167,Có quây 1m5*2m k cậu
726168,Giá bnh vậy
726169,N u mua cả quây set 5min cả jum giá bnh vậy
726170,Size xxl giá bnh vậy
726171,Bạn ơi Bên bạn bán máy xay hấp pải k b
726172,Hàng xách tay hay công ty cậy
726173,Philips event 4in1 ạ
726174,Ok b Giá bnh vậy
726175,Có sẵn k bạn
726176,Ship nghệ an bnh vậy b
726177,Mai mình ck bạn Bạn ship cho mình nha
726178,Balo này bên mình bán bnh ạ
726179,E nói nè
726180,Tí e đi gửi tiền cho shop
726181,Shop gửi hàng qua xe khách cho e dc k ạ
726182,Vì e cần gấp để đi đà nẵng vào ngày mai 
726183,Cho e xin sdt
726184,Ck xong e gọi ạ
726185,Gửi giúp e balo này và máy xay hấp event nha shop
726186,Tổng của e bnh ạ
726187,Cả cốc tập hút richell nữa
726188,4in1 ạ
726189,Sao ở shopee ghi 379 ạ
726190,Máy 4in1 cũng tăng giá rồi hả shop
726191,Bnh vậy
726192,Báo luôn tổng 3 thứ giúp e đi
726193,Cốc tập uống richell ạ
726194,Màu này shop ơi
726195,Tổng của mình 3 cái này
726196,4tr448k
726197,Shop check giúp e e ck luôn giờ
726198,Gửi e stk với
726199,4in1
726200,Có km cho e gì k ạ
726201,C gửi về c hải 0911071545 vp văn minh thị trấn nam đàn huyện nam đàn tỉnh nghệ an 
726202,E gửi vào vietcombank
726203,Nhờ c check giúp e nha
726204,Check giúp e nha
726205,Nhờ shop gửi hàng giúp e với nha
726206,Shop ơi E nhận dc hàng rồi
726207,Balo đẹp thật
726208,Shop có video hướng dẫn sd máy xay hấp cho e xin với
726209,Tối x p đồ rồi e chụp luôn nhé
726210,Shop k đọc tn ạ
726211,Cho mình xem mẫu 1m8 và 2m với b
726212,Mình cần mua
726213,B có ship cod k
726214,Ck rồi gửi hàng hả b
726215,Ship nghệ an bnh b
726216,Cho mình xem mình chọn mẫu
726217,Bể này có size k b
726218,2 tuổi 13kg dùng dc k
726219,Thảm xpe hàn quốc 1m8*2m
726220,Còn mẫu nào bạn
726221,Còn về k
726222,2ghe và 3ghe
726223,Tủ này bnh ạ Còn vàng k shop
726224,Xin giá nôi với ạ
726225,Trọng lượng mấy kg ạ
726226,Bé đ n bn kg ngồi đc an
726227,Shop ơi cho tớ hỏi
726228,Cái thảm này có hình nào khác hok 
726229,Thảm này của hãng gì hả b 
726230,Thank b nhé tớ tham khảo t nhé
726231,Bên shop còn xe tập đi màu này hok
726232,Ship cho tớ đc hok
726233,Ship lun cho t trước 2h đc hok 
726234,T ở 39 hàng than
726235,Tất cả bn xiền hả b
726236,Có cần lắp đặt gì hok b 
726237,Ktra kĩ cho t nhé
726238,Xe h t màu hồng zui ah
726239,Th xe này shop còn hok
726240,B ship cho tớ cái xe màu nâu nhé
726241,T gọi cho shop bên bạn zui đó
726242,Mang sớm nhất cho t nhé
726243,Còn bộ này hok
726244,Ship mình 1 bộ màu hồng
726245,Cái bộ như ảnh hồng tím 
726246,Bộ đầy đủ 5 set bạn nhé
726247,Mix như nào hả b 
726248,Chụp thử 1 bộ mix đc hok
726249,Mình mua cho bé gái nhé
726250,Căn bản là tớ thjk cái bình tưới cây cho bé
726251,Bé nhà tớ thjk tưới cây
726252,B còn bộ đồ chơi gì hay nữa hok
726253,Mình share và tag 3 mẹ zui nhé
726254,Quà là gì hả b
726255,B có đồ chơi bác sĩ hok
726256,Th ship cho tớ vẫn địa chỉ cũ nhé
726257,39 hàng than
726258,Sđt 01225843993
726259,Của mình h t bn hả b 
726260,Shop có ảnh bên trong hok
726261,Đựng đc nhiều đồ hok shop
726262,Chỉ có 1 màu tối này thôi hả shop 
726263,Mình mua set hudson dể tặng
726264,Mà rờ thây vải hơi thô cứng
726265,Cho mình hoi cái này giạt sẽ mềm ra hay sao sh 
726266,Do mìh tặng nên k bi t
726267,K bi t giặt xong nó coa mềm ra ko thui shop
726268,Dạ em cam on ạ
726269,Cho e hỏi giá gh này nha
726270,Banco giao hàng ngay dc ko a 
726271,E sorry c
726272,Ba em bé đi mua ở đâu mag về lun r c
726273,Mới gọi báo em
726274,Cho e Xin gia gh ăn dặm nhe
726275,Mẫu b mới up ạ
726276,Sao mình lên shopee ko thấy hàng vậy ạ
726277,Mìh ko thấy thú nhún bằng nhựa ạ
726278,Inbox gia nha shop phi ship ve binh duong luon
726279,Tay ga bé chay hay co nút bật z ak 
726280,Dza co j e tra loi nha
726281,Ship bình duong s ak 
726282,Shop cho e hỏi mấy mẫu này còn k ạ
726283,Shop cho e hỏi gh có về nữa k ạ
726284,E đợi r đặt mấy mẫu này luôn
726285,E chờ đc đ n cuối tháng thôi ạ
726286,Shop xem tn giúp e với chứ sau ng nhà e đi k ai nhận giúp e đc
726287,Dạ nhờ shop ạ
726288,Cho mình 4 mẫu này nhé shop
726289,Tổng là 1 tr 189 ah shop
726290,Free ship cho mình nha
726291,Đảm bảo là gh hơi và phao k bị j nhé
726292,Bt 3 15 khu đô thị hữu hưng phường tây mỗ quận nam từ liêm Hà Nội Đt 0982681379 Lê thị Thủy
726293,Ship h t mấy ạ
726294,Mà shop ở đâu ạ
726295,E k thấy dc
726296,Đ c
726297,Gh cho e màu xanh lá như hình còn phao cho e màu hồng nhé shop
726298,Shop tư vấn giúp mình là gh ngồi từ mấy tháng tuổi thì ngồi đc ạ
726299,Cũng tầm đó ạ
726300,Sản phẩm này bn đây ạ
726301,1 gối trắng 1 phao màu j cũng đc ạ 1 gh xanh lá cây và 1 gối bảo vệ đầu hình con ong nhé shop
726302,Shop lên đơn giúp e Còn tiệt trùng uv be bela e tham khảo thêm đã ạ
726303,B cho mình 1 tiệt trùng uv nữa nhé
726304,Tổng là 2 tr 440
726305,Shop gửi hàng đảm bảo cho e nhé
726306,Tin tưởng nên ms đặt ở shop
726307,Thứ mấy shop ship để e còn sắp x p time nhận hàng ạ
726308,Tiệt trùng màu hồng cho e nhé shop
726309,Có j shop đt vào số trên báo trc e nhé
726310,169 phao 129 gối ong nâu 595 gh xanh lá 296 gôi trắng 1250 tiệt trùng màu hồng 
726311,169 phao 129 gối ong nâu 595 gh xanh lá 296 gôi trắng 1250 tiệt trùng màu hồng 40k
726312,Shop ơi có ship cho mình k để mình còn bi t
726313,Mình c nhận đc trong vòng đầu tuần sau thôi shop
726314,Sau đó ng nhà mình về quê shop ship đc j thì ship cho mình cái nào k có thì thôi ạ
726315,Gối cho mình màu ghi xám cũng đc shop nhé
726316,Ok shop muộn nhất đầu tuần sau nha shop
726317,Shop ơi tuần sau k đc shop mai gắng ship giúp e nhé
726318,169 phao 129 gối ong nâu 595 gh xanh lá 296 gôi xám 40k
726319,Mà shop oi cho e hỏi gh có 2 cái k thì ship e 2 cái nhé ạ
726320,E muốn đặt thêm gh 
726321,T2 shop ship cho e đc k ạ
726322,Địa chỉ cũ shop ah
726323,Shop cho e hỏi giá bn đây ạ
726324,Và bộ đồ chơi nhà tắm này k có bán riêng ah shop ơi
726325,Mình k lấy chậu mà muốn lấy mấy đồ chơi thôi thì giá bn ạ
726326,Bể đựng thánh cao giá bao nhiêu ạ
726327,Còn hàng kg shop
726328,Giá khuyen mãi la 490k đug kg shop
726329,Dạ cho em hỏi n u ship vào miền nam phí bao nhiêu ạ
726330,Dạ ở huyện Đức Hoà tỉnh Long An ạ
726331,Vậy cho mình hỏi 1 cái nữa nha shop là khoảng mấy ngay thì nhận hàng được ạ
726332,Dạ e cảm ơn shop nhiều nha
726333,Cho minh order san pham nay nha
726334,Chuyen đủ het luôn ha shop
726335,Ngân hàng nao cug đc phai kg shop
726336,Tai mình it khi mua online nen kg rõ lam
726337,Shop chốt phí gium minh cai nha
726338,Chuyển cho shop 490k còn phí ship khi nhận hàng mình tự trả luôn đug kg
726339,Ok vì mình là mẹ bỉm sữa kg có thời gian đi bên ngoài nhiều nên ck có hơi lâu để mình sắp x p có gì shop thông cảm nha Cam on shop
726340,xe này mấy tư th vậy shop 1 hay 2 chiều 
726341,xe mấy tư th vậy shop
726342,Xin chào cho m hỏi thú nhún xuất xứ nước nào vậy bạn
726343,Và chậu tắm này kích thước bn
726344,Kích thước chậu là 79x84 ạ 
726345,Thú nhún còn màu nào vậy shop 
726346,Shop ơi thảm kỳ diệu winfun còn k
726347,Bạn ơi hút sữa avent snow gối chốh bẹp đầu và gối chống trào ngược giá bao nhiêu
726348,Gối chống bẹp đầu và gối chống trào ngược thì bao nhiêu em
726349,Có sẵn ko em
726350,Uki bạn mai mình lấy 1 chi c
726351,Mình mua ck bạn ship cho mình đc ko
726352,Ah mình cần 1 loạt tiệt trùng bình sữa nữa
726353,Bạn có loại nào vừa phải dùng hợp l ko
726354,Em có cái loại của fatz mà có cả sấy ko em
726355,Chị lấy thêm cái tiệt trùng sấy khô của Fatz nhé
726356,Chị ck cho shop xong ship đ n nhà hộ chị nhé
726357,Chị chưa
726358,Cho chị thông tin
726359,Chị lấy cả mhs Avent snow nữa nhép
726360,Ck vào tk nào hả em
726361,Em ship cho chị đêns ngõ 89 2 51 24 Lạc Long Quâng
726362,Sđt 0915668800
726363,Ủa chị tưởng nay ship đồng giá 20k
726364,Ah uki e
726365,Bạn ơi bên mình có thảm không ạ
726366,Thảm toyshouse ạ
726367,Mẫu vàng Nhiu ak
726368,Cho kiểm hàng không ak
726369,Shop ơi bộ này bnhiu
726370,Cái này bnhiu
726371,Mình hỏi mã này cơ
726372,Còn hàng k
726373,Ship mình cái này
726374,may nay bnhiu z shop
726375,Em ở tphcm
726376,Phí ship bn 
726377,Ship về hà tĩnh thì ntn ạ
726378,E muốn ship COD shop ạ
726379,shop ơi báo giá xe đẩy đảo chiều delama cho e với ạ
726380,khi nào thì có lại vậy ạ
726381,gja bn ak
726382,may pha sua nay gja bn ak
726383,Bên m còn mẫu này ko ạ
726384,Mẫu này có mút sàn chống xê dịch ko ạ
726385,À cho m hỏi thêm mẫu này giá ntn ạ
726386,Shop ơi cho m hỏi bên m còn sale quây nhựa loại này ko ạ
726387,Cho m xin giá và kích thước với
726388,cảm ơn shop để mình tìm hiểu thêm nhé
726389,Cho m xin giá giường nhựa với
726390,Kích thước bnh 
726391,Kệ này còn bnh bạn
726392,Còn màu gì 
726393,Hqua m vừa mua xong
726394,Tại đợi mãi k thấy b nt
726395,Rẻ quá
726396,M mua 1490 k chứ
726397,Cho m xin giá cũi này với
726398,Uh M sợ thay đổi giá
726399,Cái này nhìn có bé k bạn
726400,Dùng đc trọng lg bnh kg
726401,Đ n mấy tuổi
726402,Để m tham khảo
726403,Thảm này giá bnh hả bạn
726404,Còn k cho mình 2 cái
726405,Sách học tiêngw anh còn k
726406,Cho m Xin giá xe này
726407,Bên m Có shoppe k shop
726408,Ship tới kim Mã h t bnh nữa ạ
726409,Ok bạn Có gì m nt nhé
726410,Gh này có những màu gì bạn
726411,Giá này cao hơn trên bài b pot à
726412,Giá ở shop bnh ạ
726413, ship nữa
726414,Giá bây giờ bao nhiêu ship
726415,Hn đắt th 
726416,Hôm đăng bài rẻ hơn mà
726417,Hqua m ib để mua mãi k thấy trả lời
726418,T ở kim mã
726419,T hỏi giá gh này ship
726420,H t km rồi ag
726421,Mình xem ở bài hôm trc đăng 2190
726422,Có được k mình lấy
726423,Hôm qua mình ib mãi từ hôm qua k thấy trả lời gì cả
726424,Có hai màu hả bạn
726425,Khi nào có hàng báo m nhé
726426,ib giúp mình bình pha sữa tiny
726427,gh ngồi ôt zaracps aroma giá sao ah
726428,shop ở đâu vậy c
726429,e thấy cố richell 195k à c
726430,có địa chỉ ở hcm k ạ
726431,Có bớt ko vậy shop
726432,Oki để mai mình qua shop xem ở ngoài ưng ko nhé
726433,Mà shop ngoài xe ra có đồ chơi gì cho bé 1 tuổi ko ạ
726434,shop có phụ kiện medela freestyle ko
726435,vậy à cám ơn b nhé
726436,cho m hỏi quây này bn ạ
726437,Cái này còn ko b ơi
726438,Ko về hàng lại hả b
726439,Có cách nào đặt đc hem b
726440,Kiểu th này ko ạ
726441,Cửa nhà chị 83cm em nhé
726442,Mai em ship chị nhé
726443,Với bên em còn cái cầu trượt ko
726444,Cho c xin kích cỡ cầu trượt nhé
726445,Hi b oi
726446,Ship cho minh xe đẩy này đi
726447,Building đại kim ngõ 2 định công thượng hoàng mai toà b 
726448,0888332188
726449,Nhưng cho ship luôn cho mình được ko mình đang cần sử dụng
726450,Minh go i lai roi
726451,Sao bao minh 1590k
