senid,sentence
726958,Delivery time 29 10 Name Yasuko Tel 0329500130 Address 3112 31F TowerA Mipec Riverside Long bien Item Nadle bicycle 3 in 1 1 290 000 40000 shipping fee
726959,Hi today what time ship the bicycle to me
726960,Hi I want to ask what time will ship the bicycle to me Can you tell me the time Thank you
726961,Today
726962,17 30
726963,Here
726964,Then coming up
726965,31 F
726966,Is easy to go there
726967,Why need to charge extra 20k
726968,The shipper arrive then call me
726969,Then what is the problem
726970,Just ship to home
726971,No need Conversation
726972,Room 60k
726973,What time
726974,The bicycle is blue color have handle safety fence right
726975,The wheel no need to blow air right
726976,7 o clock ok
726977,No need blow air into wheel
726978,Just use right 
726979,And 1 pack this have 
726980,1 pls
726981,Plus the bicycle
726982,Delivery time 29 10 Name Yasuko Tel 0329500130 Address 3112 31F TowerA Mipec Riverside Long bien Item Nadle bicycle 3 in 1 1 290 000 60000 shipping fee 1 pack of wet tissue 58k
726983,Just remind you the shipper need to bring ID card to register coming up to apartment
726984,This 1 set how much 231 200 
726985,I want to order arau shower gel How much K mom soften how much 
726986,Which one
726987,Shower gel 
726988,This one have 
726989,Washing liquid how much
726990,Refill pack is 160 000 
726991,Have stock 
726992,I sent your the order later
726993,This one is 149
726994,I order the following items 1 arau shower gel bottle 139k x2 2 k mom washing liquid 160k x2 3 dry tissue 54k x5 4 grey horse 199k
726995,Have bottle
726996,FREESHIP over 300k
726997,Can you see my order
726998,I order the following items 1 arau shower gel bottle 139k x2 2 k mom washing liquid 160k x2 3 dry tissue 54k x5 4 grey horse 195k
726999,I don t have shopee acc
727000,Can you offer to me
727001,Pls this is second time I buy things with you Becoz shopee is Vietnamese language I don t know
727002,Pls offer the price free ship for me I will keep order with you
727003,Dry tissue I order 5 pack
727004,Could you just free shipping fee for me
727005,I order over 1 000 000
727006,But order in shopee have discount
727007,The product order via you is more expensive
727008,Just free 40k for me
727009,The product keep with you tell me
727010,Can you free shipping fee for me
727011,Then can you charge me half of the FREESHIP
727012,Fee
727013,You still want to keeping do business with me So pls offer me I buy many things
727014,Just little discount you can offer on the other website now I just ask you little discount Not much
727015,So I ask you I pay 20k u pay 20 k
727016,139*2 160*2 61*5 195 20k ship
727017,Ok pls arrange ship on tomorrow Arau shower gel have bottle Horse is grey color
727018,Tel 0965922121 Room 3112 31F TowerA Mipec Riverside long bien Pls inform shipper ship at home
727019,Pls check what time will delivery goods
727020,Hi when you arrange shipping 
727021,Sorry don t understand
727022,When you shipping goods to me
727023,Not yet
727024,Ok No laundry water ok
727025,Other pls ship to me
727026,Pls inform shipper tomorrow ship the goods to me after 17 00
727027,If can t arrange on 18 12
727028,After 1700
727029,No people at home
727030,After 17 00 ok 
727031,139*2 61*5 195 40k ship Total 818k
727032,Inbox cho e giá máy vs ạ
727033,Inbox e
727034,Máy tiệt trùng sấy khô nhé
727035,E vừa gọi cho s đáy
727036,Máy loại khác s ơi
727037,Còn loại j tốt hơn fat k s
727038,Tiệt trùng sấy khô luôn đúng k s
727039,Mà haenim là hàng xách tay đúng k
727040,Bjo có hàng ti p th ạ
727041,Gửi cho e ảnh vs
727042,E dùng fat r chán quá
727043,Muốn kua máy tốt hơn
727044,K có hình à a
727045,Lâu th cơ ạ
727046,S có nôi nào rung
727047,Rồi có nhạc
727048,Cho bé dễ ngủ k
727049,Con e đc 1 rhangs tuổi
727050,E thấy giá cungz chênh lêhcj
727051,Đáng lể
727052,Kể
727053,Con e toàn ti bình vs khó nghr
727054,Theo s tư vấn e nên mua loại nào
727055,Vì e k đ n tận nơi xem từng cái 1 đc Cái này càng mát
727056,Vs nằm k ảnh hưởng đ n cột sống của bé càng tốt s nhê
727057,S check r ship hàng cho mình vs
727058,S gọi
727059,Hoặc cho m sđt mình gộ
727060,Tư vấn trực ti p
727061,R ship luôn đc k
727062,Sđt 0968 799 686
727063,Ship cho e loại này vs
727064,Có ship tận nhà k shop nhỉ
727065,Số nhad 80 phố đỗ sĩ hoạ thị trấn ân thi huyện ân thi tunhf hưng yên
727066,Nhưng gửo xe
727067,Thì gửi xe nào th s
727068,E sọw k gần nhà
727069,Tính phí ship tận nhà cho e vs
727070,Bjo e ck bn đay s
727071,E ck shop ship cho e luôn
727072,S check r gửi hàng luôn cho m
727073,Khoảng bao giờ
727074,E nhạn đc s nhỉ
727075,E quên k hỏi
727076,Baot hành trong bao lâu
727077,Gửi hàng giúp e
727078,Sao e vẫn chưa nhận đc hàng s nhỉ
727079,E tg s gửi cpn về tận nhà
727080,E hỏi ship tận nhà đây
727081,Vì nhà con nhỏ k có ai đi nên cần ship tận nhà mà
727082,Chứ có qtrong phí đâu
727083,E hỏi phí thôi
727084,Chứ mấy trăm cungz ok mà
727085,Th bjo s gửi xe
727086,R đúng k
727087,E mua xe đc chứ mấy trăm qtronf j phí
727088,E sợ xe ở xa 
727089,E gọi r s à
727090,Mai họ vc đ n
727091,Cảm ơn s nhé
727092,S tư vấn cho e
727093,Về máy hâm sữa vs
727094,E đang ohaan vân 3 loại này
727095,Theo s thì nên lấy loại nào
727096,E đã mua fat mad k muốn dùng nữa
727097,Nhnwg có hiện giờ lên k s
727098,Ý e là máy naod
727099,Hiện giờ
727100,Hâm lên ya s
727101,Hâm avent
727102,Hâm sữa 40 độ
727103,Trong bn phút th s
727104,Vs máy nào
727105,K cần dùng nc s nhỉ
727106,E phân vân cái đieenj tử chicco
727107,Nó hiện gioè lên
727108,Còn avent hình như k hiện
727109,Thre ship cho e avent đi
727110,Ship trong chiều nay s nhr
727111,Ship về chung cư học viện hậu cần ngọc thuỵ long bien hà nội
727112,Sđt 0968 799 686
727113,trong hnay
727114,Đunhs k s
727115,Hay là bjo
727116,Máy nayd có chức năng
727117,Hâm nóng sưac kns
727118,E nên mua máy này
727119,Hay mua máy avent s nhỉ
727120,Th đổi cho e đc k
727121,Ship cho e máy nayd
727122,Máy nayd bn th s
727123,Màu đên nhép
727124,Cho e chọn caid tặng gh nhé
727125,Cho e gh hồng đc k
727126,N u mua cả 2 là 4890 40k ship
727127,Còn n u k gh là 3750 40 đúng k s
727128,Mình joir lại thôi
727129,Chứ ksao
727130,Htrc mua nôi rùn của s còn chưa bóc hộp
727131,E hỏi a tí
727132,Cái máy babymoov e mua của s
727133,Cứ hiện sáng nút calc
727134,Mad e đã lamd tjeo hdan
727135,Là dùng dấm vs nc nóng r
727136,Mac k êhts
727137,Vs hâm ch độ 5 ohuts trong tủ lạnh
727138,Thì sữa lên đ n 70 độ s à
727139,Hdan e
727140,Cách lắp nôi vs
727141,E lứo đc r s nhé
727142,Cho e 1 máy
727143,Hâm sữa avent vs
727144,Vs s có túi trữ sữa k
727145,Hâm sữa h t r à s
727146,Xe này còn những màu j th s
727147,Có bán quạt tích điện
727148,Kẹp vào xe đẩy k th 
727149,E đang tìm quạt tích điện
727150,S có xe đẩy aprica k
727151,S có nhận thanh l hộ
727152,Spham đã mua tại cửa hàng k
727153,Mới mua của shop đầu tháng 5 ak
727154,S có nồi
727155,Nấu cháo chậm k
727156,K có hãng khác k
727157,Fat có bền kns
727158,S có gh ăn dặm k
727159,Gh nayd giá bn s
727160,Gh này có phaitr gh tặng kèm khi mua cùng máy babymoov
727161,K s
727162,Inb mình giá 2 gh này nhed
727163,Gh dươi
727164,Chất liệu có nóng k s
727165,Nóng hơn cái mastela s nhit
727166,S còn gh nào
727167,Ăn dặm mát hơn k
727168,Mẫu này gấp gọn đc k b
727169,B có hình gấp gọn của gh k b
727170,Hàng chính hãng k b
727171,Bên c có gối ôm uala rogo k a
727172,Gối ôm là 2 cái ạ
727173,Có bán lẻ 1 cái k ạ
727174,Mình order trên shoppee r nhé
727175,B có tt vnpay k
727176,Shop ơi shop còn thảm chơi cho bé k
727177,E xem trên shopee thì thấy mỗi 1 mẫu
727178,E mua qua shopee thì mai có luôn k chị nhỉ
727179,Vì mai là e cần r
727180,Th thì chị gọi ship cho e tính thêm tiền ship cũng dc ah
727181,Thảm này vẫn sale giá 520k đúng k chiu
727182,Ship cho em đ n R4 sảnh B royal city ah
727183,Sdt 0937285591
727184,Em tên Liên
727185,Chị ơi chị đã check kho chưa ah
727186,Th còn mẫu j ah
727187,Vậy cho em mẫu gấu ôm mặt trăng ah
727188,Chiều nay hả chị
727189,Hay chiều mai ah
727190,Chiều nay thì khoảng 6h hẵng ship cho e vì sợ e k về kịp
727191,Vâng ah thank chị
727192,Nhà mình có con ngựa bập bênh rồi nên đổi wa cái khác được không shop
727193,Giao về long thành đồng nai shop
727194,Bên shop bán bên shopee ko
727195,Ship ve long thành đồng nai thì bao lau shop
727196,N u k lấy quà thì avent đôi giá bn ah
727197,Vậy ah cảm ơn b nhé
727198,M tg trừ đc
727199,Khác nhau th nào hả b
727200,Chỉ còn những màu trên stt thôi ah
727201,Ah m bi t cái đó
727202,2 loại chỉ khác vậy thôi ah
727203,1 chiều gọn hơn ah
727204,Loại này nhẹ đúnh k b
727205,Vậy loại nào nhẹ hơn
727206,Aprica ah
727207,Loại này t xem rẻ nhất kh 5t
727208,Để m tham khảo xem nhé
727209,B ơi cái này còn k ah
727210,Thảm này hè có nóng k b
727211,Còn hình nào vậy b
727212,Rồi ship luôn cho m vs
727213,B ơi bên m có cửa hàng k e muốn qua e trực ti p gh 
727214,Vâng e cảm ơn lúc anof rảnh e qua
727215,Cái này có ship shopee k c
727216,Th k ship qua đó rồi
727217,Chỉ ship nội thành ah b
727218,Loại này dùng đc b p từ đúng k shop
727219,May này pha dc tât ca cac loại sữa ko shop Hay chi pha dc sua cua Nhật
727220,2 địu này loại nào dễ dùng hơn shop 
727221,Còn loại kia của nước nao vậy
727222,Loại của Mỹ bé ko quay ra được hả shop
727223,Loại nao bé sơ sinh dùng dc vậy shop Bé nhà mình 1 5th co dùng dc ko
727224,Loại comfy có nằm được ko shop 
727225,Cảm ơn shop nhé De mình suy nghi xem nên mua loại nào
727226,Ben shop có máy hut mũi Little Martin s ko
727227,Máy hut mũi cho bé
727228,Mình thấy có 2 loại
727229,Vậy loại nao ok
727230,Loai comfy het roi hả shop
727231,Loại kian nhìn thô quá
727232,Khi nao comfy co lại
727233,Hàng buchen co mấy đầu thay b
727234,Pin thường xài dc ko hay fai pin hãng
727235,Máy do bnhiu zậy shop
727236,N u ship vao SG mất bao lâu
727237,Địu infantino còn ko shop
727238,Nó co mấy màu vậy
727239,Khi nao ve hàng lại shop
727240,Địu infantino khi nào có vậy shop 
727241,Điu infantino về hàng lại chưa shop
727242,Có về ko shop de mình chờ
727243,Bạn còn nôi này k
727244,Ship về ngõ 464 Âu Cơ có freeship ko shop
727245,Cho m đặt 1 bộ về ngõ 464 Âu Cơ nhé
727246,Ok b tối nay ship dc cho mình ko
727247,Trung 0945621590 b nhé
727248,Vào ngõ 464 gọi mình ra đón nhé
727249,B ơi mình lắp thì k thấy giống hình ảnh các bạn đăng trên fanpage
727250,Do cái giá này bị lỗi hay các bạn bán hàng không giống hình nhỉ 
727251,à ảnh trên page có 2 hàng treo khăn 1 hàng kẹp
727252,còn thực t thì có 1 hàng treo khăn và 2 hàng kẹp
727253,ừ mình xem rồi
727254,của mình nhận hqua này
727255,Shop tư vấn mình gh trẻ e ngồi oto với
727256,Or tag mình vào mình ko tìm dc sp đó
727257,Nhà mình có gh sẵn hàng ko b ơi
727258,Cho bé sơ sinh trở lên Bé nhà mình đang dc 1t
727259,Loại này chả hạn
727260,M đang cần tư vấn mà Hì
727261,Mình ở bg
727262,Chất liệu gh nỉ b nhỉ
727263,Mềm mại ko Mình có thể cọc trc xong ship cod mình dc ko shop 
727264,Mình muốn xem hàng Shop địa chỉ ở đâu hn
727265,Kể ra cũng ko xa lắm Đi tí thì tới âu cơ cũng dễ đi
727266,Để tí mình về bàn vs vợ nhé shop
727267,2c này nó khác nhau ở điểm j shop
727268,Chất liệu gh có khác nhau nhiều ko shop
727269,Hay khác về kích size 
727270,Uki chắc mình đặt loại stage
727271,Để mình ktra xem tk còn đủ ko mình ck thì các bạn ship nhanh về cho mình 
727272,Cod nhanh vs chậm chênh nhau nhiều ko shop 
727273,Mình ít đặt hàng ol 
727274,Hàng này có bh ko bạn Vs giặt có dễ ko
727275,Nt mình stk shop nhé
727276,Có giảm dc cho mình nữa ko 
727277,Hình như hnay bị nghẽn mạng Mình ck thông báo thành công nhưng ko nổi Có j từ h tới chiều m ck các b ship ra minh khai cho m nhé
727278,M vừa chuyển 3890n Các bạn check giúp mình nổi báo mình nhé M báo địa điểm ship giúp mình ra minh khai hn
727279,Uh thấy nổi chưa bạn
727280,Mình gửi b sdt b này B alo ship cho bạn cầm về cho mình nhé 
727281,B ấy đang ở minh khai đấy
727282,B alo cho bạn nhé
727283,M ko rõ bạn đang ở cụ thể chỗ nào 
727284,Bạn ship ra giúp mình m cũng đi nhờ ngta mà
727285,0969395295 bạn tên Ninh nhé
727286,Bạn alo dc bạn ấy chưa
727287,Ok khi nào ship b bảo mình vs nhé 
727288,E gửi gh về b n xe bg cho a nhé
727289,Để chiều tối a lấy
727290,Hoặc ship thẳng về nhà a 121 nguyễn thị minh khai tp bắc giang bg
727291,Sdt 0941 367 999
727292,Uh bh gửi cho a dc 
727293,Và bh thì tới nơi
727294,Gửi nhanh vs chậm
727295,Chi phí tnao
727296,Uh th e gửi cho a nhé Tks e
727297,Vậy chậm cũng dc hnay ko lấy dc thì a cũng ko còn vội nữa
727298,Uh r e làm tnao cũng dc e
727299,Có gồm phao cổ ko shop
727300,Shop mình còn ship túi nay k
727301,Túi này giá sao shop
727302,Gui mẫu cho mình xem voi
727303,Ship ve hau giang bnhiu z 
727304,Minh muon mua 1 so thu nhu balo insular ghe an tong do cat toc yem dang mang gia moi thu bn vay shop 
727305,Diu aag 024 nua
727306,Con thanh chan nay khong khoan cat thi gan bang gi vay shop Gia nhu the nao ạ 
727307,539k là 1 cái cổng hay sao ạ 
727308,Minh o tphcm thi ship bn vay 
727309,Có hình thật ko shop
727310,Cho e hoi may pha sua nhiu
727311,Cho mình xin giá giường với ạ
727312,Còn ship tỉnh thì th nào ạ 
727313,Em ở Buôn Ma Thuột
727314,Ship shopee có đỡ phí hơn ko shop nhỉ 
727315,Mà nệm đi kèm là loại nệm gì ạ 
727316,Mình lên shopee tìm ở shop ko có sản phẩm này
727317,cho e hỏi máy hấp bn vậy c
727318,Shop cho minh hoi gia cua quay nay nhe
727319,Shop oi tren shoppe cung gia nay luon hã shop
727320,Phi giao hang vao tp hcm thi nhu the nao ạ
727321,Minh dang mua tren shoppe
727322,Shop oi cho minh hoi chắn cửa cầu thang ben minh bao nhieu a 
727323,Cho minh hoi dat tai facebook voi shoppe ben nao chuyen hang nhanh hon ạ
727324,Giao ben face thi bao nhiu ạ va khoang may ngay toi ạ
727325,Shop oi cho minh hoi nha minh 102cm fai mua them thanh noi shop co ban luon ko ạ
727326,Minh chua dat
727327,Thanh chan co 85cm
727328,Ban co thanh noi bao nhiu cm
727329,Shop k co thanh noi nho hon ah
727330,Thanh noi 12cm bao nhieu ạ
727331,Kích Thước nhỏ quá
727332,OK shop nhỏ quá hi
727333,Còn cái này k ạ
727334,Khi nào có lại ib giùm mình nha
727335,Cho mình mã nhé
727336,Mà trên shoppe h t thảm chơi hq gòy
727337,Mã giảm giá lun ạ
727338,Quây toys house ship sg bn ạ
727339,Thảm chơi là loại nào ak
727340,Có phải thảm silicon chôg va đập k ạ
727341,N u ship q bình thạnh tphcm thì bn ạ
727342,Zịk m chọn freeship
727343,Phải tàg 3ng nữa mới đc ạ
727344,Mình lấy size m góc vuông màu xanh
727345,Mình share r đó ak
727346,Bạn check jum mình nha
727347,Thảo 0933663696
727348,155 38 xô vi t nghệ tĩnh p17 q bình thạnh
727349,Shop nhận đc tiền ck chưa ak
727350,Sáng nay mới đặt thanh chắn zới thảm silicon trên shopee
727351,Đang mong đợi để cho bé chơi quá
727352,Sáng mình mua r n u tách thì thảm đi trc nha shop
727353,Tại mình thanh toán r
727354,Zới hôm nay shoppe km 10 
727355,Đẹp xuất sắc lun
727356,Đợi quây toys house ship tới nữa sẽ quay clip bé chơi gửi shop
727357,Đợi xíu mình chụp
727358,Mà ship shopee nhanh hơn ák Đặt sau 1 ngày mà giờ có trc r
727359,Bị lỗi nhỏ nè
727360,Rõ lắm
727361,Thôi khỏi đi mất công quá
727362,Mình nhận đc quây r
727363,Đẹp lắm ạ
727364,Ad cho mình xin thêm mấy cái bọc chân quây toy house nha
727365,Còn thú nhún toy house k ạ
727366,Thấy trên shopee hơn 700
727367,Còn xe sư tử k ạ
727368,Xả kho còn xe sư tử k an
727369,Chuyển khoản trc pk ạ
727370,Báo giá xe sư tử tập đi jup mình
727371,Mình ck r đó ạ
727372,155 38 xô vi t nghệ tĩnh p17 q bình thạnh tp hcm
727373,Vì ở xa nên giúp mình gói cẩn thận nha shop
727374,Huhu Sợ mí đơn vị vc lắm lắm
727375,Đuk r ak
727376,Mình có chuyển mua xe winfun sư tử bữa thứ 6 Ad kiểm tra giùm là đã ship giùm chưa ạ
727377,Gần 1 tuần r mà vẫn chưa nhận được hàng ạ
727378,Thảm silicon 999k pk ạ
727379,Thảm silicon trên shopee 1 120k
727380,Mua trực ti p cũng giá đó lun hay sao ạ
727381,Mình đang đợi trả lời bên shopee mua thảm silicon
727382,Thảm silicon còn k ạ
727383,Cỡ nhỏ 1m4 x 1m4 pk ak
727384,1050k ạ
727385,Ship sg chắc nhìu tiền ạ 
727386,Mún mua trên shoppe để đc hỗ trơj ship xíu mà hq giờ k có b nào check h t
727387,Mà bên kia là 1120 ạ
727388,Giúp mình chỉnh lại giá thảm silicon đi ạ
727389,Cho mình hỏi rổ trái cây là bằng nhựa mềm đúk k ạ
727390,Ôi Mà mới xem lại chỉ bán nội thành hà
727391,Ok b Lắp ráp dễ k ạ
727392,Chắc coa cuốn hdan pk ạ
727393,Có mấy màu ạ Để tối mình ck
727394,Ship cod hay ck trc ạ
727395,Máy pha sữa tiny có km hôk ạ
727396,Shop cho mình giá thảm chơi có nhạc và thảm xốp gấp đc k ạ
727397,Thảm chữ nhật 249 đó ạ
727398,Với thẩm gấp 450
727399,Cho mình xin thông tin tkhoan
727400,Có đc chọn mẫu thảm gấp k ạ
727401,Ship code hay ck trc ạ
727402,Shop có bán phao cổ k ạ
727403,Mình mún mua thanh chắn cầu thang ạ
727404,Mình order 1 thanh và 1 nối 12
727405,Thanh ngang là 85cm ạ
727406,Mình ck nha ad Ship sg ạ
727407,Tính mua trên shopee mà gía ship chát quá 
727408,Dạ Với 1 nối chữ Y nữA ak
727409,Dạ Cước shope cao gê
727410,Giok trong clip lun ạ
727411,Ship sg bn vậy a
727412, phí ship cao quá ạ
727413,Shop c mình thông tin để mình ck mua cây phơi đồ inox ạ
727414,155 38 xô vi t nghệ tĩnh p17 q bình thạnh 0933663696
727415,Shop inbox giá máy này giúp e với ạ
727416,Em cảm ơn shop nhiều ạ sẽ nhanh chóng lấy 1 máy về liền ạ
727417,shop co nhung loai cau truot nao vay sop
727418,cho em sem hinh anh vli ạ
727419,Thảm nhạc giá bn
727420,Có tách cái đệm ra được k hả b
727421,Tháo ra cho bé nằm xuống đệm trên giường thôi dc k b
727422,B oi thảm vs qây bên mình có size nào
727423,Vs chất liệu j
727424,Qây vuông b oi
727425,Vs thảm bé ngã ra có ls ko b
727426,Vs quây đó bé bám vào đứng có bị đổ k b 
727427,Cái set chơi kia chỉ có qây tròn thôi hả b
727428,Có qÂy vuông k
727429,Sz M là diện tích bn hả b
727430,Xl vs xxl thì bao nhiêu
727431,Thảm cũng theo kích thước đó đúng k b
727432,Bên b có quẹt thẻ k b 
727433,B có tk bidv k b
727434,Mình muốn qua xem trc đã nha
727435,Mình k cầm nhiều tiền mặt nên hỏi để chuyển qua tk mà
727436,À có đỗ dc oto k b
727437,Xe tròn tập đi
727438,B có loại nào
727439,Cao bn
727440,Loại nào cao cao b
727441,Chị hỏi giá ts
727442,Cho c hỏi giá xe mamago tròn tập đi
727443,Cho c hình nữa nhứ
727444,Th cái chỉnh dc độ cao
727445,Thì có xịn hơn k
727446,Giá cái mamago
727447,Thì bao nhiêu hả b
727448,Mamago bn e oi
727449,Ship c luon dx k
727450,Lấy nâu nha
727451,Ship c đi e
727452,E ship lên phòng cgo c dc k
727453,C có con nhỏ
727454,Ở nhà 1 mình e ạ
727455,C ở 505 minh khai
727456,Hoà bình greeen
727457,C mua đồ các bann vẫn mang lên dc
727458,E giúp c dc k
727459,Ship cho c trong chiều nay nha
727460,Ok e cũng dc nhé
727461,À thôi ship cho c
727462,Trpng chiều nha
727463,Nhớ nha e
727464,Đừng ship muộn hơn nh
727465,E oi ship c đi e
727466,Hôm qa c mua cái xe tập đi mamago
727467,Cái bàn nhạc của nó hỏng r e ơi
727468,C lắp pin vào k kêu dc
727469,E cho c đổi
727470,C qay clip này
727471,E xem cho c
727472,Đổi mỗi cái bản đàn đúng k e
727473,Chỉ cần đổi mỗi cái đàn thôi
727474,Đổi cam cũng dc e ạ
727475,Bản đàn cam cũng dc mà e
727476,Ừ cucng dc e ạ
727477,Thứ 2 ship c nhé
727478,E oi c hỏi giá thảm silicon
727479,Hôm nay nhớ đổi cho c cái bản đàn o xe tập đi nhé
727480,Mai đổi hả e
727481,Th mai ship c nhé e
727482,E ơi bao g e mang đổi cho c
727483,Bộ này giá bn b oi
727484,Hình y như bài post ha b
727485,Bên b có máy hút mũi k
727486,Cho mình 1 comfy baby nhé
727487,Ship ngay nha b
727488,Hoà bình green city
727489,Chạy pin hay sạc ha b
727490,Th bg shop ship dc v
727491,Grab phí ship bn ha b
727492,Ok có j báo mình vs
727493,Ui th thôi chờ shop ship cho mình v
727494,Ko b oi
727495,Sdt 01288406963
727496,Nhà b có cặp nhiệt độ dtu k
727497,Đo trán hay tai b
727498,Bên b còn bán máy hút mũi k
727499,B oi cái này giá bn
727500,B oi túi hâm sữa nice papa giá bao nhiêi
727501,K thấy rep tn của mình
727502,Có ship dc về hp k b
727503,B oi tiền ship hải phòng bn
727504,Để t ck cả luôn
727505,Loaii túi b ạ
727506,Túi giữ nhiệt
727507,Nice papa
727508,b ơi máy tiệt trùng giá bn
727509,B oi túi hâm sữa nice papa còn k
727510,Cho e hỏi có con nao mau hồng k ạ 
727511,Shop o đau ak
727512,Be bao nhieu tuoi thi choi dc a
727513,109D lac long quân p3 q11
727514,0902580837
727515,Da e k co shoppe
727516,Shop duyet cho e chua ạ 
727517,Lay e con tai hồng nha shop
727518,Da e k co shopee
727519,Shop gui thang cho e lun dc k ak
727520,K shop cod đc ạ
727521,Tai e co be nhỏ k đi gui dc ạ
727522,Vay shop đặt trong đó dum e dc k 
727523,Da vay gữi link dum e đe e đac
727524,Co links chua ạ
727525,Shop giao e con gau ma k keu dc vay
727526,E gan bin vao nay kia ma k keu
727527,Da sr sr
727528,E mo dc roi 
727529,Mau gấu màu hồng ạ
727530,À La shop giao thi xep lai hay sao ak
727531,Nó to k 
727532,Đóng thùng thi no to bao nhieu ạ
727533,Tai đường len cau thang e hoi nho Neu to qua e so đem len k vừa
727534,Dc k ak
727535,Dc e mua lun ak
727536,Ship dum e lun
727537,Nay shop giao la thao ra 
727538,Minh đem ve moi rap vao đung k ạ 
727539,Co dễ rap k ak
727540,Cho e link e đac nhe
727541,Da vay thoi giao bt cho e cung dc ak
727542,Vay shop giao ngoai
727543,Hay la e đac trong kia ạ
727544,Ship toi 7 tram may lun ak
727545,Da 
727546,Mai shop ship som cho e nhe
727547,E chuyen cho ak
727548,E chuyen bao nhieu
727549,Tien tủ lun tiền ship hay sao ạ
727550,La bao nhieu ạ 
727551,Da Ok
727552,Cho e hoi có momo k ạ
727553,E chuyen momo dc k
727554,Loại này thì bao nhiêu
727555,Bộ quây cho bé chơi bn a
727556,Có hàng sẵn qua xem k ạ
727557,Mình ở đâu ạ
727558,B ơi Giới thiệu cho mình mẫu gh ô tô nào có tích hợp với nôi xe đẩy với b 
727559,Tag mình xem các mẫu này vs b
727560,Nôi nằm chung có mầu gì bạn
727561,Cho mình xin ảnh thật sản phẩm nhé
727562,Bạn cho hỏi xe đẩy joie pact chiều cao đất tới chỗ nằm bé là bn cm
727563,Bạn ơi m muốn lấy xe đẩy joie pact mầu navy
727564,Mình ở trong hcm
727565,Bạn gửi giúp m link shopee nhé
727566,M vừa đặt bạn nhé
727567,Shop ơi cái xe đẩy shopee ship khoảng bao lâu thì m nhận dc nhỉ
727568,Mình hỏi cái cầu tụt này giá tn
727569,Bộ này ship hcm giá bn bạn
727570,N u tầm này ship qua shopee
727571,Giá cước bạn
727572,Bạn up shopee dùm
727573,Mình check dc ko banh
727574,N u bên bạn ship là bn
727575,M lấy bộ cầu trượt bập bênh 590k
727576,Bên bạn ship cho mình nhé
727577,Địa chỉ nè
727578,Cho m số tk vcb nhé
727579,Địa chỉ ship nè
727580,Hương 0909687898
727581,Xanh cho bé trai
727582,Ck xong mình sẽ nhắn nhé
727583,Đang hỏi lại địa chỉ cho chuẩn
727584,Bạn ơi rất xin lỗi mình ko lấy bập bênh nữa Bạn cho mình xin link mình lấy cốc uống nước richell và bộ đồ chơi x p khối 70cm mình đặt qua shoppee luôn cho tiện
727585,M ko tìm thấy bộ x p khối trên shopee
727586,Bộ trong cái xô
727587,X p chồng 70cm
727588,Winfun là như nào
727589,Bộ này m lại ko thích bạn ạ
727590,Bộ kia nó gọn trong cái xô lúc cất đi
727591,Để khi nào có hàng m đặt nhé
727592,Shop cho m hỏi chắn giường baby quiner giá bn
727593,Lắp đặt vào giường ntn nhỉ
727594,Giường nhà mình là dạng phản
727595,Luồn đệm bé đẩy bật ra ko
727596,N u chỉ lắp 2 cạnh
727597,Luồn dưới đệm thôi hả
727598,Bạn có clip để tham khảo ko
