senid,sentence
620253,Chung cư rivera park 69 vũ trọng phụng
620254,Của mình tất cả bnh
620255,Ship trong giờ hành chính chiều đc ko bạn
620256,Với cho mình stk mình ck nhé
620257,Tổng 1930 bạn nhỉ
620258,Nhớ ship chiều nay trong giờ hc hộ tớ nhé
620259,098561441 bạn nhé
620260,Ngóng lắm 
620261,Shop nhớ đúng giờ hộ mình nhé
620262,Bạn ơi ship đi chưa
620263,Bạn ơi tủ sao lại cánh 1 màu thân 1 màu à
620264,Tớ có nhs
620265,0985561441
620266,Tháo ra lắp đã bị như này luôn
620267,Vì tủ chỉ có 1 màu be hoặc trắng chứ tủ nhà tớ cánh lại trắng
620268,Thân thì be
620269,Giường của bé cả đệm bnh bạn
620270,Giá bnh ak
620271,Cái này còn km ko e
620272,Xe gấu ya
620273,Còn cái j km nữa đăng nốt đi
620274,Chị lấy cả thể
620275,Cho c cái gh này màu gấu đen nhé
620276,Còn km j hấp dẫn đăng nốt đi
620277,C chọn còn ship cả thể nào
620278,Hôm nay bên e ship hay mai th 
620279,Um vì c ko có nhà hay e thuê ship ngoài cho c đc ko
620280,Thanh chắn giường 2m bnh e
620281,Cho mìn xin giá máy này nhé
620282,Mình xiin giá e này
620283,Mẫu này là mẫu mới 2019 ak
620284,Shop có thanh l hộ đồ ko ạ 
620285,À phải là đồ mua của shop ạ 
620286,Loại 800ml đúng ko ạ
620287,Shop còn thanh chắn giường umoo 1 8x2m ko ạ
620288,Bao h shop có hàng ti p ạ
620289,Shop còn xe này ko ạ 
620290,Bé lớn hơn thì xe này có bị thấp quá ko ạ 
620291,16m có dùng đc ko ạ
620292,Cho m xin giá luôn ạ
620293,Xe này shop còn k giá bn th ạh
620294,B ơi bên mình còn thanh chắn giường ko
620295,B ơi bên mình có thanh chắn giường ko
620296,Cho mình thanh chắn fun baby 2 màu xanh
620297,096 558 5168
620298,Số 8 ngõ 295 bạch mai
620299,1 thanh 2m funbaby màu xanh b nhé
620300,Shop ơi còn phễu cổ phễu van bình medela ko ạh
620301,Shop ơi bên mình bạn bộ bình phê u medela pump ko ah
620302,Núm ti bình medela nữa b báo giá giúp minh lun nhé
620303,B ơi bộ cổ phễu là gồm phễu cổ phễu van vàng van trắng là giá 240k đúg k b
620304,B tính hộ mình cho mình phễu 24 cạp bình logo 1 núm ti và phễu cổ phễu
620305,Trừ dây thôi
620306,Mình lây 2 bình
620307,Đầy đủ cả bộ trừ dây thôi b ạh
620308,23A Hai Ba Trưng
620309,0943394991
620310,Nhà mình có thanh chăn giường k
620311,bể bơi thành cao bn vạy ạ
620312,con e dc 3 tháng r ạ
620313,phao cổ đó dành cho bé 3 tháng đó ạ
620314,chắc lúc tắm thì con e cũng 4 tháng r
620315,vậy cho e link shopee
620316,mình ko tìm thấy bể bơi tren shoppe
620317,banj oiw
620318,mẫu bẻ bơi mới năm nay th nào vậy
620319,Mình đặt bể bơi là doctor dolphin mà
620320,Sao lại là bể này
620321,Thôi mình dùng cũng dc
620322,Tại đặt doctor mà
620323,Nhưng mà lắp như nào ạ
620324,Có phải như này ko
620325,Mình thấy vẫn chông chênh lắm
620326,Khi nào có nước mới chắc hay như nào
620327,Dạ 170k nha bạn
620328,Đc 15 đừong 44 KĐTM kp2 phường pháo đài Thành phố biển Hà Tiên Kiên Giang Số đt 0919923225
620329,Khi nào mình mới nhận được hàng ạ
620330,Vô lăng này giá bao nhiêu vậy chị 
620331,Ben ban cai nay bao Tien
620332,Shop ơi mình còn nôi mastela sg111 k Cho mình giá nhé 
620333,Mình đanh xem gian hàng nhà bạn trên tiki đặt trên đấy đc trợ giá tốt hơn đúng k b 
620334,Mình đang xem mã này này
620335,Thời gian giao hàng phụ thuộc tiki đungs k ạ 
620336,Mẫu này bn đấy ạ
620337,Bạn ơi mình đang muốn lấy cái nôi này
620338,Vỏ hộp ngoài có cũ lắm không bạn 
620339,Vì mình mang đi tặng
620340,Bạn ơi vỏ cũ nhưng có bẩn vào trong không bạn 
620341,N u vỏ cũ thì mình có thể tháo vỏ ra rồi mang đi tặng cũng được
620342,Okie bạn Mình đi tặng nên hỏi cẩn thận chút
620343,Vậy ship cho mình màu này nhé
620344,Mình ở gần b n xe Mỹ Đình
620345,C Nga A3 Vinhomes Hàm Nghi Nam Từ Liêm Hà Nội
620346,0936123737
620347,Lấy cho mình cái mới chút nha
620348,Vì hnay đầy bé tháng
620349,Nên bạn báo ship đi sớm hộ mình được không
620350,Mình định lấy hôm qua nhưng shop nghỉ chủ nhật Hiiii
620351,Bạn ơi chiều nay bên bạn có giao hàng được không Để mình còn sắp x p thời gian để nhận hàng 
620352,Mình đang muốn mua thêm xe đẩy
620353,Cái nôi hqua mình mua nó có tích hợp cho xe đẩy ko bạn 
620354,Bên bạn có hàng không 
620355,Xe đẩy đó có gập gọn lại được không bạn 
620356,Mình đang lăn tăn aprica karoon và combi handle S
620357,Cái nào gập lại gọn hơn huh bạn 
620358,Combi handy S
620359,Ah mình muốn hỏi
620360,Là trong 2 cái đấy
620361,Cái nào gập lại gọn hơn
620362,Okie bạn Th để mình tham khảo thêm nhé
620363,Có gì mình ới nhed
620364,Giá combi handy S bạn bán bao nhiêu nhỉ 
620365,Bên mình có gh mastela màu này ko shop
620366,Màu này ở ngoài nhìn xấu à shop 
620367,Bạn ơi ship COD về Trần đăng Ninh cầu giáy phí ship th nào
620368,Bạn ơi tầm 6h chiều ship được giúp mình ko
620369,0906183278
620370,Gh như hình nhé
620371,Bạn ơi nhớ 6h chuyển hàng đ n giúp mình nhé vì mai nhà mình lại ko có ai ở nhà để nhận
620372,Bạn cứ gọi số 0906183278 mình sẽ báo người nhận thay sáng mai
620373,151 trần đăng ninh cầu giấy hà nội
620374,Bạn oei ship sớm giúp mình nhé để mình còn bảo người ở nhà nhận
620375,Bạn ơi vậy phải chắc chắn giúp mình hôm nay nhé Vì mình còn phải báo người đợi ở nhà nữa
620376,Ok vậy chiều giúp mình nhé để mình báo người nhận chiều vậy
620377,Bạn ơi mấy giòe ship đ n để mình dặn nhân viên nhận hộ
620378,Bạn ơi cho mình lấy bộ này
620379,Ship về số 1 phạm huy thông ngọc khánh ba đình đối diện đài truyền hình Vtv 
620380,Đt 0906183278
620381,Ship sau 1 rưỡi nhé bạn Tổng của mình bao nhiêu 
620382,Chuyển trước 5h chiều giúp m8jhf nhé
620383,Bạn ơi chưa chuyển cho mình à
620384,151 Trần Đăng Ninh cầu giấy bạn
620385,Tầm mấy giờ để mình còn bi t
620386,Bạn ơi tùe chiều mình ko nhận được cuộc đt nào bạn ạ
620387,Vì mình đợi hàng bren Shop mà nên có số lạ mình ko nghe là mình sẽ gọi lại ngay
620388,Bạn check lại xem đúng chưa nhé 0906183278
620389,Gh này coa đệm ko shop và giá nhiu gh này
620390,xe nay bn vay sh
620391,gh nay bn vay sh
620392,sh có đồ gặm cho be hk
620393,Bn va sh
620394,Xe đẩy vovo gia bn sh
620395,E lay loại 1 chiều màu xanh
620396,Có tặng kèm j ko sh
620397,Van có thanh chắn va túi pk sh
620398,Có bao hanh ko sh
620399,Xe nay voi xe baby thonre sh co chứ
620400,Cai màu nay la y hinh pk c
620401,Vòm rông pk c
620402,Có ship cod ko c
620403,Vay thẻ bao hanh 1 nam pk c
620404,Vay ha c
620405,E co hoi ben shopee ko thay tl
620406,Neu lay 1490 thi e lay o day lun di c ơi
620407,Sao e trả giá ben đó c nào lại kêu e 1490 la sao c
620408,Có mà c
620409,Ua ma sao chi lay màu xanh thui c
620410,E lay xanh lợt đk
620411,Vay cug dc
620412,Sao c ko xu ly don lun c
620413,Lau vay
620414,Cho c hỏi bàn ăn dặm
620415,C phân vân giữa mastela và newber
620416,Bàn nào kích thước chỗ ngồi rộng hơn và vững hơn
620417,C cảm ơn em
620418,Và cho c xin giá 2 sp này nhé Cảm ơn e
620419,Uh th e nào tốt hơn
620420,Xin tư vấn mình muốn mua thảm cho bé ạ 
620421,Cho mình hỏi kích thươ c chất liệu và gia a 
620422,Mình co những loại nào ạ 
620423,Shop có gh ăn dặm ko a
620424,cái mastela mẫu mới ấy
620425,Gh này bn a
620426,Trc c bán bn a
620427,K nhập nữa hả c
620428,Th gần giống mẫu trên nhi
620429,Bao giá mình
620430,Chiec này bn shop oi
620431,Có video xem chi c xe ko shop oi
620432,Phí ship jo xe về an giang huyện tri tôn bao nhiêu tiền shop oi
620433,Xe này là xe tập đi hả shop oi
620434,Nó nặng ko ạ
620435,Sợ nhẹ bé nó đẩy nhanh té
620436,Có nhạc và đồ chơi phải ko ạ
620437,Ship về an giang ship chậm phí ship bn ạ
620438,Hqua m đặt thảm ô tô của shop trên shopee
620439,Hnay vào xem lại đơn hàng ko thấy nữa nghĩa là đã đc duyệt phải ko
620440,Khi nào thì m nhận đc hàng vậy
620441,Vì mình để địa chỉ gửi hàng ở cơ quan mình
620442,Mà ko bi t thảm có to ko nữa
620443,M có chở đc nó về ko
620444,M ko chat đc bằng shoppe
620445,Vunhat90 b ak
620446,Hqua m đặt 1 thảm 1 áo rảnh tay hút sữa mà
620447,Hnay ko thấy đơn hàng nữa
620448,Tên là nhatvu90 b ak
620449,Th là có hả b
620450,Thảm có to ko
620451,M chở về đc ko
620452,Khi nào ship b nhỉ
620453,Đấy đc cơ quan m
620454,Mai ko làm việc
620455,Nhờ shop tư vấn hộ m với
620456,Quà đầy tháng cho bé thì nên tặng j đc b nhỉ
620457,Giá tầm 1tr đổ laii thôi
620458,Xong r b ak
620459,Đợi ko thấy b tl nên m mua rồi
620460,Từ hôm đấy mà
620461,Cho m hỏi bên b còn giươg nay ko ạ
620462,Da vâg cam ơn b có gi m báo lại ạ
620463,Dạ qua shopee m ko bi t
620464,115 n ko ck khoản đc ạ 
620465,Dạ m ở bắc giang
620466,Cho m hỏi xe này bn ạ
620467,Xe như ảnh là bn ạ bạn
620468,Gập đc đấy ạ
620469,Có màu khác cho bé trai ko ạ
620470,M lấy xe này
620471,M ck khoản nhé vi bên b ko ship cod
620472,Ơ mà xe này là bn ạ
620473,M lấy loại tốt 
620474,1450k ạ
620475,Để m ck cho b
620476,B oi m gui rui nhé ktra nhan dc bao m
620477,Ơ quên ko thanh táon tiền thảm luôn
620478,Não th 
620479,Cho m hỏi cái bộ này cho e bé ăn đc ko ạ
620480,Rẻ vậy ạ
620481,M muốn loại ngh ăn dặm cho e bé 4 tháng lớn luôn
620482,B tư ván giúp m
620483,Dia chi nha người nhận sô 21 ngo 19 thanh thiên lê lợi tp bắc giang tỉnh bắc giang Sdt 0988003618 
620484,B gửi cái xe về đây cho m ạ
620485,Còn đồ khác của m m lấy 1 loạt xog gửi cho m
620486,Th b gửi xe về thành phố nhé
620487,Chứ ko về thành phố phiền lắm ạ 
620488,B hỏi xe về b n xe thành phố ko thi gửi hộ m
620489,Còn ko mà chỉ vào thành phố thi thôi ạ m nghét mấy bố xe huyện lắm 
620490,Toàn dình cãi nhau thôi
620491,Dạ vâg cảm ơn b ạ 
620492,Cho m hỏi chiều hay mai ban gửi ạ để m dặn người lấy
620493,Vag th mai cug đc ạ
620494, ngh chát thật 
620495, bố cháu đag phản đối vì nhà đag quá nhìu đồ dành cho con 
620496,Da vag cảm ơn b M sẽ báo lại sau ạ
620497,Shop có đồ j gặm nướu cho trẻ ko ah
620498,Bên m có giao sỉ ko shop
620499,máy hút mũi này bn ạ
620500,quây bn shop
620501,bể bơi thành cao giá tnao vậy shop
620502,shop có thanh chắn giường k ah
620503,cái này m thu lại có dễ k shop
620504,shop m có shopee k
620505,m ship về thái bình thì bn hả b
620506,m mua 1 thanh thui b
620507,giá ship hơi cao nhỉ
620508,ui nay shop xả thanh chắn à
620509,htrc quên k bảo ship
620510,th b ship mình nhé
620511,loại 2m ấy b
620512,b ship m nhé
620513,0339500763 Trang tổ 1 thị trấn Đông Hưng huyện Đông Hưng tỉnh Thái Bình
620514,à mà giường nhà m là m8x2m
620515,m lắp vào chiều dài thì lấy thanh 2m đó phải k b
620516,vì chưa hiểu cách lắp kb có bị kích ko
620517,m lấy thanh chắn với 1 gấu nhé
620518,lắp thanh nào thì ok hả b
620519,tiền ship gửi sau hả b
620520,m ck r đó b
620521,gấu nơ xanh hình tnao b nhỉ
620522,Giuong nay bnhieu 1c zay
620523,Lieu nay bnhieu
620524,Shop m có nôi này k b
620525,Giá hiện tại nôi này bên mình là bnhieu vậy shop
620526,Có ship về hải phòng ko bạn
620527,M muon mua bo feu gia bn shop oi
620528,M cam vo day turing may khac dc fai ko shop
620529,Tai m dang sai ameda
620530,Amela
620531,Ohm cau
620532,Hang xach tay ng nha cho
620533,To bi thieu cai feu
620534,The moi chet
620535,Cau noi maymon re hon
620536,Sao m tinh feu medela re hon 50
620537,Chup may ha cau
620538,Koko
620539,La sao la sao huhu
620540,The la xong
620541,The cau kiem dum to nha
620542,Kho cai la hai ben khac nhau thi fai dung khac
620543,Ba chi ben canada cho
620544,Ai ngo may hai mon
620545,Cam on shop n n nha
620546,Cau kiem lai nhe
620547,Co bao to
620548,Chi to noi do trong benh vien ho tang nen ko biet ben ngoai co ko
620549,O canada cau ak
620550,M nghe medela tot hon
620551,Khi nao cau check co pheu nt to nhe
620552,Thanks cau n lam do
620553,Nong lam
620554,Co van ko cau
620555,Cai nay nua cau oi
620556,Ko co ko dc cau oi
620557,To thieu hai cai do
620558,E co loai nao gia re sai Hai ben tam 1 tr ko
620559,Tron bo lun ha e
620560,Ben e co bao hanh ko
620561,Co xep lai dc ko shop
620562,Shop mình còn chăn lưới của Thái không a
620563,Dạ bé trai
620564,Giá bao nhiêu hả c
620565,Nãy em thấy có hàng trên shopee nhưng không đặt được mã chăn này họ nói bên vận chuyển ko hỗ trợ ship
620566,Giá chăn là bao nhiêu a
620567,Bé trai shop ạ mình lấy màu xanh
620568,Với chậu này
620569,Có ship được trong hôm nay không a
620570,Ukie a
620571,C ơi còn không
620572,Sáng mình có nhắn mà
620573,Chăn lưới Thái nhưng shop kêu để check lại xem còn màu xanh không
620574,Mình đợi mãi ko thấy nhắn
620575,Bạn có ship đc trong hôm nay ko a
620576,Th cho mình một chăn lưới xanh
620577,Một chậu này
620578,Trang 0904780087 Số 91 ngõ 119 Giáp Bát
620579,Okie ship giúp mình luôn nhé
620580,IB
620581,Edgar Baby xe nà bn vậy sjop
620582,Tớ hỏi giá nôi rung mà
620583,Đồ choi nay bn vay sh
620584,Loai nay kich thuoc bn
620585,Bên mình có máy pha sữa ko ạ
620586,Cho mình đặt mua 1 bình nhé thủ tục mua bán th nào ấy nhỉ 
620587,thứ 7 mình ko qua lấy đc bên bạn có ship ko 
620588,phí ship th nào ấy nhỉ 
620589,mình là Tuyền nhà số 25 ngõ 336 Nguyễn Trãi ngõ cạnh trường Nhân Văn mobi 0983 55 28 24
620590,Nguyên bộ này bao nhiêu shop
620591,Cho mình hỏi gh này có gấp lại dc ko ạ
620592,Shop cho mình hỏi thanh chăn giường còn 1m5 ko
620593,Mình muốn mua 1 lúc nhìu sp của shop nhưng mà tiền ship trên shoppee tới 1 triệu hơn luôn
620594,Tiền ship cao quá shop ơi
620595,này nhiu ạ
620596,B ơi cho mình hỏi mẫu xe đẩy này còn k ạ 
620597,B đặt 1 chăn lông cừu xanh 199 lê đại hành f13 q11 tphcm Thảo 0906857655
620598,Dạ b cho mình link shopee sp này nhé
620599,Shop ib minh giá bể bơi vs ạ
620600,Thảm nay bn ah shop
620601,Nguyên set này bn shop 
620602,shop ơi cho mình xin giá đầu tàu hỏa có nhạc winfun ah 
620603,Cho mình xin hình sp thật vs ah
620604,Mình ở tp Hcm
620605,Mua qua shopee bạn có link sp này ko
620606,Mình search ko có sp này
620607,Mình đặt mua rùi ah
620608,Mẫu này ở shop còn hk ạ
620609,Phí ship về ninh thuận bao nhiêu ạ
620610,Mua trên shopee miễn ship hã shop
620611,Nãy e có đặt mà lại tính phí 15k ạ
620612,Nên e thắc mắc
620613,À vậy hã c
620614,shop cho e hỏi bộ này bn vậy ạ
620615,dạ vậy e xem rồi inb shop sau nha shop
620616,C ơip
620617,E muốn lấy sỉ đồ bên mình
620618,C giao k ạ
620619,Chăn còn màu xanh k shop
620620,Hàng sx tại đâu vậy b 
620621,Thì mình vẫn bi t vậy nên mới hỏi sx tại đâu chứ bạn Vì hàng này hàng xuất Nhật mà 
620622,Mình bi t bạn ơi
620623,Vì hàng xuất khẩu có thể sx tại Việt Nam Cambodia hoặc TQ tuỳ loại mà
620624,Th nên mình mới hỏi
620625,Có j đâu nhỉ
620626,Vì mình có mua hàng TQXK
620627,Nên mình bi t
620628,Th ship về Cần Thơ bao nhiêu bạn
620629,À quên th chăn bao nhiêu ạ
620630,Vải sợi tre hả bạn Có nặng k Trẻ sơ sinh dùng dc k bạn
620631,Ship cho mình 1 cái màu xanh nha Đảm bảo chất lượng nha bạn Hihi
620632,Ship về địa chỉ SML boutique bờ hồ xáng thổi p An cư q Ninh kiều tp Cần thơ cuối đường Đề Thám rẽ trái Người nhận thu nhân 098 6766995
620633,Xanh dương 
620634,Tầm mấy ngày vậy b
620635,Sao mình chưa nhận dc hàng nữa ak
620636,B ơi túi này giữ ấm đc k 
620637,Nôi này giá nhiêu vậy bạn Gấp gọn dc k 
620638,Cả 2 đều 295k ạ
620639,Có đăng sp trên shopee ko ạ
620640,Cái này bn b 
620641,Alo shop ơi còn màu khác ko ạ
620642,E muốn mua trước t t
620643,Chị mua chi c xe đó có ship ko
620644,Qua t t mình có lại ko he c
620645,Xe này á c
620646,Shop ơi có xe về chưa
620647,Có xe rồi phải ko shop
620648,Mẫu này giá nhiêu vậy e
620649,Nhiêu 1 bộ vậy shop
620650,Lấy e 1 bộ
620651,Còn bộ này giá sao shop
620652,Vậy lấy e 2 bộ nhe 1 bộ gậm nướu và 1 bộ xúc xắc nhe
620653,PG3 02 vincomshophouse số 1 đường 3 2 p 5 Tp vị Thanh tỉnh Hậu Giang Sdt 0973839773 Thảo
620654,Vậy thôi khỏi đi shop
620655,Cho hỏi cũi này bn shop
620656,Link shopee của shop k vào đc hả shop
620657,Ly này b có đăng trên shopee k
620658,Con này giá bao nhiêu vậy shop
620659,Giờ còn ship cod k b
620660,Xe này giá bao nhiêu vậy shop
620661,Khi nào mới về lại ạ
620662,Có hàng shop nt hộ mình với được k ạ do mình cha bé nhỏ nên nhiều khi k theo dỏi được
620663,Dạ cám ơn shop nhiều
620664,lúc trước mình có mua máy tiệc trùng bên shop nhưng h máy hok vào điện ạ
620665,H mình muốn sửa thì phải đ n đâu ạ
620666,Dạ dc 2 năm rồi ạ
620667,Mình hok mua nữa mình xin địa chỉ để sửa loại máy này
620668,Dạ h t bảo hành rùi ạ
620669,Ở sài gòn có hok shop
620670,Có địa chỉ nào ở đường Đinh tuyên hoàng ở quận 1 hok ạ
620671,Ở sgon còn chỗ nào hok ạ
620672,Búp be làm bằng gì ạ
620673,Ship vè bình định bn ạ
620674,Mình đặt hàng nhê
620675,Kịp trung thu ko ạ
620676,0934806348 Địa chỉ cty tnhh hào hưng phát Lô ci 2 cụm cn diêm tiêu tt phù mỹ phù mỹ bình định
620677,Shop cho xem tài khoản
620678,Mình đã ck 100 giá trị đơn hàng rồi nha shop
620679,Shop cho mình hỏi là mẫu này vs mẫu thảm mặt trăng thì cái nào kích thước lớn hơn ạ
620680,À vậy mình đặt mặt trăng
620681,Loaik nào oki hơn hả bn
620682,Tốt hơn vs nhiều chức năng hơn ấy
620683,Để t đặt
620684,T thấy cả loaik xuất châu âu nữa
620685,À th để mình đặt
620686,T đặt trên shopee
620687,Bn xác nhận cho t nhé
620688,Xe này nằm đc đk ạ 
620689,Bn cho mình địa chỉ shop với ạ
620690,Đây là loại 1 chiều hả c
620691,Xe v1 bn sẵn k ạ
620692,Mau nay thông số như th nào bạn Giá bao nhiêu 
620693,C ơi e xin giá máy tông đơ này vs ak
620694,Có dễ sử dụng k ạ
620695,C ơi mình có ship cod k c
620696,Dạ vâng cho e xin link đi ạ
620697,E muốn xem thêm rồi đặt ạ
620698,2 loại có j khác nhau vậy c
620699,e đặt hàng rồi c xác nhận giúp e nhé
620700,cho m xin giá giương với b ơi
620701,Nhieu tien v shop
620702,Tất cả lun
620703,Nhà c có bán xe này k ạ
620704,Xe này nhà c còn k ạ
620705,Em mới gọi c mà k dc
620706,Chị mở cửa hàng chưa ạ
620707,E kb đường c ạh
620708,Âu cê c
620709,Thùng có to k c ơi
620710,Để em cbi dây buộc
620711,Ok nạ
620712,C nhờ a ship giúp em nhanh dc k ạ
620713,Em trả 50k
620714,Vì 3h em về quê rồi ạ
620715,Em hóng nãy h c ạ
620716,Em fb cho shop nạ 
620717,Báo giá tủ nhựa giúp em
620718,Máy mới này của shop mới bao nhiu phần trăm vâyh
620719,Mà mình t9 mới sinh
620720,Thì có bảo hành từ lúc sinh ko shop ơi 
620721,Mong phản hồi từ shop
620722,Thé ko con km như trc là dc thay bộ dây mới free khi mua 2300k nua hả shop
620723,Th phụ kiện hút mới là gồm những j vậy shop
620724,Cám ơn shop nhe Mình sẽ liên lạc lại sau nhed
620725,B ơi xe này giá bn vậy ạ
620726,địu bn sh oi
620727,mh xin giá xe nhé
620728,dạ cho e hỏi phí vận chuyển về Cát Hải Hải phòng bn ạ hoặc bên mh có shopee k ạ
620729,mh có đặt 1 chi c xe như hình trên shopee có gì sh gửi cho mhnhes
620730,mình giao về Cát Hải Hp
620731,ui mh ko dùng banking n u gửi Vt thì phí rất cao mà đ n chỗ mh thì rất chậm ấy
620732,vậy thôi ạ thanks sh
620733,C oi E đat quây bóng nay nha 
620734,E o vung tau
620735,E đặt cái 2250
620736,Ok Mai e ck nha To cở nào c Cái niệm e 1m8 đặt đc k 
620737,To qá v lấy e cai 1850k thui c
620738,Thui v lấy e cái 1850 nha c
620739,Mai e ck c
620740,Mai Nhớ rep tn e nha Tại nt mà c tl lâu qá Hi
620741,C ơi C dùng tk nào v Cho e stk
620742,Giờ e ck nha c 
620743,Khi nào đc báo e nha 
620744, Trương Thị Cẩm Lài 0908083707 Đ c 197 Võ Thị Sáu Phường Thắng Tam Tp Vũng Tàu 
620745,C gui bang j
620746,Tới chổ e lun pk
620747,Gui lien gium e nha 
620748,Có video xe bé chạy k c Cho e xem
620749,Khi nào có vìeo gởi e xem đi Rùi e đặt
620750,Shop cho mk hỏi cái quây bé bn ạ
620751,Cả nhà bóng nữa ạ
620752,Nhà mk có thảm cho bé k ạ
620753,Cho mk cái quây lục giác mầu đỏ ạ
620754,Diện tích nó là bn ạ shop
620755,Có thảm bên dưới k ạ
620756,K mk là có cái thảm mầu xanh trải bên dưới cái quây ấy ạ
620757,Vậy cho mk cái quây mầu đỏ
620758,Quán bún chả quạt mai linh Đường 36m thị xã gia ngĩa đak nông
620759,0978443612 Đăng thương
620760,E mua trên shoppe bt mấy ngày có hàng shop
620761,Shop có nhận đc đơn của e k
620762,Shop có chuyển hàng cho mk k
620763,Giabaochip
620764,Mk có đặt cách đây 5 ngày r
620765,Ơ mk có đặt r mà
620766,Thôi gửi k cần qua shoppe đâu cho nhanh
620767,Tại mk đang cần
620768,Quán bún chả quạt mai linh tổ 5 phường ngĩa thành đường 36m thị xã gia ngĩa tỉnh đắc nông 0967443612 Đăng thương
620769,K tt tại nhà à b
620770,Mk có đk mua r mà
620771,Sao k đc nhỉ
620772,Set nay bao nhieu vay shop 
620773,Máy hâm sửa bn vậy shop
620774,Giá bao nhiêu ib mình nha
620775,Ib giá mình nha
620776,Cái nôi đó bạn
620777,Cho c dat 2 phao boi nha
620778, Phao hỗ trợ tập bơi Swim Trainer Hàng về liên tục mới đủ đáp ứng nhu cầu các mẹ Vẫn 02 màu Hồng công chúa và xanh cho hoàng tử bé nhé xem ảnh dưới comment nha các mẹ Mùa hè mà thi u mất em này thì chưa phải mùa hè He he Giá chỉ 120k em Đặt hàng qua Shopee mebebom Freeship với hoá đơn từ 150k nha các mẹ
620779,1 cai mau cam va 1 cai mau vang
620780,Mau vang cho be 20kg tro len pk e
620781,Cho e hỏi bộ xúc xắc con set 5 món ko c
620782,Cho e 1 bô hen
620783,450 12 hoa hao p5 quan 10
620784,090831634
620785,Cho minh them cai nay nha
620786,Xuc xac 5 mon va luc lac deo tay be
620787,Ship theo dia chi o tren cho minh nhe
620788,Cho minh so vcb
620789,Minh se ck
620790,Cho c xin giá thằng nay luon
620791,De c ck luon mot lần ship
620792,Khi nao se co e
620793,C ck tien 2 mon đồ choi roi nha
620794,E gui den 450 12 hoà hảo phường 5 quận 10 nha
620795,0908316034
620796,Con ho boi khi nao co hen
620797,Vay cho c gia voi
620798,De c dat luon
620799,Kich thuoc sao e
620800,Va 1 bộ gồm gi
620801,Cho c 1 bo nha
620802,Chac chan mai co hang ha e
620803,E ship luon cung dia chi tren dum c
620804,C tra tien mat luon
620805,Co ho boi ve chua e
620806,Vay c đợi
620807,E giao chung voi đồ choi luon nhe
620808,Đung roi e
620809,Cho c hoi
620810,Bể bơi 1 bộ gồm gi e
620811,C c thong tin de c biet c kiểm hàng nha
620812,Ko co đồ bơm ha e
620813,Ah vậy để c xem lại vụ bể bơi nha
620814,E gui trước 2 món c đã chuyển khoản dumg
620815,Bể bơi để c hỏi lại
620816, XẢ KHO HÀNG MỚI Dọn kho ra còn 20 chi c bát này hàng quà tặng của Bobby Hàng nhập khẩu chính hãng mới nguyên package Vỏ có thể xấu rất nhẹ do x p kho Giá xả kho rẻ bèo nhèo 29K chi c các mẹ chốt nhanh tay ạ
620817,Cho c 2 cai chen luon hen
620818,Vay e giu dum c 2 chen
620819,C xem co gi mua them de gui luon
620820,Sao c chua nhan duoc hang vay e
620821,Đồ c đã thanh toan sao c van chua nhan duoc vay
620822,Tu 6 5 toi gio roi
620823,may hut sua medela 1 ben gia bn b
620824,Co nhung loại nào b nhỉ minh mới sinh càn mua de kich sua cho nhieu em bé minh ti
620825,Bạn tvan cho minh nhé
620826,Tam 2tr do lại co lói nao o b
620827,Minh chưa dung bap h
620828,Ben baN co ng den tu van va hupng dan dc o
620829,Cho t xem anh sp nhéa
620830,TrọN Bo day ha B
620831,À minh la 1 bộ như ảnh
620832,Fai o
620833,Minh ở nội thanh thì ship luôn dx fai o b
620834,Toi 7h ship cho minh nhé
