senid,sentence
729391,Ủa phải trả giá nữa hả
729392,Vậy mình trả giá ở đâu shop 
729393,Mà cái này nhạc có lời ko shop
729394,Minh mua le shop co bán ko ạ
729395,Áo gối vỏ chăn và bọc nệm
729396,Cái này gia bn vay shop
729397,Bạn ơi tư vấn giúp mình gh ăn dặm teknum 2016 và gh mige với 
729398,B ơi quây này giá bn và kích thước th nào b
729399,Bạn có bán cả thảm kèm luôn ko
729400,Cho mình đặt quây size M góc tròn nhé
729401,Màu này nhé b ui
729402,Mình ở HN thui
729403,Mai bạn giao cho mình qua đchi toà hoà bình greencity 505 minh khai phía sảnh đường mạc thị bưởi Sdt 0916662016 Thời gian nhận từ 3 5h chiều
729404,B nhé 
729405,Uki thanks b nh 
729406,B oi xe này bn
729407,Cho mình 1 con poodle này nhé b ui
729408,Qua 208 khâm Thiên giúp mình nhé
729409,0916662016 trong hôm nay hocwh mai nhé
729410,Đúng r b ui 
729411,Vói 1 thanh chắn này nữa b ui
729412,Xe này có màu khác k b yi
729413,Cho mình 1 nâu nữa nhé
729414,Vậy chốt mình 3 món đó nhé
729415,B ơi đồ chơi câu cá này còn ko b
729416,Ship mình luôn với
729417,208 Khâm Thiên giúp mình nha 0916662016
729418,Oki b nha càng sớm cnafg tốt cho mình nhé 
729419,B ơi ship mình với nhé
729420,Hx giao sớm trc 5h dc ko b ui
729421,Oki b mình hổ cho bạn có j lấy thêm mình báo sau nhé
729422,B cứ ship trc bộ đồ chơi nhaaaa
729423,B oi mai ship mình màu này nhé
729424,Oki b ui giao luôn cho mình dc thì tốt nhaaaaa
729425,Mình cần nhận trc 3h chiều b ui
729426,Ơi b tối thì giao từ 7 8h nhé b ơi
729427,6h mình chuea về đ n nhà b ạ
729428,B ơi xe này bn b nhỉ bé 2 tuổi dùng dc chưa b ui
729429,B ship cho mình qua 208 Khâm Thiên nhé
729430,0916662016
729431,Trước 4h chiều nay dc ko b
729432,0916933686 đổi số này giúp mình nhé
729433,B nhớ sdt sau nha
729434,0916933686 hoặc bây h b gửi luôn cũng dc b ơi
729435,Ship ngoài mình trả nhé
729436,em muôn hỏi xe tron tâp đi
729437,em ở quận 7
729438,mâu nay
729439,có ship sai gon k
729440,cho minh xin link shopee
729441,phí ship cao qua nhỉ
729442,nhưng 63k
729443,em đăt rồi đoa
729444,bên shop xác nhận đi
729445,Cho mih hoi ghe nay bao nhiu tien
729446,Cai nay va hag aricare cai nao tot hon nhi deu cua trug woc
729447,Alooo mih vua vao fb thay ban co ban tren shoppe mih vua dat hag tren day k biet ban thay chua
729448,Ship vao sg so dt 485048 duoi mih dat mau xah dam la mau nay dug k
729449,Vua thay shop ban da xan nhan don hag
729450,Ban chek lai xem Dug k Va mih dat dug mau mih muon chua Mieu ta tren mag kho wa
729451,Uh oki ban Nhug mau mih dag ky tren shoppe la dug mau mih gui dug k
729452,Minh thich mau nay lam
729453,Mau nao Ban dag gui hih ha
729454,Uh dug roi ghi xah dam
729455,Oki vay doi ship
729456,E oi cho c hoi con bo choi cat k Cho be trai nhe
729457,The gui link c nhe
729458,Do trug woc ha e Nhua tot cho be choi an toan fai k
729459,E oi bo nay nhiu vay e Cho c kih thuoc
729460,Chi chi mua way va cau truoc dc k e 
729461,Thi bao nhiu e
729462,Ship sg thi bao nhiu nua e
729463,Cai way kih thuoc bao nhiu vay e
729464,Oh okii
729465,Neu chi mua ship o sg thi gia ship sao nua e
729466,Ohh Con neu c ck thi bon e ship ntn
729467,C k can gap
729468,357a 21 nguyen trong tuyen f1 quan tan binh tph
729469,Mau ghi xah nhe
729470,Nha chi xe tai vao dc e nhe
729471,Oh vay la tc 4180 ben e ho tro 180k di c tron 4000
729472,Mua hag to wa troi ma xa nua ma cug dat tien Hai ben cug ho tro 
729473,K biet shoppe thi re hon k
729474,Uh e thu cho c link voi
729475,Thr day vay ben e ho tro khah 180k di
729476,C tron 4trieu
729477,E hoi thu sep xem
729478,Thr ho tro 80k di vay 
729479,Oki e co gi c bao nhe
729480,E oi chi lay tron bo thi co uu dai gi k 
729481,E oi chi lay ca bo thi co uu dai k gii
729482,Neu ship 400k thi c se ck truoc 50 nhe roi nhan dc c ck tiep
729483,Thu ho la gi Cck e ma
729484,K y la c nhan dc hag day du c ck tiep cho bene
729485,The ntn La mua tron bo ck 100 roi bon e ship
729486,Ck 100 cho e la nhiu nhi
729487,Cau truot nay la cau nao e 
729488,Day c muon y nhu hih ntn
729489,Dug nhu gia hwa e bao
729490,Full bo 4490
729491,The lua xih du roi cau truot rieg thi gia la khac ha e
729492,The cai nao tien hon
729493,Hola la cai chi chon ay ha
729494,Dau cho c xin hih voi
729495,La nhiu tien e
729496,La bo full 4490 xah xam c dih mua dug k
729497,Thi c dag muon lay bo day ma
729498,The chot bo day va gia ship Nua la nhiu
729499,La tc 4890 dug k
729500,Oki e cho c so tk
729501,The mua ca bo co uu dai gi k
729502,Oki e lat c ck nhe
729503,Xog c chup hih gui
729504,E oi gio c ck nhe
729505,Bua gio lu bu wen mat
729506,Mih ship mat khoag bao lau e nhi
729507,Tran ai thy ship ve 357a 21 nguyễn trọng tuyển f1 quận tân bình 0909485048
729508,Oki e nho lay mau cam xah e nhe
729509,Xah
729510,Uhh day bo nay
729511,Dc tag tham va bog dug k
729512,Uh day du roi ma
729513,Thảm là cũng màu giog hih ha
729514,Thay sọc xanh trag
729515,Cai nay bao tien vay e
729516,Oh oki thaks e
729517,E oi thah chan nay hag cua o dau Va bi nhiu tỉen e nhi
729518,Oki de c xem
729519,Cho c hoi xe nay cua o dau Vay e Bao tien
729520,Co ben chac chan k e
729521,Tai c dag cna xe di du lich
729522,Bộ liên hoàn hola giá bao nhieu ạ
729523,Tói shop máy giờ đóng cửa vạy ạ 
729524,Có hàng sẵn ko ạ
729525,Bô này gio giá sao shop
729526,Chièu shop ship cho mình dc ko 5h Số 1 trần Qu Cáp 0968955567
729527,Còn màu hông ko ạ
729528,Màu xanh như hình hả ban
729529,Shop chưa ship cho minh ạ
729530,Chièu shop sip cho mình cái bập bênh màu hồng này nhé
729531,Số1 Ga tran qu cáp 8h shop ship dc ko
729532,Vang Lúc đáy mình mới vè d n nơi
729533,0968955567
729534,Lấy mình con này luôn 
729535,Luc dâu nó thé này ạ
729536,Bạn ơi mình láy minh thú nhún thôi Xe bap bênh Ông bà mua mát loại kia rồi
729537,Shop báo ship cho mình di nhé
729538,Bộ nay giá sao shop
729539,Tách ra dùng 1 vãn dc ạ
729540,Bộ này sả còn bao nhieu shop
729541,Sip về tỉnh mất phí nhièu ko ạ
729542,Bạn có thể cho mình xem dóng hộp nó to thé nào Dc ko
729543,Mình sả d n khi nào ạ
729544,Mình dặt mùng9 láy dc ko ạ
729545,Minh có tk viettinbank ko ạ
729546,Xe này ko gấp dc ak
729547,Bạn gửi cho minh xem dc ko
729548,Nặng máy kg shop nhỉ
729549,Giờ có ship cái này ko shop
729550,Mau này hét hàng a shop
729551,Còn mỗi càu trượt ak
729552,Mình dặt trên shopper Còn màu hồng ko ạ
729553,Shopper 5 ngay cái cầu trượt roi mà chưa tháy hàng gửi vè shop nhỉ Mai minh di làm mát ròi ko có ai nhân dc hàng
729554,Trong shopper có ko ạ
729555,Cước Tỉnh thé nào shop
729556,Thanh hóa ạ
729557,Sao trong shopper lai rẻ hơn vay
729558,May hôm nưa minh ra HN ròi ship cho minh vay
729559,Xe này bán chưa ạ
729560,Vâng Chắc là ko láy dc ròi Toàn hôm dang dinlam Ben mình bán rẻ hơn các shop Hàng còn về dợt nào nữa ko ạ
729561,Vâng Ra tét có mình lấy vay
729562,Mình còn cái này ko shop
729563,Ok ạ 27 âm mình ra shop ship cho minh Giờ mình báo sau nhé
729564,Cả bộ này giá sao ạ
729565,400 là giảm còn 1450 ạ
729566,Giờ shop có ship ngay dc ko ạ
729567,Shop thu grab ak
729568,Từ đấy d n Ga lê duẩn lau ko ạ 20p nữa là tàu chạy 
729569,Ship cho mình xe này với
729570,Xe này còn bao nhiêu ạ Còn dc tặng bộ bảo hiểm ko ạ
729571,Có xe màu vàng chưa sop oi
729572,Ship cho minh luôn cái Gọi 2so ma ko nhấc máy
729573,Quá buồn
729574,VAng Mình ko để hôm nay CN
729575,Bảo hộ to ko bạn
729576,Cái xe 3 bánh nadie áy ạ
729577,Xe mới dây ạ 1750 ấy ạ
729578,Sip ve Thanh hóa phi tinh tn vay ak
729579,Chièu tói ship cho mình cái thảm toyhouse 1m4x2m với Mình dang di xe ra
729580,Số1 Ga trần qu cáp 0968955567
729581,Mới thêm hình ạ
729582,Mình ở dó từ 19h20 den sáng mai
729583,Shop mình có cái bô 3in1 chưa
729584,Lấy cho mình hình chữ nhé
729585,Có bô chưa mình lấy luôn
729586,Lúc nào mới có tiép ak 
729587,Giờ mình còn bô nào ko ạ
729588,Láy mình mầu hồng nhé
729589,Mình có đũa cho trẻ tập cầm ko ạ
729590,Xe này giá vãn 1750 ak shop
729591,Thanh chặn cửa giá sao shop
729592,Cứ th là về lắp thôi nhỉ 
729593,Tói ship cho mình cái nhé 0968955567 Số1 trần qu cáp
729594,Uh Thé dẻ qua lễ Minh láy vạy
729595,Mình giờ ko ở HN Bạn dể hôm kia ra di làm láy dc ko
729596,Bộ này giá bn vaybshop
729597,Còn màu hồng ko ạ 
729598,Tối 8h bạn ship cho mình cái nhé Cả con voi màu hồng nữa Số1 trần qu cáp 0968955567
729599,Mọi lan vẫn láy 8h tối mà
729600,Láy 4 làn ròi mà
729601,Uh 8h cho dén máy giờ cũng dc Vì mình di xe ra giờ đó mới dén HN
729602,Cái vali mới ra giá tn vay ạ
729603,A ssip hang số bao nhieu vậy
729604,Từ chiều dén giờ chưa thay gọi
729605,Sip báo kho h t hàng ạ
729606,Chả thấy báo gì 
729607,Hôm nào mình ra HN mình báo nhed
729608,Nay sop có ship hàng ko
729609,0976653694 Só1 trần qu cáp Ga Hà Nội Lấy mình cái chặn cửa và con voi màu hồng nhé
729610,Cửa nhà mình 70cm
729611,Từ bao nhieu ạ
729612,Hix Nhà mình dc có 73
729613,Thé láy cho mình cái bàn toy houre nhé Màu hồng
729614,Sớm hơn dc ko
729615,Vì người khác nhận hộ Cái bàn dấy bao nhiêu kg ạ
729616,Ok Có còn con voi ko ạ
729617,Voi phun nc ấy
729618,95k ay
729619,Gọi vào số mình dã gửi nhé
729620,Chưa có hàng ak ban ơi
729621,Làm ăn như lol áy 2 lần rồi bực mình ghê
729622,Mua bao nhiêu hàng ròi mà còn thé này
729623,Dẻ mình 1 bộ bàn màu hồng nhé Gh tựa
729624,Ok ạ 27 minh ở HN ship cho minh nhé
729625,Mình dặt bộ bàn lego ummo nhé Bộ bàn ghé kia mình láy sau May quá đợi shop May shop kia toàn hơn 2tr
729626,27 mình mới láy Mình dang trong SG quay ra
729627,Mình láy luôn con voi phun nước nữa nhé
729628,Hôm đó mình ra ròi báo lại ko lại quên
729629,Chièu bạn ship cho mình cái nhé bàn đồ chơi voi phun nước màu hồng nhé Số1 trần qu cáp 0968955567
729630,2h 3h ship cho mình Vâng 
729631,Minh láy voi màu hồng sao lại màu xanh thé
729632,Bạn đọc lại di nhé 
729633,Minh thi sao cũng dc vì bé nhà mình là con gái Nhưng lúc mình dã dặt hàng ntn mình lấy như th đó thôi Shop dã như vay thì minh ok ko sao cả
729634,Ok Ko sao cả Nhận ròi mất công 2 bên thôi 
729635,Lần này sao nhnah thé 2 làn trước Thì chả ra gì 
729636,Dang sale hàng winfun shop còn thuyền ko ạ
729637,Máy tuỏi là chơi dc ạ 
729638,Shop minh còn voi này ko ạ
729639,Mình có mâu nay ko ạ
729640,Bộ này nhà minh giá giờ tn ạ
729641,size 
729642,co 1m8 k
729643,cai nao la bi ngo
729644,4 tháng đã dùng đc chưa ạ
729645,Ship hà tĩnh k b
729646,Bên m có thanh chắn giường k ạ
729647,Báo giá m giường 1m8 *2m
729648,B ship qua đường bưu điện hay sao ạ
729649,2 thanh 2m c ạ
729650,Veef ha tĩnh hhes
729651,Gửi m ảnh thanh chắn giường 1m8 và 2m nhé
729652,Cho mih hoi bo nay bao nhiu
729653,Gia 95k thi goi cho mih mot con
729654,0913877179
729655,Cai be tieng giang
729656,Cho mih xin gia cai giuong ngu cua be di shop
729657,Mẫu này bao nhiêu shop 
729658,Có màu ghi ko shop
729659,Xe này là 1 chiều hay 2 chiều vậy
729660,Xe này nặng bao nhieu vậy
729661,Mình ko thấy thông số kĩ thuật của nó
729662,Shop ơi thảm nhạc thỏ tai dài và gấu ôm trăng có khác nhau ko sh
729663,Còn kích thươcs và chất liệu như nhau à bạn
729664,Mẫu gấu bên bạn mấy tiền th 
729665,Cho mình giá của cả 2 loại nha
729666,Mẫu gấu có hàng luôn ko chị
729667,Mẫu này thanh l bn vậy sh
729668,Vậy n u mình muônd chắn 3 mặt thì phải mua 3 thanh ả shop
729669,Dạ Có gì mình tham khảo N u mua mình tl lại sau ạ
729670,Cũi cho bé có những loại nào shop ơi 
729671,Shop có máy xay hấp babymoov plus k 
729672,Máy bảo hành th nào vậy shop 
729673,Còn màu đen k 
729674,Shop có loại hút mũi nào tư vấn giúp mình với
729675,balo còn k shop ơi
729676,chiều nay shop ship qua 185 Giảng Võ trước 5h chiều được k 
729677,không phải shop ơi
729678,địa chỉ shop ở đâu nhỉ 
729679,hic xa quá mình lại cần trong chiều nay để tối đi tặng ấy
729680,shop có cách nào ship sớm hơn giúp mình được k 
729681,cao hơn là bn bạn nhỉ 
729682,Bên m còn gh này k ạ
729683,M đặt ạ
729684,M ở tận vĩnh phúc cơ
729685,Vâng th để hôm nào tiện lên Hn m qua lấy
729686,Xe day co my bn a
729687,Vovo 2 chieu bn a
729688,Lot dem em ko a
729689,S minh ngoai ha noi phai ko a
729690,E o hcm neu muon mua thi sao a
729691,Bo goi comfy baby bn a
729692,Cho e xem hinh dc ko a
729693,E mua thi dat tren shoppe luon a
729694,Sao e ko mua shoppee dc a
729695,Cu bao loi hoai a
729696,Vay c e xin stk
729697,Co stk sacombank ko a
729698,Ck dung so tien 239k a
729699,Co phi ship j ko a
729700,Cuoc bn a
729701,Nay con ko s
729702,Chup e xem hinh that cai dem nam dc ko a
729703,O nha e cung co ma dem nam ko em
729704,Luc nao cung phai lot them men het a
729705,Di du lich gon nhe ko a
729706,Da co thay ma nhin ko ro lam
729707,Bo nay bn vay s oi
729708,Bao gia e mau nay lun nha s
729709,Quay bong voi tham xich du
729710,Thi bn a
729711,Quay nho hon thi bn a
729712,Co kich thuoc ko a
729713,Ko tang tham a
729714,Cho e hoi 1m8*2m minh co the ve rap nho lai dc dung hok a
729715,Da cho e hoi tham XPE la tham nao a
729716,Cho e xem dc ko c
729717,Da vay e lay quay hola 1m8*2m nhe
729718,Tang tham XPE voi 100bong dung hok a
729719,Da e o hcm a
729720,Co bong ro thi them bn a
729721,Da sao e thay la freeship ma
729722,Thanh toan tien hang sao ah
729723,Cho e stk a
729724,2590 k phai hok a
729725,Ok e ck thi khi nao co hang a
729726,Quay co màu nao a
729727,Loai nay co giong loai e dat ko a
729728,Thay ghi freeship toan quoc ma s oi
729729,Loai nay bn a
729730,Nhu mau nay la bn s
729731,2 loai nay co khac nhau khich thuoc thoi ha s
729732,Laoi nao tot a
729733,E doi lay loai nay dc ko s oi
729734,Bo nay co tang kem tham va bong dung hok a
729735,Nay la 2150
729736,Phai ko a
729737,E lay mau ih nhu vay trang xanh ghi nhe
729738,Ship tu thanh toan la bn a
729739,Con giam 15 con bn a
729740,Ship khoang 250 ko a
729741,Cai nao loi hon a
729742,Fs a
729743,Hom wa s bao e la quay hola ship 250 k
729744,Thi loai nay chac cung nhu vay a
729745,Vay fs
729746,E thanh toan 2390k
729747,Thu 2 e ck nhe
729748,Bong mua them thi tinh sao a
729749,Vay e lay them 30 bong nhe
729750,Cho e hoi size L la bn a
729751,Size L cua toy house dung roi a
729752,No la 1m8 1m5 65 dung ko a
729753,E mua loai nao la dc tang tham cung kich thuoc voi quay dung hok a
729754,Hay tham dc tang chi co 1 size a
729755,Vay size M
729756,2390k 30 bong
729757,Bao gia e xe nay nhe
729758,S oi minh co loai nay ko a
729759,E ct mua quay chi toy house 1m98 roi a
729760,Kiem tra tai khoan giup e a
729761,Quay nhua toy house 1m98
729762,Dia chi 35b sơn kỳ f sơn kỳ q tân phú
729763,Sdt 0938 53 53 51
729764,E ten nguyen thi xuan thuan
729765,E ck 2450 k
729766,Da tron con ko s
729767,E lay goc tron nhe
729768,Da thoi a
729769,De e xem co j mua ko a
729770,Da be gai
729771,Nhug e lay mau trang xam ghi nha s
729772,Xanh trang ghi
729773,Ko lay mau hong a
729774,Co loai nao re hon nay ko s
729775,Cung xe tap di nhu zay a
729776,Mau cu nay con ko s
729777,S co khan giay K mom ko
729778,Khi nao e nhan dc hnag a
729779,Da vay la dc tang 70 qua bong phai ko a
729780,Co kem tui dung bong ko s
729781,Da vay gap tui luoi lai bo vo thung luon giup e dc ko a
729782,De ve ko co gio dung bai day nha bi la
729783,Cho e hoi xe lua winfun khi nao co hang
729784,Da chac ko a
729785,Khoang bao lau e nhan dc hang a
729786,Da e nhan dc roi q
729787,Da s oi kiem tra dum e
729788,Khi nao e nhan dc hang a
729789,Da ok s
729790,Nay bn a
729791,Dang sale ha s oi
729792,E lay 1 chiec nhe
729793,Cho e tk di a
729794,Fb thuan nguyen
729795,35b sơn kỳ f sơn kỳ q tân phú
729796,0938 535351
729797,Khoang may ngay co a
729798,S oi khi nao e nhan dc hang a
729799,Kiem tra sao roi s oi
729800,Sao chua nhan dc hang zay a
729801,Sach vai winfun va lat dat bn s oi
729802,Sao den hom nay e van chua nhan dc hang vay
729803,Kiem tra lai giup e di
729804,Da chua
729805,Ko thay ai goi lay hang het a
729806,Xem lai dum e di
729807,Chu gan 2 tuan roi
729808,Ma hang dot trc e nhan dc ngay ma
729809,Ma sao gan pin vao ko len nhac vay
729810,Hang nay giam gia co con sd dc ko a
729811,Da day a
729812,Em giup e nhe
729813,Bo pin vao roi ma van ko len nhac a
729814,Bi ho mắt
729815,Lam dc roi a
729816,Cam on s nhiu nhe
729817,Cam on s
729818,Voi UMOO bn s oi
729819,Cho e hoi quay nhua toy house co size nao a
729820,Size M lon nhat phai ko a
729821,Chao ship
729822,Cả set nhu nay gia bao nhieu ạ
729823,Ko lấy ngựa ạ
729824,Set nay co phao luôn k a
729825,Bn xien dây c
729826,cho mình hỏi máy hút sữa medela có ch độ hút ko cần cắm điện ko nhỉ 
729827,Mình trc có mua máy của bên bạn rồi nhưng chưa dùng Mình mua máy like new ấy Dùng pin ntn b nhỉ 
729828,khay pin đấy sd đc trong bao lâu vậy b 
729829,cái này mình dùng nhiều lần đúng ko giá nhieu b nhỉ 
729830,Pin này dùng được bao nhiêu lần vậy b 
729831, mình là sau bnhieu lần sạc thì phải thay pin mới b ah
729832,ok cảm ơn b nhé
729833,cho mình hỏi bộ dụng cụ hút sữa của medela có sd đc trong máy tiệt trùng sấy khô ko nhỉ 
729834,Mình muốn mua thêm 1 bộ dụng cụ hút sữa medela thì gias bnhieu b 
729835,Ý mình là bộ phụ kiện ấy
729836,cho mình 1 cặp phễu sz 27 1 bộ cổ phễu và 2 bình trong 150ml nhé
729837,sáng nay ship cho mình được ko nhỉ mình ở địa chỉ 35 hàng vôi
729838,0979 884 601
729839,trước mình có mua máy hút sữa medela pump like new của bên bạn
729840,nhưng dạo gần đây mình hút thấy lực hút bị y u đi
729841,trước đây mình chỉ cần hút ở mức nhỏ nhất
729842,nhưng giờ có những lúc mở mức nhỏ nhất thì 1 bên lực hút rất y u 1 bên vẫn bthuong
729843,mình phải mở lên mức to hơn 1 lúc rồi mới quay trở lại mức nhỏ nhất để hút được
729844,máy bị sao bạn nhỉ 
729845,th chắc đúng rồi
729846,mình thấy 1 van trắng bị rách
729847,th bạn thêm cho 1 mình 1 cặp van trắng nữa nhe
729848,Mình xác nhận lại là mình mua 1 cặp phễu size 27 1 bộ cổ phễu 2 bình trong 150ml và 1 cặp van trắng máy medela pump nhé
729849,shop giao cho mình vào ngày mai nhé Chiều nay mình ko có ở vp
729850,mình thay van trắng rồi nhưng vẫn bị tình trạng trên là sao nhỉ
729851,ok để tối về nhà mình thử xem rồi báo lại bạn nhé
729852,chỗ bảo hành xa quá nhỉ 
729853,trong thời gian bảo hành bên mình có hỗ trợ cho mượn máy khác ko bạn 
729854,Lần trước mình có hỏi shop về việc máy medela pump có thể dùng pin con thỏ để hút
729855,Nhờ shop hướng dẫn mình cách lắp pin ntn với
729856,Máy mình mới mua ở shop năm ngoái
729857,Và cho mình hỏi máy này mang sang Nhật dùng dòng điện 110v có được ko nhỉ hay phải dùng bộ chuyển đổi
729858,mình muốn mua dây cắm điện của máy medela pump instyle
729859,trước mình mua máy của bên bạn nhưng giờ dây cắm bị hỏng mất 1 bên chân rồi nên muốn mua cái mới
729860,Hôm nay ship cho mình luôn đc ko nhỉ 
729861,Shop có bình Pigeon nhựa cổ rộng sz nhỏ ko
729862,Th núm Medela bao tiền hả bạn
729863,Ah bên bạn có núm nào mềm hơn medela mà vừa với bình medela ko ban
729864,Vì mình hút sữa là chính nên mua nhiều bình trữ
729865,Hút xong cho con ti bằng bình đó luôn
729866,Nhg núm medela mình thấy hơi cứng
729867,N u đổi bình khác để ăn thì ko tiện lắm vì ăn 1 bình hút 1 bình
729868,Trc đây mình dùng cac bình trữ của hãng khas thì dùng dc cả núm Dr Brown khá là mềm và vừa cổ bình
729869,Nhg riêng medela lại ko núm vào vừa dc trừ núm medela
729870,Chưa kịp báo lại cho chồng thì lão đã mua mất rồi
729871,Có thể cho tớ đổi núm medela vừa mua sang bình lasinoh ko bạn
729872,Bình lasinoh của bạn là kèm theo núm sz j vậy bạn
729873,Sz S là dùng đ n mấy tháng vậy bạn
729874,Núm lasinoh là dùng dc luôn cho binh Pigeon phải ko cậu
729875,Tớ lấy M
729876,Cuối tuần là tầm thứ mấy th 
729877,Thôi th cho tớ bình Lasinoh núm sz S cung dc tớ bảo chồng quay lại đổi nha
729878,Bình nhỏ cậu nhé
729879,Tks nhe
729880,Cậu ơi bình Lasinoh to bên cậu có hàng chưa
729881,Núm ti của bình to là sz j th cậu
729882,Bé 2 tháng thì dùng sz j được hả cậu
729883,Ok chồng tớ qua mua rui
729884,Tuần trc e có mua xe đẩy Travel bên mình màu cờ Mỹ
729885,E mới dùng 1 lần thui và muốn thanh l 
729886,Chị up giúp e trên page của bên mình dc ko a
729887,Chụp ảnh chèn số đt ấy hả chị
729888,Hay số gì ạ
729889,Số điện thoại phải ko ạ
729890,E làm xong e gửi chi nhe
729891,E gửi chị nhe
729892,C up giúp e
729893,Tình trạng xe là mới dùng 1 lần mới 99 c nhé
729894,Vâng th để mai e chụp lại rùi e gửi chị
729895,Giờ e đang cho chúng nó đi ngủ
729896,Mai e gửi c nha
729897,C ơi em pass dc xe đẩy luôn tối hôm đó rồi nên e ko gửi ảnh lại cho c nữa
729898,E định mua cái hộp mini đựng bình sữa của chị
729899,Cái mới về í chị
729900,Bao nhiêu tiền 1 hộp đấy ạ 
729901,Vâng để chiều e qua xem
729902,C ới thảm silicon về chưa em qua xem 
729903,Vâng th chiều mai e qua
729904,C ui e ở Phủ Tây Hồ vừa qua mua thảm của c đây ạ Chồng em bảo sáng mai đi có vc ở gần ngay nhà chị nên chồng e qua lấy thảm lun đỡ được 50k
729905,Vâng chị tối nay e cho trẻ con đi Hàng Mã cũng ko ai ở nhà ạ
729906,Tâm 10h mai e qua ạ
729907,Tks chị nhiều
729908,C ới em Phương ở Phủ Tây Hồ ạ
729909,C còn van trắng medela ko c ship gấp giúp e 3 cái dc ko ạ
729910,E vừa rửa bát làm rơi mất giờ ko có j hút sữa
729911,C ship kèm cái xúc xắc bông hoa cho e nữa nhé
729912,Úi tối qua e gọi chị mãi ko dc e lại phi qua nhà c mà đóng cửa
729913,E đành lên tận Thái Hà mua rùi ạ
729914,Ko thì nổ ngực từ tối qua c ạ
729915,Đen ghê đúng lúc tối qua mưa to
729916,C ơi hnay shop c có mở cửa ko
729917,Ti c quá e qua nhà chị thấy đóng cửa lại về Thôi để lần khác ạ
729918,Cho m xin giá máy đun nước này
729919,Nó có báo nhiệt độ nước kèm theo ko shop
729920,M cần mua gh tập ngồi nữa
729921,Cả máy phun ẩm
729922,Bình giá 1 020k a b 
729923,Của nc nào sx b
729924,Gh 1750k có video ko b
729925,Gh 2 bé sinh đôi ngồi ấy b
729926,Đọc mỏi mắt quá vì dài b a
729927,Máy phun sương giá bnhiu b
729928,Cho m cái gh tập ngồi ấy nhé shop ơi
729929,Và 1 cái phun ẩm tạo tinh dầu
729930,Shop ơi xe này còn ko Giá bao nhiêu ạ 
729931,Bể bơi đứng cho bé tập bơi còn ko 
729932,Xe đạp khi nào có ạ
729933,Hôm nào có bể bơi nt cho e với nhé
729934,Ok Khi nào có xe và bể bơi nt cho e với nhé
729935,Máy này có ko shop
729936,M thấy dòng này nhiều loại quá Loại nào dùng ok nhất b
729937,Bé mấy tháng dùng dc địu shop
729938,Xe dùng dc cho bé Bn tháng vậy shop
729939,Cho m xin Thoòng tin sp
729940,Loại này m thấy hơi thấp
729941,Có loại nào nữa ko shop
729942,Có loại nào tầm 2 tr trở xuống ko b
729943,Vậy để m tham xem b nhed
729944,Vì m mua cả Địu nữa
729945,Có gì m nt lại
729946,Cái này dùng có hơn vovo ko b
729947,Bé Bn tháng dùng dc b
729948,M đặt xe đẩy địu và bể bơi nhed shop
729949,Địu này có dễ dùng ko b
729950,Xe Bn b
729951,Tổng đơn Bn b
729952,Ship dc này cho m nhed
729953,Xe 1890 mà b
729954,Fs mà b
729955,Có tk BIDV ko gửi m Ck cho
729956,Xe có mấy màu b
729957,Xe này Bn shop
729958,Alo shop c m hỏi giá ce này với
729959,M chốt đơn cũ nhed
729960,Chủ nhật tuần sau ship cho m nha shop
729961,Vậy ship t2 ngày 8 tháng 4 cho m b nha
729962,Thứ 2 tuần sau nữa m mới có ở nhà b nhed
729963,Mai ship hàng cho m nhed shop
729964,Ship cod nha shop vì tk m ko dủ Ck
729965,Yhees địu bao giờ có b
729966,Vậy nay chuyển trước xe với bể bơi b nhed
729967,T7 sao ko chuyển hàng cho m vậy shop
729968,M nhận dc hàng rồi nhed
729969,Shop có địu nào tuong tự địu hôm trước ko cho m xem với
729970,Shop ơi hôm trước m mua bể bơi có cái phao nhỏ bị xịt một mặt Shop có bán rời ko ah
729971,Có địu về chuea b
729972,Mai gửi phao cho m nhed
729973,Có địu về chưa b ơi
