senid,sentence
728211,B49 duy tân cầu giấy hn
728212,Đối diện cmc đó b
728213,Cả ship là 400 đungs ko b
728214,Có đc tặng y m ko b
728215,Chiều ship cứ gọi 2 số đó hộ mình
728216,Ck mình nhận
728217,Mìn muốn mia hâm sữa này
728218,Mu 2 bình giá sao b
728219,Fs ko b
728220,Mình ở hn mà b
728221,Mua trên shoppee có đc fs ko
728222,Mìn mua 1 xái cho mình
728223,1 cái tặng
728224,1 cái thì ship cầu giấy
728225,1 cái ship bà triệu
728226,Gjees này
728227,Bọc da sale còn 449 hay 630 b nhi
728228,Có bọc da luôn ah b
728229,Có thấp quá ko ạ
728230,Chỉnh đc ko b
728231,Ảnh là max r ah
728232,Cho mìn xin hình vs
728233,Aricare bn b
728234,Tekum bn ạ
728235,2 caia này khác j nhau b
728236,Cái hồng
728237,Có bọc da ko b
728238,Mìn tjaays cái nâu bọc da
728239,Có vẻ êm hơn nhr
728240,Chỉ khác màu thui ạ
728241,Mình đặt qua shoppee nhé
728242,Có link ruêng của sp này ki
728243,Hay gộp cả hãng vào b
728244,Mình tìm ra r
728245,Cái hồng ko bọc da
728246,Thì là 439 ah b
728247,b ơi mình đặt gh ăn xdawmj qua shopee r
728248,bên đó qua lấy đê giao chưa bạn
728249,thảm này còn ki
728250,cái nay kjo có rổ ném bog vào ạ
728251,Cai nay gia bao nhieu vay shop
728252,Shop cho mình 5 set này nhé 3 màu trắng và 2 màu ghi
728253,Hấp và sấy khô bình
728254,Th cho 5 màu kem luôn nhá
728255,Set này giờ bao nhiêu hả bạn
728256,Máy tạo độ ẩm này bao nhiêu hả shop
728257,Bao h có lại shop ơi
728258,N u kmai thì là bao nhieu hả shop 
728259,Shop cho mình 5 set khăn màu kem 1 máy hấp sấy bình 1 rổ đựng đồ cho be mà xanh nhé
728260,Chung cư mipec 229 Tây sơn HN 0906216721
728261,À mà máy fatz này hấp Sấy đc 8 bình đúng k shop
728262,Ok đơn shop nhé
728263,Úp bình đổi cho mình sang màu hồng nhép
728264,Shop ơi Cho mình hỏi 2 loại này thì loại nào tiện dùng hơn
728265,Mọi người hay dùng loại nào hả shop
728266,Kích cỡ có giống nhau ko shop
728267,Cai 12 tuổi có to hơn nhieu k shop
728268,Lăn tăn quá Ko biet mua cái nao
728269,Có loại nào d n 7 tuoi k shop
728270,Shop bán cho mình loại đ n 4 tuoi nha
728271,Bảo hanh ntn shop oi
728272,Mình ra đâu bảo hành n u cần hả shop
728273,Uh Nhưng cung can biet n u cần sửa chưa
728274,Ship cho mình khoảng sau 12h30 nhé
728275,Trưa
728276,Nhà mình có người ở nhà từ 12h30 đ n 2h30
728277,Shop dặn ship giup minh nhé
728278,Địu nay 2 thang dung dc k shop oi
728279,Có dịu nào mà 2 tháng dùng đc ko shop
728280,Ths shop nhé Mình suy nghĩ xíu 
728281,Shop ship cho mình địu này nhé
728282,Vậy hả shop Qua Tet lại h t khuy n mại phải k shop 
728283,Shop ơi Địu này giờ bao nhiu 
728284,Shop ship cho mình 1 cái nhé
728285,Về chung cư mipec 229 Tây Sơn
728286,Mai thì sau 5h chiều giúp mình nhé
728287,Đúng roi shop
728288,Shop ơi Ship giúp mình sau 5h nhé 6h là chắc chắn nhất Ths shop nha
728289,Ơ shop ơi 
728290,Ship địu cho mình chưa th 
728291,Shop ship cho mình 1 cái này nhé
728292,6h30 chiều shop nhé
728293,Em này bn 1 em hả shop
728294,Shop ship cho mình 1 con nhé
728295,Chung cư mipec 229 tây sơn 0906216721
728296,Sau 6h shop nhé
728297,Bao h ship chó cho mình đấy shop ơi
728298,Cho mình xin giá shop nhé
728299,Các size
728300,Shop ơi Gh này khuyên mai còn bn hả shop 
728301,Cho mình 1 chi c màu hồng nhé
728302,Chung cư Mipec 229 Tây Sơn HN
728303,Sau 6h30 tối shop nhé
728304,Mình muốn mua bể này shop ơi
728305,Bn tien ha shop
728306,Size to nhất shop nhé
728307,Mình muốn mua cả cái phao cổ cho bé luôn
728308,Ok shop cho minh set xúc cát 65k luôn
728309,Chung cư mipec 229 Tây Sơn shop nhé
728310,Shop có bơm luôn ko 
728311,Sau 6h30 chiều shop nhé
728312,Bộ này bao nhoeu shop oi
728313,Shop ơi Bộ này size như nào hả shop 
728314,Shop oi Thảm này bn
728315,Shop ship cho mình một thảm giống hình mình gửi nhé Chung cư mipec 229 Tây Sơn
728316,Ship cho mình set này shop nhé
728317,Có xả kho xe tập đi nào ko shop oiii 
728318,Hãng nào tốt hơn hả shop
728319,5 tháng shop a
728320,Cái mastela chỉ có 1 cỡ thôi hả shop
728321,Thương thì mấy tháng cho bé ngồi xe tập đi đc nhỉ
728322,Mai shop ship cho mình cái tomorow nhé
728323,Có mầu gi ha shop
728324,Tomorow ko có hồng hả shop 
728325,Mình xem ảnh đc k
728326,Shop cho mình xem ảnh 2 màu đc ko 
728327,Đen xì xì tất cả hay phối trắng đen hả shop Phối trăng đen thì mình ok nhá
728328,Shop oi Ship cho mình 2 thảm này
728329,Nhà cô Tâm Phong 610 nhà ct6 chung cư 12 tầng đối diện thanh tra chính phủ ngõ 1 phạm văn bạch
728330,090 2423998
728331,Chiều nay shop nhé
728332,2 cái mỗi cái 1 hình như mình gửi nhé
728333,Hôm qua mình nhắn đây shop
728334,2 ship cho mình 2 thảm shop nhé
728335,Shop oiiiiiiiiiiiiiiiooiiooooooo
728336,Mình 3 chai này shop nhé
728337,0906216721
728338,Tối shop nhé
728339,Nhớ giao thảm giúp mình luôn
728340,Bát nào shop 
728341,Mình mua 3 chai tắm nhưng chưa thấy ship
728342,Em này bn shop oi 
728343,Nhà mình giương 1 6 2 m thì dùng cỡ nào shop
728344,Vì ko thấy thanh 1 6m
728345,M5 cũng vừa à 
728346,Th shop ship luôn cho monhf 2 thanh 2m 1thanh 1 5 và 1 con voi nhé
728347,Chung cư mipec 229 tây sơn
728348,Cũng đc shop nhé
728349,Cho mình 2 nồi này nhé
728350,Mình muốn lắp đặt thanh chắn
728351,Nhà mình ko bi t lắp 
728352,Đọc lại tin nhắn mới bi t ship lắp
728353,Hay shop có clip hướng dẫn ko 
728354,Hộp thanh 1 5m bị nhầm các thanh ko đều nhau nhà mình ko lắp đc shop oiiiii 
728355,Nhưng ở hộp 2m 4 thanh đều nhau thì mình lắp xong ok rồi
728356,Hụt th này thì sao vừa đc
728357,Shop oiiiii 
728358,Th sao xử l sao hả shop 
728359,Cho mình mẫu của các mẹ đã lắp đc để mình làm theo nhé
728360,Giương này bao nhiêu shop ơi 
728361,Shop ơi Gh này cho bé cân nặng bn 
728362,Shop ơi Bạn mình vừa mua ở shop gh này tặng con mình mới ship đ n nhà hôm nay con mình giờ 9 cân rồi nên ko dùng đc Shop có thể cho mình gửi lại đc ko 
728363,Hoặc đổi đồ dùng khác
728364,Có 1m6x2m ko ạ Giá bn ạ 
728365,Cho m xin giá thanh chắn giường m6*2m
728366,Shop con tủ lạnh kemi k ah
728367,Minh muon mua 1 cai ạ
728368,Ko mình ở An Giang
728369,Bộ cốc uống nước
728370,ok Nguyễn Thị Mỹ Hưng 178 ấp Thượng I TT Phú Mỹ Phú Tân An Giang 0932238342
728371,ship cod đi shop
728372,thông thường ship 30k
728373,shop gởi hàng đi
728374,ừ thì shop cộng vô mình chịu
728375,ok có gì thì mình nt lại cho shop
728376,Mình lấy 1 cái màu xanh tím than nhe
728377,Nguyễn thị mỹ hưng ấp thượng I thị trấn phú mỹ phú tân an giang 0932248342
728378,Vậy bạn gởi link shopee nhe
728379,Mình lấy 4 cá 1 gặm màu xanh nhe
728380,Mình lấy con bướm nhe
728381,thanh toán khi nhận hàng luôn ko đc hả shop
728382,Shop ơi món này có ship tỉnh ko ạ
728383,Phí giao hàng đ n nghệ an là bao nhiêu ạ
728384,Có đc kiểm hàng trc khi thanh toán ko
728385,Vì e sợ vận chuyển sẽ làm bể hàng
728386,Nãy e thấy bảo là phí chuyển về hơn 100k là sao ạ
728387,Ban oi tham silicon bn tiền nhỉ
728388,Ban oi ban co bim merris S chu 
728389,Ừa tks banh
728390,Ban oi ben ban dg co may loai ghe an dặm phải ko
728391,Hom tr c co 1 cai ma h troi mat roi
728392,Ban doi minh tim de chup anh nhe
728393,Nha ban co cua hang chu nhi 
728394,Ghe nay bn nhi
728395,Có quá nhiều thứ muốn mua 
728396,Báo giá địu giúp c nhe
728397,De gom 1 lan mua may thu luon 
728398,Địu này có kệ ngồi ko b nhỉ
728399,Bỏ ra ngồi như hình dưới cùng nhỉ
728400,Bạn ơi bạn có balo bỉm sữa kiểu này k nhi
728401,N u có bạn ship giúp m balo và địu luôn
728402,Bn b nhỏ
728403,Lấy cho mình địu màu đỏ nhew
728404,Con trai màu đỏ cg dc nhi 
728405,Gam tươi hay kiểu đỏ đun b 
728406,Ko mình đg nói địu cơ 
728407,Alo b lay địu cho mình nhew
728408,Cái nay nhe
728409,Đang suy nghĩ giữa màu đỏ và màu tím than 
728410,Hoàng Ngân 0989 203 609 toaf D chung cư Mullberry lane mỗ lao hà đông
728411,Bao h cac ban chuyen hang nhi
728412,Fs hay mat phi ban 
728413,Cho minh link nhe
728414,Tks e n u lấy kmai giá còn 1 660 tức là sao e nhỉ
728415,C ơr Hà đông thi phí ship bn nhi
728416,C ở Mulberry lane đường Nguyễn văn lộc
728417,Vậy 1 660k sẽ đc 1 quây vuông 1 32*1 32 thảm và bóng phải ko nhỉ 
728418,Bạn ship cho mình 1 bộ nhé
728419,Bạn chụp giúp mình xem cái thảm
728420,Đồ có cồng kềnh ki nhỉ 
728421,Mình xem kiểu dáng thôi
728422,1 mình có cầm đc k 
728423,Có cho vào o tô vios dc k nhỉ 
728424,Vì ob nội ở nhà
728425,K biet ông cầm dc k
728426,Ko thì ship qua cơ quan
728427,Rồi chồng m mang về
728428,Có màu j bạn nhỉ
728429,dchi ngo 59 lang ha khu d nhà n3 n4 dt a Thang 0982030222 
728430,Bạn lấy xanh trắng nhe
728431,Có cửa mở chứ nhỉ 
728432,Bao h ban ship de minh dan chong 
728433,Y minh la chieu nay hay mai
728434,De minh bao chong minh
728435,Lắp cg dễ thôi fai ko ban 
728436,Uki bn
728437,Ch nay chồng m ko ở vp
728438,Mai ban ship nhe
728439,Hoặc 7h30 có ship dc k ban
728440,Thì ship về nhà minh 
728441,Có nặng k bn 
728442,Vì ngại nhờ ob xuống lấy
728443,Từ cổng vào lại đi thang máy
728444,É nặng nhỉ
728445,8 9h ship về Hà đông đc k ban
728446,Vậy 21h hnay nha
728447,Toà d chung cư Mulberry lane đường nguyễn văn lộc hà đông
728448,20h30 21h tầm đó nha
728449,8h30 dc k 
728450,Hoặc muộn nhất là mấy h thì báo m 
728451,Uki nhe
728452,Nhà mình có mỗi 2ob
728453,2 childs
728454,Nên k có ai trông
728455,Uki bn tks b
728456,Bạn đã giao hàng chưa nhỉ
728457,Hnay co fai CN dau nhi
728458,Ban hen giao quây bóng mà m ko thấy
728459,Ban cho minh dt minh goi nhe
728460,K thay ai lien he
728461,Minh cg ko báo bận
728462,Ko co nhe
728463,Ko co misscall
728464,May m cg ko tăt
728465,0989 203 609
728466,Ban goi dung so chua 
728467,Ok b b bao ship goi m nhe
728468,Bao gia giup m bộ khăn nh
728469,Ban lay giup m 1 tui nay nhe
728470,Khăn gồm 2 cái
728471,Kthuoc bn nhi
728472,Ui th to nhỉ
728473,Khăn mặt bt 25 30 thoi
728474,Lấy cho c 1 binh sua mau hồng nhe
728475,1 hộp túi trữ sữa 1 bộ khăn tắm 1 bình sữa hồng
728476,Khăn tắm màu xanh
728477,Khăn xanh mint nhé
728478,Lúc nào ship báo c nhew
728479,Nhà bạn có đồ chơi j cho bé 7m nhỉ
728480,Gia cai nay bn e
728481,Bộ 5 cai pk bn
728482,1trieu mua tren shope dc fs ban nhi 
728483,Mua tren shope cg ko dc fs a ban 
728484,1trieu cg ko fs 
728485,Uh vi minh dg o shope thay fs 
728486,Minh vao cai nao cg thay phi vc o 
728487,Minh muon mua cai đàn cho bé
728488,Đàn bip bop va đàn trống cái nào hơn nhỉ
728489,Bạn 7m
728490,2 cai minh vua chup gui ban au
728491,Be đg ngủ rồi
728492,Minh mua 3 cai nay
728493,Bình sữa và túi trữ sữa bạn có add dc vao thêm ko nhi 
728494,M ko lấy khăn nữa
728495,Mình ko thấy túi trữ sữa và bình como trên shoppe
728496,Bạn gửi link hộ m để mình add
728497,Hoặc khi soạn hàng để mình dặn 
728498,Bên bạn có bán nắp bình sữa comotomo k 
728499,Xe này cho bé từ bn tháng hạ b
728500,Ship về Hạ Long thì bn b nhỏ
728501,Cái nào rẻ nhất ấy b
728502,Con m 18m m đang muốn mua xe chòi chân cho b ấy thì mẫu này hay mẫu nào phù hợp b nhỏ
728503,Ok b để nhà m nghiên cứu
728504,c ơi e ở gia lâm hqua vừa mua xe đẩy vovo của nhà chị ạ
728505,e thấy c đăng là xe đẩy 2 chiều
728506,mà e ko bi t làm sao để đổi chiều đẩy xe ạ 
728507,hình như c ship nhầm xe cho e rồi 
728508,tại xe này hình như là vovo traveling vì chỉ có 1 bánh đơn thôi
728509,c kiểm tra lại hộ e nhé 
728510,shop cho e hỏi e muốn mua gh ăn dặm và bình comotomo
728511,gh màu be và bình comotomo xanh 250ml ạ
728512,cho m hỏi gh mastela 1013 màu ghi và bình comotomo 250ml màu xanh giá bn ạ 
728513,m ở 115 trần duy hưng cầu giấy shop có ship ko ạ 
728514,vâng mình lấy gh lưng nhựa
728515,th ship cho minhg nhé
728516,115 trần duy hưng cầu giấy hn
728517,cho m 1 xe ghi 1binhf xanh 250ml
728518,ship có giao ngoài giờ hc ko ạ 
728519,cho m số tk m ck xog ship cho mình luôn nhé
728520,p403 ct6 yên hòa cầu giấy
728521,đơn của mình h t bn vậy 
728522,kai này chưa bao gồm ship đk 
728523,à quên mình tự trả ship cho grab hay ck cả tiền ship cho bạn 
728524,m đag ck tech rồi đây
728525,m vừa ck rồi bạn check tk nhé
728526,ok m cảm ơn
728527,shop gửi grab cho m chưa ạ 
728528,m nhận đc xe rồi đẹp lắm ạ
728529,xe đẩy 2c vovo máy hâm sữa gặm nướu và gh đều rất ưng 
728530,c ơi cho e hỏi c còn bể bơi doctor dolphine ko ạ cho e xin kích thước bể với cả bể dfos là về mỗi lần cho bé bơi là tự bơm ạ 
728531,bể có kèm phao cổ cho bé ko ạ 
728532,giá bể bn vậy ạ 
728533,c còn màu trắng ko ạ 
728534,alô c ơi
728535,c ơi cho e lấy 1 bể bơi và 1 set xúc cát nhé
728536,ship chiều hoặc tối nay cho e đc ko 
728537,e ở ct6 yên hòa cầu giấy đt 0979207792
728538,c ơi ship e nhé 
728539,vâng e cám ơn shop
728540,bé nhà e rất thích bơi luôn ah 
728541,gh và xe đẩy bé cũng rất hợp tác thank shop ah
728542,dạ e cảm ơn 
728543,nhà cháu có quay clip nhưng mà ko chuyên nghiệp chứ bạn bơi thích lắm
728544,chị ơi c có núm ty comotomo cho bé 7m ko ạ và tay cầm bình sữa como nữa ah 
728545,c ơi c cho e hỏi quây cũi này bé nhà e 14m n u đứng vịn vào liệu có bị đổ ko ạ
728546,quây này giá bn vậy c 
728547,c ơi e lấy thì nay có ship kịp ko ạ 
728548,e ở 115 trần duy hưng cầu giấy
728549,th c ship cho e 1 bộ đó nhé
728550,115 trần duy hưng cầu giấy 
728551,đt 0979207792
728552,n u đc trong hn trước 5h30 thì c bảo e để e chờ lấy hàng e cảm ơn
728553,ôi c ơi
728554,c đã gửi ship quây cho e chưa ạ 
728555,hxhx hqua e về nhà e đo kích thước thấy nhà e hơi nhỏ cả kai nhỏ nhất kia cũng có vẻ hơi chật chội nên chồng e bảo là thôi n u c chưa ship thì cho c cancel có đc ko c 
728556,hic ngại quá e xin lỗi c
728557,Tống thị minh thôn 2 hà bắc hà trung thanh hoá 0976342014
728558,M mình đặt cái kia mà
728559,Thanh toán bn shop
728560,Cái này có ship cho m k vậy
728561,Inb cho m nha
728562,Ship đăk lăk bn tiền shop Shop ở đâu vậy ạ
728563,nay giá còn bn ạ
728564,e đây c
728565,địa chỉ e là ở 1A nguyễn tất thành phường thuận phước quận Hải Châu thành phố đà nẵng ah
728566,dạ vâng e sẻ nc với chồng
728567,và rồi e sẻ báo shop nha
728568,e cám ơn shop nha
728569,Mình mua máy hút sữa của bên bạn
728570,Uh bạn ơi
728571,Nãy nhắn mà rớt mạng
728572,Mình bị rách van trắng
728573,Bạn ship cho mình 1 đôi van trắng bạn nhé
728574,Uh ship cho mình tới 36 Trưng Nhị Hà Đông nhé
728575,Lúc nào CH mình cg có ng nhận bạn nhé
728576,Báo giá cho mình máy pha sữa của bên bạn nhé
728577,Bên bạn giao hàng tới có lắp ráp luôn cho mình ko bạn 
728578,Vậy bạn giao cho mình 1 chi c nhé
728579,Tới 36 Trưng Nhị Hà Đông
728580,Sđt 0912484660
728581,Mình nhận đc hàng rồi bạn ạ
728582,Mình có xem cách cài máy trên youtube rồi
728583,Nhg ko hiểu cài theo mỗi loại sữa th nào bạn nhỉ 
728584,À thôi ok bạn
728585,Mình tự đong bằng tay rồi áng chừng rồi
728586,Tại theo công thức đấy ko chuẩn
728587,À uh mình nhắn xong mới để thời gian
728588,Tớ gửi fb sp nhé 
728589,Ngô ánh Nguyệt stk 0011004128494 vcb trung hoà bạn nhé
728590,Phiền bạn cho mình hỏi
728591,Mình mới mua máy pha sữa của bên bạn hôm 19 10 
728592,Giờ bé nhà mình lại ko ăn sữa bột nữa nên mình muốn thanh l 
728593,Bên bạn có thanh l hộ hay mua lại ko 
728594,Uh tớ cảm ơn bạn
728595,Mình gửi hình ảnh bạn đăng giúp mình nhé
728596,Bạn ơi bạn đăng hộ mình chưa 
728597,Bạn ơi tớ thanh l được máy pha sữa rồi
728598,Bạn xoá ảnh hộ tớ nhé
728599,Xe này bnhiu shop
728600,Shop oi cho e hoi chặn cửa bao nhieu tien ah
728601,Ben minh co xe ba banh cho be ko
728602,Xe cho be 2 tuoi tro len
728603,Xe nay cua nuoc nao ah ban
728604,Ma minh muon mua xe cho be tu 2 tuoi tro len y
728605,Xe nay bé sợ dùng ko dc lau
728606,Shop oeii cho m hỏi bộ qây full mấy chi ti t
728607,Gồm qây cầu trượt ngựa bập bênh xích đu
728608,Là bnhiu ạ
728609,Od chờ 9 ngày thì rẻ hơn hả shop
728610,Còn n u đ n xem mua lun là 4690k ạ
728611,Hàng có sẵn ở shop k ạ
728612,Có sẵn đủ lun fai k shop
728613,Ừa nhà mẹ nuôi m cũg gần gần chỗ shop nè
728614,Ừa xem chất vs màu thôi
728615,Qây vs ngựa cầu trượt các thứ í
728616,Ok thì lấy lun cho nhah chứ od đợi lâu qá hihi
728617,Qa btoi thì có đc k shop
728618,Tại vì đi làm về mới ghé đc
728619,Cuối tuần thì sao ạ
728620,Ok m bi t r
728621,B ơi hnay shop có mở k ah
728622,Ng nhà mình đt đeer đ n cửa hàng m xem á
728623,Mà thấy k ll đc
728624,Xinh qá nè shop
728625,Bộ này xinh qá í
728626,Lúc ng nhà mình đ n xem có nói là bộ qây vs mấy món đồ chơi này hok giống như hình m đưa lắm
728627,Màu nhạt hơn
728628,Nhưg mà về thì thấy cũg ok lắm í
728629,Cũg chắc chắn
728630,Bạn bé mới trượt mà k sợ gì cả
728631,Cười khoaos chí xog còn trèo ngược lên nữa
728632,Hihi công chúa mà nghịch như cái th í
728633,Mặt cũg manly nữa
728634,Chi m h t ngôi nhà lun í đi đ n đâu cũg toàn đồ của bạn này thôi 
728635,Trươt xún còn cười nè
728636,Ebe thích lắm
728637,Có cái bóng rổ thì chưa bik chơi
728638,Bộ này xinh đ n mẹ cũg mún nhảy vào chụp hình sống ảo nữa mà
728639,Nàng ấy k sợ gì h t
728640,Còn trèo ngược lên xog bị trượt xún dập mông
728641,Vẫn đứng dậy trèo típ
728642,Mẹ sợ lun á
728643,Té đau cho sợ
728644,Sau mới k dám trèo
728645,Bé đầu mà bé gái nữa
728646,Nên mẹ chịu khó đầu tư
728647,Ừa đó
728648,Bể bơi dolphin còn k ạ 
728649,Bể tắm thành cao cho bé bn ạ
728650,Bnh sh
728651,Cái này k có chân à sh
728652,Cho e 2 set này nhé
728653,Cho e đeo tay và xúc xắc ạ
728654,Ship sóc sơn bn ạ
728655,Cái bộ xúc xắc là hàng của nước nào ạ
728656,Cái set trên het r ạ
728657,Máy này bnh ạ
728658,Shop ship tới phường quảng phúc tx ba đồn tỉnh quảng bình
728659,Sdt 0344173849
728660,Nguyễn văn hùng
728661,La s ạk
728662,Ban giui linh lam j
728663,Mih hỏi Là mih phai thanh toán 4 50 hóa đơn trước hay s
728664,1tr450 Là tính cả khung luôn à
728665,Trả trước chuyển thẻ hay sao
728666,Cho số tk 
728667,Số đt nữa shop ơi
728668,Xíu nữa ạk Chắc chiều
728669,Chiều mih ck tien 50 thì bao nhiêu ạk
728670,Vâg ạk 
728671,Ghi người giui nguyễn hồng thúy nha shopnha
728672,Khỏi ghi fabook
728673,Đã gửi rồi nha shop
728674,Khoảng mấy ngày thì có 
728675,Tổ dân phố diên phúc Phường quảng phúc Thị xa ba đồn tỉnh quảng bình
728676,0344173849
728677,Nguyễn thị hồng thúy
728678,Xe như hình minh giui nha shop
728679,Xe ngày shop ạk
728680,Shop ơi Sao chưa có xư vậy ạk
728681,Là shop giui xe cho mih chưa ấy
728682,Vâg Nên mih hỏi Thấy 4 ngày rồi 
728683,Vâg ạk
728684,M mua xe tập đi trên shoppe
728685,Mà sao xe lùn vậy
728686,M chỉnh mức cao nhất rồi mà vẫn thấp
728687,390
728688,Mua ở shoppe
728689,Trang của shop
728690,Thôi ok ùi s nha
728691,Tại nãy m nghĩ mức 1 cao nhất
728692,M chỉnh qua mưc 3 ok ùi
728693,Cho m hoie
728694,Xe đẩy e bé dạng clip người nc ngoài
728695,Mà xe x p gọn như giỏ xách giá bnhiu
728696,Cho m xin gí kệ nhé
728697,Cho m xin giá máy tiệt trùng be bela nha
728698,Có dùng nước hay chỉ tia uv vậy shop
728699,Ch độ bảo hành sao ạh
728700,Lấy m 1 b tiệt trùng hha
728701,Mà nó có vừa bình avent cổ rộng ko s
728702,Ủa chứ ko tiệt trùng đc bình sữa hả
728703,Cho m 1c màu xanh nha shop
728704,Ahd
728705,Còn cái máy tiệt trùng 1 bình áh
728706,Free ship ko
728707,Vậy là bnhiu
728708,Ship m 1c màu này lun nha
728709,Hoàng Nữ Kim Chi 39 đường D10 p Tây Thạnh q Tân Phú 0904458009
728710,220k đúng ko
728711,M quên ghi stk nha
728712,Ghi đậm nha
728713,Ship balo kia cho m chưa
728714,N u chưa cho m đổi mẫu này đc ko s
728715,Gh goiin đầu giá sao s
728716,Ok thanks nhé
728717,Giá balo này bnhiu a
728718,C ơi e mua cái nôi rung này bên chị mà làm th nào để lắp pin được vậy c 
728719,Nôi joie dreamer c
728720,E chưa lắp đc pin vào
728721,E thấy có phần open mũi tên đó rồi nhưng k làm nào để mở ra đc 
728722,Có ạ Nhưng e vặn thử rồi k thấy bấm ra được Cậy sợ nó gẫy nên k dám cậy
728723,Xong rồi cậy ra hả c Mà mũi tên ghi là open here mà k cậy chỗ đó lên đc
728724,Oke c Để tí e thử lại
728725,Cho mình hỏi bộ quây xích đu cầu trượt có giá bao nhiêu vậy shop
728726,Ví dụ mình muốn làm kiach thước nhỏ hơn đc k shop 
728727,À à shop bán giá trọn bộ kiach thước
728728,Cánh mình thích lắp bn là tuỳ mình
728729,Bạn có thể cho mình bi t đc độ dài 1 cánh quây là bn cm k 
728730,Cho mình od 1 bộ
728731,Bé gái chị dâu mình đặt màu hồng có cả xanh
728732,Thì bé trai là xanh ghi hả shop
728733,Bộ bé trai màu hồng chuheern màu ghi hả shop
728734,Màu bé trai th nào vậy shop
728735,Màu này là thuần gái hả shop
728736,Cho mình đặt màu này đi
728737,Od đi ạ
728738,Oke shop Mai mình ck nhé
728739,Thôi mình đổi lại tone thuần bé trai shop ạ
728740,Nhà mình ck 2tr rồi này
728741,Oke shop Số 8 ngách 152 ngõ xã đàn 2 phố Nam Đồng Bên bạn ship vào hôm nay hay mai 
728742,100k ship nữa ạ
728743,Bạn có thể giao hàng cho mình vào khỏng thời gian 16h30 19h thôi nhé
728744,Ừ ship cho mình khoảng thời gian 16h30 19h thôi nhé
728745,0933565825 anh Trung
728746,Oke b yên tâm nhé Tới nơi gọi anh Trung giúp mình
728747,Chắc mai nhà mình mới nhận hàng đc bạn ạ
728748,Mai cũng giờ bạn ship cho mình nhé
728749,Oke shop th hnay mìn nhận đi
728750,Cứ 17h có mặt là đẹp nhất
728751,Gọi cho a Trung trc khi ship hộ mình nhé
728752,Shop cho mình hỏi toys house này còn màu xám là màu cụ thể ntn nhỉ 
728753,Màu ntn luôn ạ Mình nhìn tưởng màu xanh
728754,Giống y hệt hình bé đang chơi đúng k ạ 
728755,Vẫn còn hàng đúng k ạ 
728756,Tối mình qua cửa hàng xem đc k 
728757,Shop cho mình hỏi thảm này giá đang sale là bn ạ 
728758,Ko để động đc fai ko bạn
728759,Cho mk hỏi giá 2 sp này ạ
728760,Shop cho em hỏi giá mẫu thảm này ạ 
728761,Shop còn họa ti t này ko ạ
728762,Hai mẫu nào ạ
728763,Em lấy thảm này ạ
728764,Shop cho em hỏi luôn giá bể bơi này ạ
728765,Dạ Gh hơi tập ngồi shop có ko ạ
728766,Màu này có ko ạ
728767,Shop gửi cho em thảm và bể thành cao này nhé
728768,Trương ngọc duyên 0986010168
728769,Khu tập thể biên phòng tổ 5 phường nghĩa phú thị xã gia nghĩa tỉnh đắc nông
728770,Shop cho em hỏi luôn là thảm hai mặt thì mặt kia họa ti t cũng vậy hay khác ạ
728771,Thảm này thì họa ti t sau ntn ạ
728772,Máy xay này bn vậy ạ 
728773,Nhắn mình stk để mình ck nhé trong ng đag ko đủ tiền mặt có tk mbbank thì càng tốt
728774,Giờ mình đặt gh này liệu còn đc là 10 khách đầu tiên để nhận km ko
728775,Mình đặt 1 đầu tàu hoả Winfun nhé
728776,0985277245
728777,Toà g1 cc five star 460 khương đình thanh xuân
728778,Mình lấy 1 balo này
728779,Shop có địu ko
728780,Địu shop bán bnhieu
728781,Mình lấy 2 cái màu đen
728782,Ship đ n địa chỉ và liên hệ trog tin nhắn trước nhé
728783,Ah quên 1 cái địu 1 balo
728784,Gửi lại giúp mình mấy mẫu đấy nhé
728785,Mình lấy mã 8 nhé
728786,Địu lấy màu đen
728787,Bgio shop giao hàng th 
728788,Mình chưa nhận đc hàng shop ơi
728789,Mình ko lấy j nữa nhé
728790,Oke khi nào hàng về báo mình 1 ti ng nhé
728791,Cho mình hỏi mình mua medela sonata nguyên seal của shop cách đây 6m
