senid,sentence
617511,B ship đơn Lĩnh Nam chưa ạ
617512,Chặn cầu thang có chưa ạ
617513,Hic nhớ báo mình nhé ạ
617514,Vâng nhà mình sắp chuyển mà không có chặn sợ các bạn bé chạy lung tung
617515,Nguy hiểm lắm
617516,B ơi 1 bên cầu thang th này có dùng chặn được không ạ
617517,Tức là không dùng được chặn cầu thang của bên mình ạ
617518,N u mình bắt lên cái tay vịn có được không ạ
617519,Thanh chăn mình cao bao nhiêu ạ
617520,B ơi đơn chặn cầu thang mình vẫn lấy nhé ạ
617521,Khi nào b ship được
617522,Lòng cầu thang rộng 95 ạ
617523,2 thanh chữ Y là sao ạ
617524,Oh b cho mình xin hình nối được không ah
617525,Ah mình là hình chữ Y bắt vào cầu thang ấy ạ
617526,Ý mình là vít vào cầu thang trông th nao ấy ạ
617527,B ơi th bên trên ngoạm vào tay vịn bên dưới cố định vào đâu ak
617528,Vâng bên trên mình hiểu rồi
617529,Nhưng bên dưới nhà mình không có phần để ngoạm
617530,Nhà mình đang định làm mi ng gỗ vuông cố định trên dưới bắt vào phần nan hoa
617531,Rồi thanh chặn tì vào mi ng gỗ đấy vậy
617532,Vậy mai b ship cho mình 1 chặn 1 thanh nối 12 nhé ạ 
617533,Lần trước mình order gh oto thanh chặn nhưng hàng nhà b chưa có nên ship gh trước và có bảo sẽ free ship thanh chặn ạ
617534,Nhà C7 Ngõ 87 Tam Trinh Hoàng Mai Hà Nội
617535,0984306644
617536,Sao lắp lên cái khoá nó lại xa th này nhỉ
617537,Không khoá được
617538,B ơi mình đặt thêm 4 bộ như vừa rồi nhé
617539,4 Thanh chặn 4 thanh nối 12 5 ngoạm chữ Y
617540,Chiều giao b nhé
617541,B tư vấn giúp mình địu em bé ạ
617542,Dạ địu thoáng mát nhé ạ
617543,Cái địu Infantino b mới up
617544,Chắc là nóng b nhỉ
617545,Mình chỉ sợ mùa hè địu thì bị nóng quá ấy ạ
617546,Địu Infant bao tiền và địu lưới bao tiền ạ
617547,B ơi báo giá giúp mình
617548,B ơi bình giữ nhiệt hâm sữa cho bé mang đi xa mình còn không ạ
617549,Hâm sữa mẹ thì th nào ạ
617550,Bình này có vừa Como không ah
617551,Mình nhớ b còn một loại hâm sữa di động nữa đúng không ạ
617552,Cho mình xin lại thông tin của loại hâm sữa kia đi ạ
617553,Khi nào thì có ti p ạ
617554,B còn địu Infantino không ạ
617555,Địu này dùng được cho bé đ n mấy kg ạ
617556,Địu này còn về không ạ
617557,Túi hâm sữa Nice Papa vừa bình Como không b nhỉ
617558,B có thể thử giúp mình bình Como không ạ 
617559,Mình cũng không ước lg được 
617560,B ơi t3 b ship cho mình 1 túi hâm sữa Nice Papa màu xanh đ n Nhà C7 Ngõ 87 Tam Trinh Hoàng Mai Hà Nội 0984306644 nhé ạ
617561,Mình cần giao giờ hc ạ
617562,B ơi xe này giá th nào ạ
617563,B ơi mai có ship 1 xe B Beko màu xám từ tầm 5h đổ ra cho mình đ n Nguyệt Qu 21 17 Vinhomes The Harmony P Phúc Đồng Q Long Biên được không 
617564,Khoảng mấy h ạ
617565,Mình không nhận được khoảng thgian rộng th vì còn đi ra ngoài b ạ
617566,Thôi có gì cứ bảo ship nt trước cho mình
617567,Tiền mình sẽ ck nhé
617568,B ơi mình tưởng đang freeship 
617569,Cho mình 1 Comfy này nữa nhé
617570,Ship cùng xe đẩy
617571,B ship đi ạ
617572,21 17 nhed ạ
617573,3 5 ngày là sao ạ 
617574,B ơi sao mình thấy hướng dẫn là cho trẻ từ 6 tháng
617575,Hic th sao trong quyển hướng dẫn và xe lại ghi dùng từ 6 tháng đ n 15kg thôi ạ
617576,Xe B Beko xám đang giảm 100k ạ
617577,Vâng mình lấy 1 xe nhé Ngày mai giờ hành chính ship cho mình đ n Nhà C7 Ngõ 87 Tam Trinh Hoàng Mai Hà Nội 0947117747
617578,Để mai giao cũng được ạ
617579,mình muốn mua bóng lăn tập bò winfun đặt hàng ntn j shop 
617580,shop có cái bóng tập bò winfun này ko ạh
617581,sản phẩm này còn ko bạn
617582,có ship đc ra Lạc Long Quân HN ko
617583,Xe vovo 2 chiều giá bn shop 
617584,Em mua 2 cái được giảm giá ko chị 
617585,bạn ơi cho mình hỏi quây cũi màu xanhxám bạn đang thanh l hiệu gì vậy ạ 
617586,kích thước bao nhiêu vậy bạn của nước nào sản xuất á bạn
617587,cho mình hỏi là có phải hàng chính hãng toyhouse không bạn 
617588,okie cám ơn bạn để mình tham khảo thêm 1 vài mẫu nữa
617589,Bạn gửi hình thực t cái quây kích thước như vậy giúp mình đc ko vì hình như trong hình kích thước lớn hơn
617590,Ok còn xe 3 in 1 còn được tặng quà ko vậy bạn
617591,Có giấy tờ chứng minh hàng chính hãng rùi bảo hành đầy đủ ko bạn
617592,Xe đa năng á bạn
617593,Phí ship về hóc môn bao nhiêu vậy bạn
617594,Oh bạn ở đâu mà phí ship cao quá vậy bạn
617595,Oh mình ko để xa quá rồi bạn ơi hichic
617596,bạn ơi cho mình hỏi tiền ship quây cũng nhiêu đó luôn hay sao bạn quây của toyhouse có giấy tờ nhập khẩu đầy đủ ko vậy bạn 
617597,phí ship về tphcm bao nhiêu vậy bạn 
617598,C ơi e 1 combo medela swing maxi
617599,Có ship đc luôn hn k ạ
617600,Th c ship cho e v số 8 ngõ 19 trần phú hà đông ạ
617601,Sau h trưa c nhé
617602,C ơi shop m cón avent tiệt trùng 2 in 1 k ạ cho e giá với
617603,Cho e 1 cái đấy
617604,Shop c có cặp nhiệt độ hồng ngoại combi k an
617605,E muốn đo đc cả nc tắm bình sữa vs nhiệt độ fong
617606,Beurer có nt k ạ
617607,Beurer tốt hơn combi ạ
617608,Th cho e loại đấy c đx
617609,C check xem còn loại nào
617610,Vs có ảnh e xem mẫu mã vs ạ
617611,Vâng th cho e của beurer
617612,Nhà m có bán chậu tắm k ạ
617613,Có cái của beurer 650k khác cái này ở đâu hả c
617614,Bên c có bán chậu tắm k ạ
617615,E mới mua 1 chậu combi
617616,E muốn mua 1 chậu xinh xinh nữa để tráng nga
617617,E tưởng fai có 2 chậu
617618,Có to quá k ạ
617619,E định cho tắm trong fong mà fong hơi chật
617620,2 cái to ntn k đủ
617621,Ơ nhưng cái này k nhúng ng nó vào đc ạ
617622,Cho e cái dài dài nhúng đc mà bé xinh í
617623,Hứ th thôi e ki m sau ạ
617624,C cho e lấy 2 cái kia nhé
617625,Vâng ạ ship e sau 6h đc k ạ
617626,Tối
617627,Uki c ạ
617628,Tổng đơn của e là bn ạ
617629,Ad thui mai c ship lên cq cho e nhé số 2 l nam đ ạ
617630,Trong h hành chính nhé
617631,Mai sợ 6h e chưa về nhà
617632,C ui c bảo ship trc cho e 4h30 vs ạ
617633,Th c ship tầm 7h về hà đông cho e nhé
617634,Okic
617635,C oi bảo ship hộ e với e lại chbi đi chơi rùiii
617636,C ơi avent tiệt trùng của e bà gv quên k đổ nc bi cháy bật k lên điện nữa r huhu
617637,Có cách nào sửa k ạ
617638,Vâng ạ 
617639,Vâng c e gửi qua ạ
617640,Địa chỉ trên fb đung k ạ
617641,C ơi e lại cắm đc r n u có gì e gửi c sửa giúp e nhé
617642,C ơi máy vãn chạy nhưng có mùi khét E gửi ng nhà mang đ n cho chị nhé 
617643,Chị ơi cho e giá combo chậu và phao tắm babyhoo
617644,Cho 1 combo bồn nhỏ phao đều màu hồng đ n số 17 ngõ 10 trần phú hà đông
617645,À e hỏi mặc áo ăn dặm này mùa hè nóng k ạ
617646,Cho e set này ah
617647,C ơi chậu con vịt to hơn chậu baby cỡ tiểu k ạ
617648,Th c ship đổi cho e sang cỡ đại đc k ạ 
617649,Vâng e thấy bé muốn to hơn nó bơi cho thik
617650,Phí ship í ạ
617651,Th tổng là thêm bn hả c
617652,Là 410 ship ạ
617653,Vâng th c ship đổi cho e
617654,To hơn nhau nh k c
617655,Nhiều k ạ 
617656,E tìm thấy r
617657,Mà c ơi có màu hồng này k ạ
617658,Th cho e to màu hồng này c nhé
617659,Vvaang c ship trc chiều mai cho e c nhé mai e về ngoại rồi ạ
617660,Th c ship tối sau h hành chính hộ e nhé
617661,E dặn ng nhà
617662,À c bảo ship gọi số này cho e nhé ạ
617663,098 9296968
617664,C ơi ship e mấy thứ này nhé
617665,Cốc tím hồng ạ
617666,Số 2 ngõ 256 thuỵ khuê
617667,Th có hàng lần sau về màu k ạ
617668,Th hồng xanh ạ
617669,Cho e giá tue lạnh kemin ạ
617670,Cho e 2 set rửa mình arau khuy n mại nhé
617671,Alo cho e 2 set rửa mình arau đang km nhé
617672,Về cổng s1 chung cư seasons avenue mộ lao hà đông
617673,Ship e cả tủ lạnh màu xám nhé
617674,0972776689
617675,Phòng 704 chị bảo ship chuyển tủ lên nhà cho e
617676,Khoảng bh ship cho m hả b
617677,B ơi chưa ship tủ lạnh cho m à 
617678,Nhớ ship mình sáng nay nhé
617679,C cho e đặt 1 địu 269k nhé
617680,À à e nhầm
617681,Ủ sữa ạ 
617682,C ơi e xin giá gh gội đầu
617683,Ship cho m 1 cái về cổng s1
617684,Chung cư seasons avenue
617685,Mộ lao hà đông nhé
617686,090 4941579 bà Minh con nhé
617687,Đây c ạ Màu hồng c nhé
617688,Ơ b ơi mình đặt từ hôm kia r
617689,Bh lại kêu h t 
617690,Bh có màu hồng shop trả lời giúp m
617691,Shop hẹn k có giữ lời mình trc mua của shop rất nh lần r
617692,Sao lại làm ăn th 
617693,Vậy bh có hồng ạ
617694,Th ship luôn m màu xanh cũng đc nhé
617695,Trong hôm nay luôn nhé
617696,090 4941579 bà Minh
617697,B bảo ship gọi số này r hỏi địa chỉ nhé
617698,Mình vẫn chưa thấy ship gọi
617699,K ai gọi cả b nhé
617700,Cứ để đợi mãi vậy
617701,Bạn bảo ship gọi ngay cho nhà m hẹn lúc nào thì hẹn chắc giúp m đ n địa chỉ số nhà 2 ngách 23 ngõ 1197 đường giải phóng thịnh liệt hoàng mai HN
617702,Alo 
617703,B bảo ship gọi hẹn luôn ng nhà m đi 
617704,Mình đặt hộ thôi
617705,Các khách khsc thì bạn ship ntn vậy 
617706,Đặt 4 ngày k ship nổi là sao hxx
617707,Grab có cod
617708,Bạn đặt đi
617709,B gọi đc chưa
617710,Giá bộ này th nào ạ
617711,sàhndshF
617712,gh ăn dặm mastela 
617713,shop còn kem trị nứt đầu ti của medela ko
617714,oh đợt trc thấy có bán nhit
617715,Mình mua cái gh ăn dặm đó ạ
617716,Bjo mình gửi phần hỏng về cho bạn qua đ c nào vậy
617717,Thảm này nhiu ạ
617718,Shop có bán gối cho bé 1 tuổi ko 
617719,Gối sợi tre có lỗ thoát khí ko b 
617720,Gối bnhiu tiền vậy 
617721,Gối bao tiền b 
617722,Kích thước gối ntn vậy b 
617723,B bảo tuần tời hàng về mà 
617724,N u có hàng thì tag mình vào nhé 
617725,Shop ơi Ti giả nuk cao su có những mẫu nào vậy 
617726,Núm cao su mùi như mùi gối cao su đúng ko e 
617727,Nhưng mùi kiểu vậy ko 
617728,Th cho c xem mẫu silicon để c nhờ ng qua lấy nhé
617729,Cho c 2c mẫu này nhé 
617730,C thấy đánh số là cao su mà
617731,C thấy đánh số là bộ hình gấu pooh nhưng toàn là loại cao su
617732,Còn silicon thì có hình mickey thôi đúng ko e
617733,Mẫu này là silicon thì cho c m2 và m3
617734,Mà mình lấy 2c lẻ thôi
617735,2 chi c í
617736,Chứ ko phải 2 cặp 4chiec nhé
617737,Vậy m2
617738,Lát nữa có anh nói giọng ngọng đi ko vững lắm đ n thì bạn đưa cho a ấy loại này nhé
617739,170k đúng ko 
617740,Htai thì còn loại gì A ấy đi trên đg rồi 
617741,N u vậy khi hàng về b ship luôn ra bv hữu nghị Việt Xô cho mình trong ngày nay nhé
617742,Tên ng nhận là c Dung
617743,097 6202426
617744,Cả tiền ship là bnhiu b 
617745,Còn thanh chắn này ko shop
617746,Shop ib giá jup mình mấy đồ này nha 
617747,Ship cho mình 4 món này địu mầu hồng Dc 34 79 40 Dương quảng hàm cầu giấy 0982334849
617748,Bao giờ về những mẫu mình chọn bạn ui
617749, bạn ship cho mình địu màu xanh và hai đồ chơi
617750,Mình lấy lục lạc xanh lá
617751,Bao giờ bên bạn ship Đồ cho mình 
617752,Oki Bạn
617753,Báo giá cho mình đồ chơi này
617754,Báo giá xe tập đi cho mình
617755,Mình Bỏ không lấy địu nữa bạn nhé
617756,Lấy cho mình gh màu xanh bạn nhé 
617757,Mầu này còn ko bạn 
617758,Ủa Sao khác hãng mà thi t k giống nhau th bạn 
617759,Mình thấy mấy mầu trên link bạn bảo mình xem trông mầu sắc hơi sặc sỡ quá
617760,Mình thấy 2 mầu này ko ok lắm
617761,Thôi th bỏ qua cho mình gh nhún này Hôm nào có xe tập đi và đồ chơi cho bé bạn ship cho mình nha
617762,Sory bạn nha nhiệt tình trả lời mình mà mình ko lấy đc j cho bạn ngại quá 
617763,Hôm nào có xe tập đi bạn alo mình nha Còn mấy con lục lạc có bạn chuyển cho mình trước cũng được
617764,Oki Tks bạn
617765,Bạn ơi đã có xe tập đi chưa 
617766,Bạn có xe đẩy đi biển nào siêu gọn nhẹ ko bạn 
617767,Mấy con lục lạc này có ship luôn cho mình nhé 
617768,Mình lấy mẫu xe tập đi này bạn có hàng chưa 
617769, mẫu xe tập đi này mình ko thích bạn àh 
617770,Ship cho mình 1 con Đc 34 79 40 Dương Quảng Hàm Cầu Giấy DD 0982334849
617771,E oi cai nay con k ah
617772,Co shipcod k e
617773,Pai ck ha e
617774,Chuyen khoan ha e
617775,Vay so tai khoan la j vay k
617776,E oi cai nay con k
617777,E oi cai nay bao nhiu vay
617778,Co mau nay thoi ha shop
617779,E oi c vua ck tien cai ho boi voi kẹ do 
617780,Agibankak
617781,81 ấp 7 xã gia canh huyện định quán tỉnh đồng nai
617782,0967456771
617783,0967456772
617784,Het hag roi sao b k noi m luc dau ak 
617785,Jo pai ngoi doi toi tuan sau
617786,Ve nho gui m luon nha
617787,E oi c k lay ho boi dug cho no nua nha 
617788,Lay con voi nay nha e 
617789,Bu het bao nhiu nua vay
617790,Vay e coi dum c voi 
617791,Ok Mai e nho coi lai dum c nha 
617792,Dug roi e Vay doi cho c nha
617793,Bu them tien k e
617794,Vay c lay 2 thu nay nha
617795,Co do choi j tam 250k luon k e
617796,C lay luon e khoi ck
617797,Vay e lay balo may cho nha
617798,Con 39 k c ck cho
617799,C gui roi nha
617800,E gui hang cho c nha
617801,E gui hag cho c chua vay
617802,Dc roi E gui hag cho c di
617803,Mua tu bua jo ma jo con chua co nua
617804,Vay la 3 mon nay nha
617805,E gui lien di Chu c dat bua jo roi
617806,E oi gui hag cho c chua vay May bua roi sao k thay
617807,E oi xe day nay bao nhiu do
617808,Vay c chuyen khoan roi e gui hag pai k
617809,E oi c ck roi nha
617810,Lay mau xanh dam nay nha e
617811,E co phao boi ma deo vao tay be k
617812,Vay e lay cho c xe nay nha e
617813,Vay jo sao e
617814,Dot trc cug chuyen vay ma
617815,No luu san roi jo c nhan vao thoi ah
617816,Tai dot trc c cug ck vay ak
617817,Mai e coi dum c nha
617818,Co j e bao lai cho c nha
617819,E oi dug roi ak
617820,Vay ma bua jo cu tuog gui dc roi
617821,C moi chuyen khoan lai do nha
617822,Cái cũ la 1080 k voi cai moi gui la 2390
617823,Ne e 
617824,Gui cai xe day nha e
617825,Nho noi nha e
617826,K lai k gui dc nua do
617827,Vay e gui hag cho c nha
617828,Kiem tra hag giup c nha
617829,E co ban mieg lot vai ben trog xe day k
617830,Voi cai quat nho giog vay k e
617831,Kẹp vao xe cho mat
617832,E oi xe nay k hạ xuog dc nua ha
617833,Co 1 tu the vay thoi ha e
617834,E oi ghe nay bao nhieu vay
617835,Xe nay bao nhieu vay e
617836,Lay cho c cai ghe nay nha e
617837,Ok De c ck roi nt qua
617838,E oi lay c cai nay nha
617839,C ck roi e gui hag cho c nha
617840,Dug roi e
617841,Gui chua e
617842,Y la c noi e gui chua De c dat them do ak
617843,Cdat them cai nay
617844,E gui cug luc cho c dc k
617845,Cai nay ne e
617846,Vay e con mau j
617847,Gui hjh c xem voi e
617848,Mau do hogvay ha e
617849,Link e gui c thay mau den ma
617850,Jog vay ha
617851,Gia sao e
617852,Vay lay c xe do nha
617853,E oi c chuyen khoan roi ma quen k chup hih 
617854,E kiem tra dum c
617855,Gui hag cho c nha
617856,Ne e oi
617857,Xe nay ne e
617858,Cua c toi 3 thu ma chua thay cai nao
617859,E coi dum c
617860,Vay ma bua jo c goi hoi thi e bao gui luon roi
617861,Jo e gui lai cho c di Kiem tra dum c 3 thu voi 
617862,Con cai xe kja c gui tra ve cho
617863,Ok De c gui
617864,C lay cai ce nay nha 
617865,E nho gui 3 cai kja cho c nha 
617866,Kiem tra roi gui di dum c voi 
617867,E oi cho c hoi
617868,Ghe nay ne
617869,Thay trong huong dan co màn che
617870,Ma trog thung thi k co
617871,Ok Cam on e nha
617872,Xe đẩy vovo khung bạc với khung trắng là như th nào vậy
617873,Chất lượng th nào
617874,Đẹp hơn à
617875,Bạn có ảnh khung bạc ko
617876,Mjnhf thấy toàn khung trắng
617877,Ship mình 1 cái xanh nhạt nhé
617878,Nhà ct1 chung cư ngõ hòa bình 6 minh khai
617879,0988114814
617880,Cho mình 2 chiều màu xanh nhé
617881,Có bán lẻ gối ôm comfort baby ko ah
617882,Gối chặn b
617883,Bán cả bộ hay như nào ạp
617884,Báo giá m cái này nhe
617885,Còn màu khác k b
617886,Tại bé nhà m bé trai màu này girl quá
617887,Bên m có xe đẩy aprica karon k shop
617888,Qua xem trực ti p đc k b
617889,Minh chuyen ve roi thannh toan ko dc ha c
617890,Bạn này shop bán bao nhiêu s
617891,Bên mình hiện có chương trình sale k ạ
617892,Nhựa có bị đổi màu k shop
617893,Còn màu hồng không dhop
617894,Mình đọc địa chỉ cho b
617895,Đây m lấy bạn này nhé
617896,Bạn đọc địa chỉ mình chuyển tiền cho bạn
617897,Tổng là 1330k
617898,Gửi xe thì ra đâu lấy bạn
617899,Bạn ơi kiểm tra rồi gửi cho mình nhé
617900,Sđt 0987040497
617901,Sản phẩm này bao giờ shop sale thì phần m nhé
617902,Vâng em mua combo mấy thứ giống trong hình luôn
617903,Vậy em này bao nhiêu hả s
617904,Bạn kiểm tra cẩn thận lại nhé mình chuyển thành công rồi nhé
617905,Ngày và giờ ghi trên tn h t rồi nhé
617906,Mình k quen xe khách nào 
617907,C gửi ở b n hay ntn để em hỏi
617908,Chị gửi về đập phúc hoặc hoà mạc c ah
617909,C chạy ra b n gửi cho em nhé
617910,0975617637
617911,B n giáp bát c ah 
617912,2h30 là quay về em
617913,0984009425
617914,Không số này chạy về mình muộn hơn shop xem có gửi giúp mình luôn đk k nhé
617915,Shop gửi cho m chưa ah
617916,Sao em k thấy xe nào gọi em ra nhận
617917,Cho m lấy b này
617918,C còn bạn này k
617919,Bạn gửi xe cho mình đk k
617920,Vẫn nhà xe cũ b
617921,Lần trước m cũng chuyển khoản h t
617922,Nhưng khi shop gửi đồ
617923,Lúc lấy m vẫn trả tiền Ship về
617924,Mai T2 c gọi xong c gửi giúp em nhé
617925,Quây không hả shop
617926,Có xích đu cầu trượt không
617927,Bộ như hình mình gửi size 1m5 *1m8
617928,Có cả cầu trượt xích đi
617929,Không lấy thảm XPE còn bao nhiêu em
617930,Trước m mua 1 tủ này bên mình
617931,Bên m giờ còn k ăn
617932,Giá hiện tại bên mình bao nhiêu shop
617933,Có sale k bạn
617934,Cho em lấy cái này
617935,0975617637 số nhà xe chị ơi
617936,Lần trước shop gửi xe này cho em 1 lần rồi đấy
617937,Shop sale thêm cho em nữa đk k ah
617938,Shop sale thêm cho em t nữa đk k ah
617939,Shop gửi nhớ điện cho m m còn ra nhận
617940,Nguyễn thu Hà trung tâm điều dưỡng thương binh yên nam duy tiên Hà nam
617941,Sđt 0987040498
617942,0987040498
617943,Số này b nhé
617944,Số lần trước sai đuôi nhà xe k gọi đk cho em k
617945,Gửi chưa b
617946,Để m sắp x p ra đón
617947,Shop bảo nay gửi đồ
617948,Shop gửi chưa m còn nhận
617949,Em muốn tìm hiểu sp ngậm cho trẻ bé
617950,M lấy 2 bạn này
617951,Cho m xin đường lick của bạn thứ 2
617952,M k tìm thấy đk trong shoppe
617953,Giá đai 1xx mấy vậy c
617954,Ship qua shoppe giá rẻ hơn k ạ
617955,Ship bn nũa ạ
617956,Cho e 1 đai màu xanh ship về 809 Nguyễn Lương Bằng Đà nẵng
617957,Dạ cảm ơn sh
617958,Xe đẩy combi còn ko b 
617959,Có bán cầu tuột ko ko b
617960,Này còn ko b 
617961,Gửi mình nha b
617962,Tây ninh ak
617963,Cái này có bán riêng xich đu ko b 
617964,Minh ko thấy sp này trong shopee b ơi
617965,B gửi mình số tk nhé
617966,Ck rồi b nha
617967,Cai này còn ko
617968,Code xe được ko b 
617969,Nguyễn Văn Cần CH Hồng Niêng 0902700558 139 đường 785 ấp Thạnh Hoà xã Thạnh Đông huyện Tân Châu tĩnh Tây Ninh
617970,Gửi chung với cai vô lăng nha b
617971,Gửi chưa b ơi
617972,Shop báo giá cho mình 2 mẫu này
617973,Shop ơi mình còn đặt thêm gh ngồi ăn bệt xí cả bộ cầu trượt thì giá ntn Có giảm thêm ko 
617974,Cái cũi đấy nó có đệm ga luôn ko b Hay phải mua riêng
617975,Cả màn luôn hả b 
617976,Mình chọn thêm gh và bệt xí xog bên bạn ship nhé
617977,Đồ chơi của trẻ dưới 1 tuổi bên bạn có sẵn cái gì 
617978,Mình lấy sẵn
617979,Có cái quây vòng lại cho trẻ ngồi chơi k bạn
617980,Cầu trượt thì bgio lại về 
617981,Chậu tắm mình k thấy có nhỉ
617982,Teknum là cái cuối cùng mình gửi đúng ko
617983,Ship cho mình đ n số nhà 47 ngõ 210 Đội Cấn gồm bô thảm chơi gh ăn và cũi nhé
617984,Có người lắp đồ vào cho mình đúng ko 
617985,Sdt 0913855515 trưa mình mới có nhà nên bên bạn ship cho mình vào 12h nhé
617986,Check đungs hàng cho mình nhé
617987,Ơ sao bên cậu sáng báo có sẵn
617988,Cũi tuần sau thì bgio có cậu
617989,Ngày chính xác ấy
617990,Gh ăn này cơ
617991,Tối nay tầm 7h ship cho tớ bô gh ăn và thảm chơi đc ko 
617992,Oki cậu đúng 7h tối cho t nhé
617993,Uh t đây
617994,Bên mình có thảm chơi cho bé mà rộng 1m5 trở lên ko
617995,Có ship đx luôn cho t ko 
617996,Ship cho t qua sảnh vimec timecity với
617997,Ship luon cho tớ sdt là 0981345690
617998,Tối muộn là mấy h cậu
617999,T lấy con voi
618000,Uh 8h cố gắng cho t nhé
618001,Cho t luôn tối nay đi
618002,Vì t cần gấp
618003,K tớ lại phải gọi chỗ khác
618004,Đ n gọi t nhé
618005,Gối này còn ko shop 
618006,Loạinafy có còn k b 
618007,Vậy mai b ship giúp mình ra sảnh R1B Royal city b nhé Ship giúp mình buổi sáng thì ở số 5 điện biên phủ nhé
618008,Sdt 0981345690
618009,N u buổi chiều ship giúp mình ra sảnh R1B sau 4h chiều và 6h30 nhé
618010,Bên bạn ship đc mấy h cho mình nhỉ
618011,Trc khi đi gọi mình trc vì t nữa mình k ở điện biên phủ nữa
618012,Hnay có nhận ship ko nhỉ 
618013,Bộ bàn gh cho bé là bnhieu b 
618014,Ô sao mình xem trên fb là giá 8xx
618015,Hnay bên bạn có ship ko 
618016,Th tầm mấy h ship đx cho mình để mình nhắn địa chỉ chính xác sơ mình chạy đi chạy lại
618017,Be là cái màu vàng hả b 
618018,Cho mình ảnh với
618019,Th để mai mình nhắn địa chỉ b ship nhé tối mình sợ đi lung tung k nhận đc
618020,To quá b ạ cho mình xin thông tin của quây ko và bộ cầu trượt lẻ nhé
618021,Cho mình xin giá bộ này nhé
618022,Chiều ship giudp mình bộ này đc ko
618023,Còn bộ vàng đúng k b 
618024,Mai ship giúp mình ra sảnh R1B Royalcity nhé sdt 0981345690
618025,Trc khi ship gọi xem mình có nhà k nhé Mình sợ mai có việc
618026,Xog cho mình stk nhé
618027,Chuyển xog mingf chụp màn hình
618028,B cứ cho ship rồi minhf trả tiền mặt nhé
618029,Tk mình đang lỗi k thanh toán đc
618030,Shop ơi báo giá cho em thanh chắn cầu thang vs ạ
618031,dạ thanh chặn cầu thang có săn hok shop
618032,của 82cm vừa hok ạ
618033,shop có shoppe hok ạ
618034,để em vào đặt hàng ạ
618035,shop có bán thanh nối chắn cửa hok ạ
618036,lều bao nhiêu ạ
618037,Mình 2 bộ 5 món
618038,Minh trên sân bay nội bài
618039,nhà mình h t hàng xe đáp 3 bánh của EDGAR BABY rồi à mình muốn lấy xe màu đỏ bánh cao su
618040,th sắp tới ko có hàng về à 
618041,mình muốn lấy loại 1 450 ấy
618042,th mình đặt cái màu đỏ nhé
618043,à 1 550
618044,bánh cao su
618045,màu đỏ bánh cao su ấy 1 550k ấy
618046,màu đỏ bánh cao su ấy 1 550k ấy nhà mình có xe đạp 3 bánh chưa nhỉ
618047,À xe đẩy kiêm xe đapj ấy
618048,Loại 1550k mà
618049,Th có những màu gì nhỉ 
618050,Mình muốn lấy bánh cao su ko lấy bánh đúc
618051,N u ko bh hàng về 
618052,Bao h có hàng ti p vậy 
618053,Mẫu mới có bánh cao su ko shop 
618054,Nhưng sợ nó ko êm ko shop 
618055,Đi bánh cao su thì êm ái hơn bé đỡ bị xóc ấy ạ
618056,Vậy hàng mới thì bao h về ạ 
618057,Th hàng về gửi ảnh mình xem
618058,có hàng chưa shop ơi
618059,190k
618060,3 ngăn à bạn
618061,Xe này mình có màu hồng ko
618062,Mình có bảo hành gì ko shop
618063,Lấy cho mình 1 xe này mà màu hồng nha
618064,Đc 854 tạ quang bửu p6 q8 Chung cư giai việt lô B2 Sđt 0922226373
618065,Ủa vậy shop có bán xe đẩy cho mình hk
618066,Để mình bt mua chỗ khác
618067,Mình có vừa gọi điện đặt thảm silicon 1 4X 2m của Toyhouse
618068,Bạn nhờ ship chuyển hàng sớm giúp mình nhé
618069,Thông tin liên hệ
618070,Hằng 096 268 347 086 886 1347
